2025-05-14 21:05:09,574 - {'dataset': {'dataset': 'TACoS', 'feature_path': 'tacos_features_c3d.hdf5', 'vocab_size': 1734, 'word_dim': 300, 'frame_dim': 4096, 'max_num_words': 20, 'max_num_frames': 200, 'target_stride': 1, 'train_data': 'data/tacos/tacos_train.json', 'test_data': 'data/tacos/tacos_test.json', 'val_data': 'data/tacos/tacos_val.json', 'vocab_path': 'data/tacos/glove.pkl'}, 'train': {'optimizer': {'lr': 0.0004, 'weight_decay': 0, 'warmup_updates': 400, 'warmup_init_lr': 1e-07}, 'batch_size': 32, 'max_num_epochs': 30, 'model_saved_path': 'checkpoints/TACoS/8_2025-05-14_21-05-09'}, 'model': {'name': 'PCNet', 'config': {'frames_input_size': 4096, 'words_input_size': 300, 'hidden_size': 256, 'use_negative': True, 'num_props': 8, 'sigma': 9, 'sigma_neg': 9, 'gamma': 0.5, 'dropout': 0.1, 'DualTransformer': {'d_model': 256, 'num_heads': 8, 'num_decoder_layers1': 3, 'num_decoder_layers2': 3, 'dropout': 0.1}, 'num_iteration': 4}}, 'loss': {'margin_1': 0.1, 'margin_2': 0.15, 'cf_margin_1': 0.1, 'cf_margin_2': 0.15, 'lambda': 0.133, 'alpha_1': 1.5, 'alpha_2': 2.5, 'inter_lambda': 0.146, 'co_cl_loss': 0.2, 'co_qua_loss': 1.0}, 'vote': False, 'seed': 8}
2025-05-14 21:05:09,989 - train: 9790 samples, test: 4001 samples
2025-05-14 21:05:10,437 - Start Epoch 1
2025-05-14 21:05:37,085 - Epoch 1, Batch 50, lr = 0.00005, final_loss = 6.7413, nll_loss = 6.6975, ref_nll_loss = 6.7850, ivc_loss = 1.1836, neg_loss_1 = 0.0265, neg_loss_2 = 0.0488, ref_loss = 0.0379, intra_loss = 0.7444, div_loss = 0.1078, 0.533 seconds/batch
2025-05-14 21:05:58,744 - Epoch 1, Batch 100, lr = 0.00010, final_loss = 5.5326, nll_loss = 5.4705, ref_nll_loss = 5.5947, ivc_loss = 0.6181, neg_loss_1 = 0.0051, neg_loss_2 = 0.0225, ref_loss = 0.0227, intra_loss = 0.3713, div_loss = 0.0685, 0.483 seconds/batch
2025-05-14 21:06:16,277 - Epoch 1, Batch 150, lr = 0.00015, final_loss = 4.7781, nll_loss = 4.7142, ref_nll_loss = 4.8420, ivc_loss = 0.2202, neg_loss_1 = 0.0037, neg_loss_2 = 0.0145, ref_loss = 0.0217, intra_loss = 0.0486, div_loss = 0.0447, 0.439 seconds/batch
2025-05-14 21:06:34,584 - Epoch 1, Batch 200, lr = 0.00020, final_loss = 4.2883, nll_loss = 4.2241, ref_nll_loss = 4.3525, ivc_loss = 0.2386, neg_loss_1 = 0.0051, neg_loss_2 = 0.0177, ref_loss = 0.0236, intra_loss = 0.0482, div_loss = 0.0483, 0.421 seconds/batch
2025-05-14 21:06:53,844 - Epoch 1, Batch 250, lr = 0.00025, final_loss = 3.9768, nll_loss = 3.9095, ref_nll_loss = 4.0440, ivc_loss = 0.2310, neg_loss_1 = 0.0049, neg_loss_2 = 0.0157, ref_loss = 0.0259, intra_loss = 0.0688, div_loss = 0.0369, 0.414 seconds/batch
2025-05-14 21:07:11,375 - Epoch 1, Batch 300, lr = 0.00030, final_loss = 3.8283, nll_loss = 3.7601, ref_nll_loss = 3.8965, ivc_loss = 0.2268, neg_loss_1 = 0.0055, neg_loss_2 = 0.0183, ref_loss = 0.0271, intra_loss = 0.0588, div_loss = 0.0366, 0.403 seconds/batch
2025-05-14 21:07:12,384 - Epoch 1, Batch 306, lr = 0.00031, final_loss = 3.7126, nll_loss = 3.6397, ref_nll_loss = 3.7855, ivc_loss = 0.1367, neg_loss_1 = 0.0032, neg_loss_2 = 0.0128, ref_loss = 0.0212, intra_loss = 0.0219, div_loss = 0.0236, 0.399 seconds/batch
2025-05-14 21:07:12,393 - merge_alpha: 0.04068111255764961, range_width: 0.22010265290737152
2025-05-14 21:08:30,322 - | R@1,mIoU 0.0854 | R@1,IoU@0.1 0.2567 | R@1,IoU@0.3 0.0975 | R@1,IoU@0.5 0.0362 | R@1,IoU@0.7 0.0117 | R@1,IoU@0.9 0.0030 | R@5,mIoU 0.1959 | R@5,IoU@0.1 0.5661 | R@5,IoU@0.3 0.2174 | R@5,IoU@0.5 0.0977 | R@5,IoU@0.7 0.0467 | R@5,IoU@0.9 0.0062 |
2025-05-14 21:08:30,352 - save model to checkpoints/TACoS/8_2025-05-14_21-05-09/model-best.pt, num_updates 306.
2025-05-14 21:08:30,352 - Best results have been updated.
2025-05-14 21:08:30,352 - ============================================================
2025-05-14 21:08:30,352 - Start Epoch 2
2025-05-14 21:08:55,718 - Epoch 2, Batch 50, lr = 0.00036, final_loss = 3.6974, nll_loss = 3.6225, ref_nll_loss = 3.7722, ivc_loss = 0.1711, neg_loss_1 = 0.0041, neg_loss_2 = 0.0194, ref_loss = 0.0239, intra_loss = 0.0300, div_loss = 0.0280, 0.507 seconds/batch
2025-05-14 21:09:16,958 - Epoch 2, Batch 100, lr = 0.00040, final_loss = 3.6140, nll_loss = 3.5339, ref_nll_loss = 3.6941, ivc_loss = 0.1671, neg_loss_1 = 0.0048, neg_loss_2 = 0.0129, ref_loss = 0.0199, intra_loss = 0.0551, div_loss = 0.0223, 0.466 seconds/batch
2025-05-14 21:09:38,265 - Epoch 2, Batch 150, lr = 0.00037, final_loss = 3.5864, nll_loss = 3.5063, ref_nll_loss = 3.6665, ivc_loss = 0.1806, neg_loss_1 = 0.0042, neg_loss_2 = 0.0136, ref_loss = 0.0219, intra_loss = 0.0486, div_loss = 0.0290, 0.453 seconds/batch
2025-05-14 21:09:55,901 - Epoch 2, Batch 200, lr = 0.00036, final_loss = 3.4496, nll_loss = 3.3672, ref_nll_loss = 3.5320, ivc_loss = 0.1332, neg_loss_1 = 0.0029, neg_loss_2 = 0.0105, ref_loss = 0.0192, intra_loss = 0.0347, div_loss = 0.0198, 0.428 seconds/batch
2025-05-14 21:10:13,529 - Epoch 2, Batch 250, lr = 0.00034, final_loss = 3.4155, nll_loss = 3.3337, ref_nll_loss = 3.4973, ivc_loss = 0.1116, neg_loss_1 = 0.0036, neg_loss_2 = 0.0097, ref_loss = 0.0190, intra_loss = 0.0168, div_loss = 0.0185, 0.413 seconds/batch
2025-05-14 21:10:32,395 - Epoch 2, Batch 300, lr = 0.00032, final_loss = 3.4031, nll_loss = 3.3177, ref_nll_loss = 3.4884, ivc_loss = 0.1143, neg_loss_1 = 0.0022, neg_loss_2 = 0.0079, ref_loss = 0.0191, intra_loss = 0.0194, div_loss = 0.0205, 0.407 seconds/batch
2025-05-14 21:10:33,424 - Epoch 2, Batch 306, lr = 0.00032, final_loss = 3.4362, nll_loss = 3.3418, ref_nll_loss = 3.5305, ivc_loss = 0.1347, neg_loss_1 = 0.0025, neg_loss_2 = 0.0034, ref_loss = 0.0166, intra_loss = 0.0681, div_loss = 0.0131, 0.402 seconds/batch
2025-05-14 21:10:33,433 - merge_alpha: 0.10377507656812668, range_width: 0.2523977756500244
2025-05-14 21:11:49,678 - | R@1,mIoU 0.0867 | R@1,IoU@0.1 0.2777 | R@1,IoU@0.3 0.0892 | R@1,IoU@0.5 0.0307 | R@1,IoU@0.7 0.0075 | R@1,IoU@0.9 0.0005 | R@5,mIoU 0.2001 | R@5,IoU@0.1 0.5826 | R@5,IoU@0.3 0.2272 | R@5,IoU@0.5 0.1030 | R@5,IoU@0.7 0.0397 | R@5,IoU@0.9 0.0030 |
2025-05-14 21:11:49,904 - save model to checkpoints/TACoS/8_2025-05-14_21-05-09/model-best.pt, num_updates 612.
2025-05-14 21:11:49,905 - Best results have been updated.
2025-05-14 21:11:49,905 - ============================================================
2025-05-14 21:11:49,905 - Start Epoch 3
2025-05-14 21:12:16,669 - Epoch 3, Batch 50, lr = 0.00031, final_loss = 3.3257, nll_loss = 3.2407, ref_nll_loss = 3.4108, ivc_loss = 0.0808, neg_loss_1 = 0.0019, neg_loss_2 = 0.0079, ref_loss = 0.0157, intra_loss = 0.0119, div_loss = 0.0122, 0.535 seconds/batch
2025-05-14 21:12:36,431 - Epoch 3, Batch 100, lr = 0.00030, final_loss = 3.2989, nll_loss = 3.2097, ref_nll_loss = 3.3881, ivc_loss = 0.0780, neg_loss_1 = 0.0019, neg_loss_2 = 0.0074, ref_loss = 0.0164, intra_loss = 0.0057, div_loss = 0.0135, 0.465 seconds/batch
2025-05-14 21:12:56,675 - Epoch 3, Batch 150, lr = 0.00029, final_loss = 3.2088, nll_loss = 3.1199, ref_nll_loss = 3.2977, ivc_loss = 0.0736, neg_loss_1 = 0.0034, neg_loss_2 = 0.0060, ref_loss = 0.0166, intra_loss = 0.0053, div_loss = 0.0117, 0.445 seconds/batch
2025-05-14 21:13:16,365 - Epoch 3, Batch 200, lr = 0.00028, final_loss = 3.2091, nll_loss = 3.1195, ref_nll_loss = 3.2987, ivc_loss = 0.0869, neg_loss_1 = 0.0023, neg_loss_2 = 0.0069, ref_loss = 0.0183, intra_loss = 0.0058, div_loss = 0.0159, 0.432 seconds/batch
2025-05-14 21:13:33,633 - Epoch 3, Batch 250, lr = 0.00027, final_loss = 3.1524, nll_loss = 3.0602, ref_nll_loss = 3.2446, ivc_loss = 0.0609, neg_loss_1 = 0.0019, neg_loss_2 = 0.0080, ref_loss = 0.0157, intra_loss = 0.0002, div_loss = 0.0089, 0.415 seconds/batch
2025-05-14 21:13:49,486 - Epoch 3, Batch 300, lr = 0.00026, final_loss = 3.1780, nll_loss = 3.0864, ref_nll_loss = 3.2696, ivc_loss = 0.0570, neg_loss_1 = 0.0027, neg_loss_2 = 0.0060, ref_loss = 0.0182, intra_loss = 0.0025, div_loss = 0.0057, 0.399 seconds/batch
2025-05-14 21:13:51,772 - Epoch 3, Batch 306, lr = 0.00026, final_loss = 3.0704, nll_loss = 2.9666, ref_nll_loss = 3.1743, ivc_loss = 0.0478, neg_loss_1 = 0.0019, neg_loss_2 = 0.0034, ref_loss = 0.0167, intra_loss = 0.0000, div_loss = 0.0059, 0.398 seconds/batch
2025-05-14 21:13:51,781 - merge_alpha: 0.11484143882989883, range_width: 0.2671424448490143
2025-05-14 21:15:10,596 - | R@1,mIoU 0.0853 | R@1,IoU@0.1 0.2702 | R@1,IoU@0.3 0.0925 | R@1,IoU@0.5 0.0312 | R@1,IoU@0.7 0.0080 | R@1,IoU@0.9 0.0002 | R@5,mIoU 0.1992 | R@5,IoU@0.1 0.5674 | R@5,IoU@0.3 0.2179 | R@5,IoU@0.5 0.1060 | R@5,IoU@0.7 0.0415 | R@5,IoU@0.9 0.0067 |
2025-05-14 21:15:10,599 - ============================================================
2025-05-14 21:15:10,599 - Start Epoch 4
2025-05-14 21:15:37,042 - Epoch 4, Batch 50, lr = 0.00026, final_loss = 3.1181, nll_loss = 3.0260, ref_nll_loss = 3.2103, ivc_loss = 0.0728, neg_loss_1 = 0.0023, neg_loss_2 = 0.0078, ref_loss = 0.0162, intra_loss = 0.0090, div_loss = 0.0098, 0.529 seconds/batch
2025-05-14 21:15:56,198 - Epoch 4, Batch 100, lr = 0.00025, final_loss = 3.0929, nll_loss = 3.0006, ref_nll_loss = 3.1851, ivc_loss = 0.0508, neg_loss_1 = 0.0014, neg_loss_2 = 0.0052, ref_loss = 0.0154, intra_loss = 0.0030, div_loss = 0.0059, 0.456 seconds/batch
2025-05-14 21:16:16,969 - Epoch 4, Batch 150, lr = 0.00024, final_loss = 3.1187, nll_loss = 3.0218, ref_nll_loss = 3.2156, ivc_loss = 0.0527, neg_loss_1 = 0.0010, neg_loss_2 = 0.0045, ref_loss = 0.0158, intra_loss = 0.0022, div_loss = 0.0074, 0.442 seconds/batch
2025-05-14 21:16:38,085 - Epoch 4, Batch 200, lr = 0.00024, final_loss = 3.0192, nll_loss = 2.9210, ref_nll_loss = 3.1173, ivc_loss = 0.0463, neg_loss_1 = 0.0010, neg_loss_2 = 0.0040, ref_loss = 0.0149, intra_loss = 0.0030, div_loss = 0.0053, 0.437 seconds/batch
2025-05-14 21:16:56,132 - Epoch 4, Batch 250, lr = 0.00023, final_loss = 3.0497, nll_loss = 2.9470, ref_nll_loss = 3.1523, ivc_loss = 0.0487, neg_loss_1 = 0.0015, neg_loss_2 = 0.0042, ref_loss = 0.0137, intra_loss = 0.0001, div_loss = 0.0078, 0.422 seconds/batch
2025-05-14 21:17:11,709 - Epoch 4, Batch 300, lr = 0.00023, final_loss = 3.0149, nll_loss = 2.9171, ref_nll_loss = 3.1127, ivc_loss = 0.0560, neg_loss_1 = 0.0017, neg_loss_2 = 0.0046, ref_loss = 0.0147, intra_loss = 0.0090, div_loss = 0.0062, 0.404 seconds/batch
2025-05-14 21:17:12,745 - Epoch 4, Batch 306, lr = 0.00023, final_loss = 2.9960, nll_loss = 2.8939, ref_nll_loss = 3.0981, ivc_loss = 0.0501, neg_loss_1 = 0.0005, neg_loss_2 = 0.0048, ref_loss = 0.0118, intra_loss = 0.0003, div_loss = 0.0097, 0.399 seconds/batch
2025-05-14 21:17:12,755 - merge_alpha: 0.11380985379219055, range_width: 0.2717565596103668
2025-05-14 21:18:29,291 - | R@1,mIoU 0.0876 | R@1,IoU@0.1 0.2714 | R@1,IoU@0.3 0.0955 | R@1,IoU@0.5 0.0342 | R@1,IoU@0.7 0.0095 | R@1,IoU@0.9 0.0010 | R@5,mIoU 0.1945 | R@5,IoU@0.1 0.5579 | R@5,IoU@0.3 0.2149 | R@5,IoU@0.5 0.1035 | R@5,IoU@0.7 0.0452 | R@5,IoU@0.9 0.0090 |
2025-05-14 21:18:29,518 - save model to checkpoints/TACoS/8_2025-05-14_21-05-09/model-best.pt, num_updates 1224.
2025-05-14 21:18:29,519 - Best results have been updated.
2025-05-14 21:18:29,519 - ============================================================
2025-05-14 21:18:29,519 - Start Epoch 5
2025-05-14 21:18:54,886 - Epoch 5, Batch 50, lr = 0.00022, final_loss = 2.9824, nll_loss = 2.8838, ref_nll_loss = 3.0810, ivc_loss = 0.0481, neg_loss_1 = 0.0008, neg_loss_2 = 0.0045, ref_loss = 0.0146, intra_loss = 0.0001, div_loss = 0.0073, 0.507 seconds/batch
2025-05-14 21:19:16,859 - Epoch 5, Batch 100, lr = 0.00022, final_loss = 2.9724, nll_loss = 2.8729, ref_nll_loss = 3.0720, ivc_loss = 0.0489, neg_loss_1 = 0.0012, neg_loss_2 = 0.0035, ref_loss = 0.0132, intra_loss = 0.0001, div_loss = 0.0088, 0.473 seconds/batch
2025-05-14 21:19:36,946 - Epoch 5, Batch 150, lr = 0.00022, final_loss = 2.9674, nll_loss = 2.8715, ref_nll_loss = 3.0633, ivc_loss = 0.0513, neg_loss_1 = 0.0022, neg_loss_2 = 0.0038, ref_loss = 0.0165, intra_loss = 0.0001, div_loss = 0.0069, 0.450 seconds/batch
2025-05-14 21:19:56,243 - Epoch 5, Batch 200, lr = 0.00021, final_loss = 2.9596, nll_loss = 2.8610, ref_nll_loss = 3.0582, ivc_loss = 0.0621, neg_loss_1 = 0.0018, neg_loss_2 = 0.0064, ref_loss = 0.0145, intra_loss = 0.0001, div_loss = 0.0112, 0.434 seconds/batch
2025-05-14 21:20:15,562 - Epoch 5, Batch 250, lr = 0.00021, final_loss = 2.9781, nll_loss = 2.8769, ref_nll_loss = 3.0793, ivc_loss = 0.0527, neg_loss_1 = 0.0017, neg_loss_2 = 0.0055, ref_loss = 0.0140, intra_loss = 0.0026, div_loss = 0.0074, 0.424 seconds/batch
2025-05-14 21:20:32,613 - Epoch 5, Batch 300, lr = 0.00020, final_loss = 2.9580, nll_loss = 2.8584, ref_nll_loss = 3.0577, ivc_loss = 0.0503, neg_loss_1 = 0.0020, neg_loss_2 = 0.0050, ref_loss = 0.0141, intra_loss = 0.0000, div_loss = 0.0074, 0.410 seconds/batch
2025-05-14 21:20:34,319 - Epoch 5, Batch 306, lr = 0.00020, final_loss = 2.9323, nll_loss = 2.8220, ref_nll_loss = 3.0425, ivc_loss = 0.0433, neg_loss_1 = 0.0012, neg_loss_2 = 0.0064, ref_loss = 0.0123, intra_loss = 0.0000, div_loss = 0.0054, 0.408 seconds/batch
2025-05-14 21:20:34,329 - merge_alpha: 0.11680330336093903, range_width: 0.2792142629623413
2025-05-14 21:21:52,740 - | R@1,mIoU 0.0898 | R@1,IoU@0.1 0.2949 | R@1,IoU@0.3 0.0920 | R@1,IoU@0.5 0.0267 | R@1,IoU@0.7 0.0077 | R@1,IoU@0.9 0.0002 | R@5,mIoU 0.1960 | R@5,IoU@0.1 0.5744 | R@5,IoU@0.3 0.2172 | R@5,IoU@0.5 0.0990 | R@5,IoU@0.7 0.0397 | R@5,IoU@0.9 0.0030 |
2025-05-14 21:21:52,990 - save model to checkpoints/TACoS/8_2025-05-14_21-05-09/model-best.pt, num_updates 1530.
2025-05-14 21:21:52,991 - Best results have been updated.
2025-05-14 21:21:52,991 - ============================================================
2025-05-14 21:21:52,991 - Start Epoch 6
2025-05-14 21:22:19,712 - Epoch 6, Batch 50, lr = 0.00020, final_loss = 2.8939, nll_loss = 2.7883, ref_nll_loss = 2.9995, ivc_loss = 0.0421, neg_loss_1 = 0.0015, neg_loss_2 = 0.0040, ref_loss = 0.0134, intra_loss = 0.0000, div_loss = 0.0055, 0.534 seconds/batch
2025-05-14 21:22:39,321 - Epoch 6, Batch 100, lr = 0.00020, final_loss = 2.8821, nll_loss = 2.7813, ref_nll_loss = 2.9830, ivc_loss = 0.0460, neg_loss_1 = 0.0016, neg_loss_2 = 0.0047, ref_loss = 0.0137, intra_loss = 0.0000, div_loss = 0.0063, 0.463 seconds/batch
2025-05-14 21:22:57,361 - Epoch 6, Batch 150, lr = 0.00020, final_loss = 2.9039, nll_loss = 2.7989, ref_nll_loss = 3.0088, ivc_loss = 0.0389, neg_loss_1 = 0.0016, neg_loss_2 = 0.0032, ref_loss = 0.0121, intra_loss = 0.0000, div_loss = 0.0054, 0.429 seconds/batch
2025-05-14 21:23:18,092 - Epoch 6, Batch 200, lr = 0.00019, final_loss = 2.9208, nll_loss = 2.8185, ref_nll_loss = 3.0231, ivc_loss = 0.0442, neg_loss_1 = 0.0018, neg_loss_2 = 0.0039, ref_loss = 0.0126, intra_loss = 0.0001, div_loss = 0.0067, 0.426 seconds/batch
2025-05-14 21:23:36,898 - Epoch 6, Batch 250, lr = 0.00019, final_loss = 2.9118, nll_loss = 2.8118, ref_nll_loss = 3.0117, ivc_loss = 0.0543, neg_loss_1 = 0.0018, neg_loss_2 = 0.0051, ref_loss = 0.0153, intra_loss = 0.0017, div_loss = 0.0078, 0.416 seconds/batch
2025-05-14 21:23:55,890 - Epoch 6, Batch 300, lr = 0.00019, final_loss = 2.8975, nll_loss = 2.7912, ref_nll_loss = 3.0038, ivc_loss = 0.0410, neg_loss_1 = 0.0012, neg_loss_2 = 0.0047, ref_loss = 0.0120, intra_loss = 0.0000, div_loss = 0.0056, 0.410 seconds/batch
2025-05-14 21:23:56,925 - Epoch 6, Batch 306, lr = 0.00019, final_loss = 2.8773, nll_loss = 2.7610, ref_nll_loss = 2.9935, ivc_loss = 0.0378, neg_loss_1 = 0.0000, neg_loss_2 = 0.0079, ref_loss = 0.0093, intra_loss = 0.0001, div_loss = 0.0047, 0.405 seconds/batch
2025-05-14 21:23:56,935 - merge_alpha: 0.11569814383983612, range_width: 0.2891852855682373
2025-05-14 21:25:11,830 - | R@1,mIoU 0.0859 | R@1,IoU@0.1 0.2752 | R@1,IoU@0.3 0.0897 | R@1,IoU@0.5 0.0282 | R@1,IoU@0.7 0.0090 | R@1,IoU@0.9 0.0005 | R@5,mIoU 0.1953 | R@5,IoU@0.1 0.5701 | R@5,IoU@0.3 0.2147 | R@5,IoU@0.5 0.0975 | R@5,IoU@0.7 0.0380 | R@5,IoU@0.9 0.0037 |
2025-05-14 21:25:11,832 - ============================================================
2025-05-14 21:25:11,832 - Start Epoch 7
2025-05-14 21:25:40,160 - Epoch 7, Batch 50, lr = 0.00018, final_loss = 2.8929, nll_loss = 2.7894, ref_nll_loss = 2.9965, ivc_loss = 0.0428, neg_loss_1 = 0.0010, neg_loss_2 = 0.0038, ref_loss = 0.0135, intra_loss = 0.0025, div_loss = 0.0051, 0.567 seconds/batch
2025-05-14 21:25:58,697 - Epoch 7, Batch 100, lr = 0.00018, final_loss = 2.8425, nll_loss = 2.7389, ref_nll_loss = 2.9461, ivc_loss = 0.0471, neg_loss_1 = 0.0015, neg_loss_2 = 0.0047, ref_loss = 0.0136, intra_loss = 0.0000, div_loss = 0.0069, 0.469 seconds/batch
2025-05-14 21:26:17,827 - Epoch 7, Batch 150, lr = 0.00018, final_loss = 2.8619, nll_loss = 2.7551, ref_nll_loss = 2.9686, ivc_loss = 0.0439, neg_loss_1 = 0.0020, neg_loss_2 = 0.0047, ref_loss = 0.0115, intra_loss = 0.0019, div_loss = 0.0058, 0.440 seconds/batch
2025-05-14 21:26:36,147 - Epoch 7, Batch 200, lr = 0.00018, final_loss = 2.8150, nll_loss = 2.7102, ref_nll_loss = 2.9198, ivc_loss = 0.0535, neg_loss_1 = 0.0027, neg_loss_2 = 0.0037, ref_loss = 0.0144, intra_loss = 0.0000, div_loss = 0.0089, 0.422 seconds/batch
2025-05-14 21:26:54,998 - Epoch 7, Batch 250, lr = 0.00018, final_loss = 2.8389, nll_loss = 2.7374, ref_nll_loss = 2.9403, ivc_loss = 0.0503, neg_loss_1 = 0.0022, neg_loss_2 = 0.0048, ref_loss = 0.0138, intra_loss = 0.0001, div_loss = 0.0076, 0.413 seconds/batch
2025-05-14 21:27:11,756 - Epoch 7, Batch 300, lr = 0.00017, final_loss = 2.8523, nll_loss = 2.7487, ref_nll_loss = 2.9560, ivc_loss = 0.0419, neg_loss_1 = 0.0011, neg_loss_2 = 0.0056, ref_loss = 0.0116, intra_loss = 0.0000, div_loss = 0.0058, 0.400 seconds/batch
2025-05-14 21:27:12,778 - Epoch 7, Batch 306, lr = 0.00017, final_loss = 2.9715, nll_loss = 2.8678, ref_nll_loss = 3.0751, ivc_loss = 0.0391, neg_loss_1 = 0.0010, neg_loss_2 = 0.0030, ref_loss = 0.0137, intra_loss = 0.0000, div_loss = 0.0050, 0.395 seconds/batch
2025-05-14 21:27:12,788 - merge_alpha: 0.11729121953248978, range_width: 0.30337849259376526
2025-05-14 21:28:28,752 - | R@1,mIoU 0.0908 | R@1,IoU@0.1 0.2842 | R@1,IoU@0.3 0.0935 | R@1,IoU@0.5 0.0322 | R@1,IoU@0.7 0.0102 | R@1,IoU@0.9 0.0007 | R@5,mIoU 0.1987 | R@5,IoU@0.1 0.5729 | R@5,IoU@0.3 0.2142 | R@5,IoU@0.5 0.1032 | R@5,IoU@0.7 0.0420 | R@5,IoU@0.9 0.0027 |
2025-05-14 21:28:29,011 - save model to checkpoints/TACoS/8_2025-05-14_21-05-09/model-best.pt, num_updates 2142.
2025-05-14 21:28:29,011 - Best results have been updated.
2025-05-14 21:28:29,011 - ============================================================
2025-05-14 21:28:29,012 - Start Epoch 8
2025-05-14 21:28:55,481 - Epoch 8, Batch 50, lr = 0.00017, final_loss = 2.8173, nll_loss = 2.7072, ref_nll_loss = 2.9274, ivc_loss = 0.0412, neg_loss_1 = 0.0013, neg_loss_2 = 0.0052, ref_loss = 0.0117, intra_loss = 0.0000, div_loss = 0.0056, 0.529 seconds/batch
2025-05-14 21:29:14,875 - Epoch 8, Batch 100, lr = 0.00017, final_loss = 2.7942, nll_loss = 2.6845, ref_nll_loss = 2.9039, ivc_loss = 0.0376, neg_loss_1 = 0.0009, neg_loss_2 = 0.0036, ref_loss = 0.0099, intra_loss = 0.0000, div_loss = 0.0064, 0.459 seconds/batch
2025-05-14 21:29:32,078 - Epoch 8, Batch 150, lr = 0.00017, final_loss = 2.8112, nll_loss = 2.7059, ref_nll_loss = 2.9166, ivc_loss = 0.0426, neg_loss_1 = 0.0020, neg_loss_2 = 0.0044, ref_loss = 0.0121, intra_loss = 0.0000, div_loss = 0.0059, 0.420 seconds/batch
2025-05-14 21:29:53,119 - Epoch 8, Batch 200, lr = 0.00017, final_loss = 2.7734, nll_loss = 2.6634, ref_nll_loss = 2.8833, ivc_loss = 0.0425, neg_loss_1 = 0.0015, neg_loss_2 = 0.0051, ref_loss = 0.0123, intra_loss = 0.0000, div_loss = 0.0057, 0.421 seconds/batch
2025-05-14 21:30:12,456 - Epoch 8, Batch 250, lr = 0.00016, final_loss = 2.8436, nll_loss = 2.7328, ref_nll_loss = 2.9544, ivc_loss = 0.0375, neg_loss_1 = 0.0016, neg_loss_2 = 0.0029, ref_loss = 0.0103, intra_loss = 0.0000, div_loss = 0.0061, 0.414 seconds/batch
2025-05-14 21:30:30,358 - Epoch 8, Batch 300, lr = 0.00016, final_loss = 2.8406, nll_loss = 2.7349, ref_nll_loss = 2.9463, ivc_loss = 0.0444, neg_loss_1 = 0.0024, neg_loss_2 = 0.0040, ref_loss = 0.0120, intra_loss = 0.0000, div_loss = 0.0067, 0.404 seconds/batch
2025-05-14 21:30:32,350 - Epoch 8, Batch 306, lr = 0.00016, final_loss = 2.8461, nll_loss = 2.7365, ref_nll_loss = 2.9556, ivc_loss = 0.0707, neg_loss_1 = 0.0006, neg_loss_2 = 0.0039, ref_loss = 0.0130, intra_loss = 0.0299, div_loss = 0.0059, 0.403 seconds/batch
2025-05-14 21:30:32,360 - merge_alpha: 0.11713682860136032, range_width: 0.3079180419445038
2025-05-14 21:31:49,786 - | R@1,mIoU 0.0851 | R@1,IoU@0.1 0.2732 | R@1,IoU@0.3 0.0890 | R@1,IoU@0.5 0.0282 | R@1,IoU@0.7 0.0087 | R@1,IoU@0.9 0.0007 | R@5,mIoU 0.1954 | R@5,IoU@0.1 0.5724 | R@5,IoU@0.3 0.2092 | R@5,IoU@0.5 0.0975 | R@5,IoU@0.7 0.0427 | R@5,IoU@0.9 0.0045 |
2025-05-14 21:31:49,788 - ============================================================
2025-05-14 21:31:49,789 - Start Epoch 9
2025-05-14 21:32:16,911 - Epoch 9, Batch 50, lr = 0.00016, final_loss = 2.8040, nll_loss = 2.6978, ref_nll_loss = 2.9103, ivc_loss = 0.0390, neg_loss_1 = 0.0022, neg_loss_2 = 0.0035, ref_loss = 0.0117, intra_loss = 0.0000, div_loss = 0.0052, 0.542 seconds/batch
2025-05-14 21:32:36,577 - Epoch 9, Batch 100, lr = 0.00016, final_loss = 2.7913, nll_loss = 2.6843, ref_nll_loss = 2.8984, ivc_loss = 0.0425, neg_loss_1 = 0.0018, neg_loss_2 = 0.0049, ref_loss = 0.0124, intra_loss = 0.0000, div_loss = 0.0055, 0.468 seconds/batch
2025-05-14 21:32:55,905 - Epoch 9, Batch 150, lr = 0.00016, final_loss = 2.7949, nll_loss = 2.6896, ref_nll_loss = 2.9002, ivc_loss = 0.0419, neg_loss_1 = 0.0020, neg_loss_2 = 0.0050, ref_loss = 0.0129, intra_loss = 0.0000, div_loss = 0.0048, 0.441 seconds/batch
2025-05-14 21:33:15,686 - Epoch 9, Batch 200, lr = 0.00016, final_loss = 2.7690, nll_loss = 2.6589, ref_nll_loss = 2.8791, ivc_loss = 0.0394, neg_loss_1 = 0.0004, neg_loss_2 = 0.0037, ref_loss = 0.0113, intra_loss = 0.0013, div_loss = 0.0060, 0.429 seconds/batch
2025-05-14 21:33:37,922 - Epoch 9, Batch 250, lr = 0.00015, final_loss = 2.7582, nll_loss = 2.6473, ref_nll_loss = 2.8691, ivc_loss = 0.0455, neg_loss_1 = 0.0015, neg_loss_2 = 0.0027, ref_loss = 0.0121, intra_loss = 0.0040, div_loss = 0.0069, 0.433 seconds/batch
2025-05-14 21:33:52,083 - Epoch 9, Batch 300, lr = 0.00015, final_loss = 2.7380, nll_loss = 2.6261, ref_nll_loss = 2.8499, ivc_loss = 0.0504, neg_loss_1 = 0.0017, neg_loss_2 = 0.0043, ref_loss = 0.0127, intra_loss = 0.0000, div_loss = 0.0089, 0.408 seconds/batch
2025-05-14 21:33:53,119 - Epoch 9, Batch 306, lr = 0.00015, final_loss = 2.7343, nll_loss = 2.6222, ref_nll_loss = 2.8464, ivc_loss = 0.0495, neg_loss_1 = 0.0020, neg_loss_2 = 0.0034, ref_loss = 0.0126, intra_loss = 0.0000, div_loss = 0.0090, 0.403 seconds/batch
2025-05-14 21:33:53,128 - merge_alpha: 0.11807963252067566, range_width: 0.319817453622818
2025-05-14 21:35:09,841 - | R@1,mIoU 0.0910 | R@1,IoU@0.1 0.2874 | R@1,IoU@0.3 0.0960 | R@1,IoU@0.5 0.0305 | R@1,IoU@0.7 0.0107 | R@1,IoU@0.9 0.0020 | R@5,mIoU 0.1978 | R@5,IoU@0.1 0.5811 | R@5,IoU@0.3 0.2117 | R@5,IoU@0.5 0.1002 | R@5,IoU@0.7 0.0417 | R@5,IoU@0.9 0.0052 |
2025-05-14 21:35:10,008 - save model to checkpoints/TACoS/8_2025-05-14_21-05-09/model-best.pt, num_updates 2754.
2025-05-14 21:35:10,009 - Best results have been updated.
2025-05-14 21:35:10,009 - ============================================================
2025-05-14 21:35:10,009 - Start Epoch 10
2025-05-14 21:35:36,225 - Epoch 10, Batch 50, lr = 0.00015, final_loss = 2.7303, nll_loss = 2.6174, ref_nll_loss = 2.8432, ivc_loss = 0.0456, neg_loss_1 = 0.0021, neg_loss_2 = 0.0037, ref_loss = 0.0109, intra_loss = 0.0000, div_loss = 0.0082, 0.524 seconds/batch
2025-05-14 21:35:55,328 - Epoch 10, Batch 100, lr = 0.00015, final_loss = 2.7460, nll_loss = 2.6314, ref_nll_loss = 2.8605, ivc_loss = 0.0420, neg_loss_1 = 0.0012, neg_loss_2 = 0.0048, ref_loss = 0.0101, intra_loss = 0.0000, div_loss = 0.0071, 0.453 seconds/batch
2025-05-14 21:36:16,039 - Epoch 10, Batch 150, lr = 0.00015, final_loss = 2.7612, nll_loss = 2.6476, ref_nll_loss = 2.8748, ivc_loss = 0.0472, neg_loss_1 = 0.0022, neg_loss_2 = 0.0046, ref_loss = 0.0106, intra_loss = 0.0000, div_loss = 0.0084, 0.440 seconds/batch
2025-05-14 21:36:37,568 - Epoch 10, Batch 200, lr = 0.00015, final_loss = 2.7094, nll_loss = 2.5979, ref_nll_loss = 2.8208, ivc_loss = 0.0437, neg_loss_1 = 0.0020, neg_loss_2 = 0.0045, ref_loss = 0.0108, intra_loss = 0.0024, div_loss = 0.0061, 0.438 seconds/batch
2025-05-14 21:36:54,552 - Epoch 10, Batch 250, lr = 0.00015, final_loss = 2.7535, nll_loss = 2.6437, ref_nll_loss = 2.8634, ivc_loss = 0.0466, neg_loss_1 = 0.0009, neg_loss_2 = 0.0054, ref_loss = 0.0117, intra_loss = 0.0000, div_loss = 0.0078, 0.418 seconds/batch
2025-05-14 21:37:10,776 - Epoch 10, Batch 300, lr = 0.00014, final_loss = 2.7552, nll_loss = 2.6446, ref_nll_loss = 2.8659, ivc_loss = 0.0402, neg_loss_1 = 0.0022, neg_loss_2 = 0.0033, ref_loss = 0.0112, intra_loss = 0.0000, div_loss = 0.0061, 0.403 seconds/batch
2025-05-14 21:37:11,823 - Epoch 10, Batch 306, lr = 0.00014, final_loss = 2.6658, nll_loss = 2.5370, ref_nll_loss = 2.7946, ivc_loss = 0.0341, neg_loss_1 = 0.0005, neg_loss_2 = 0.0043, ref_loss = 0.0074, intra_loss = 0.0000, div_loss = 0.0063, 0.398 seconds/batch
2025-05-14 21:37:11,832 - merge_alpha: 0.11888644099235535, range_width: 0.335194855928421
2025-05-14 21:38:27,790 - | R@1,mIoU 0.0920 | R@1,IoU@0.1 0.2902 | R@1,IoU@0.3 0.0982 | R@1,IoU@0.5 0.0337 | R@1,IoU@0.7 0.0105 | R@1,IoU@0.9 0.0010 | R@5,mIoU 0.1957 | R@5,IoU@0.1 0.5731 | R@5,IoU@0.3 0.2124 | R@5,IoU@0.5 0.1032 | R@5,IoU@0.7 0.0412 | R@5,IoU@0.9 0.0032 |
2025-05-14 21:38:27,928 - save model to checkpoints/TACoS/8_2025-05-14_21-05-09/model-best.pt, num_updates 3060.
2025-05-14 21:38:27,928 - Best results have been updated.
2025-05-14 21:38:27,929 - ============================================================
2025-05-14 21:38:27,929 - Start Epoch 11
2025-05-14 21:38:56,284 - Epoch 11, Batch 50, lr = 0.00014, final_loss = 2.7271, nll_loss = 2.6176, ref_nll_loss = 2.8367, ivc_loss = 0.0475, neg_loss_1 = 0.0018, neg_loss_2 = 0.0052, ref_loss = 0.0126, intra_loss = 0.0000, div_loss = 0.0072, 0.567 seconds/batch
2025-05-14 21:39:14,696 - Epoch 11, Batch 100, lr = 0.00014, final_loss = 2.7175, nll_loss = 2.6065, ref_nll_loss = 2.8285, ivc_loss = 0.0415, neg_loss_1 = 0.0016, neg_loss_2 = 0.0039, ref_loss = 0.0120, intra_loss = 0.0000, div_loss = 0.0060, 0.468 seconds/batch
2025-05-14 21:39:33,232 - Epoch 11, Batch 150, lr = 0.00014, final_loss = 2.7164, nll_loss = 2.6030, ref_nll_loss = 2.8298, ivc_loss = 0.0396, neg_loss_1 = 0.0022, neg_loss_2 = 0.0034, ref_loss = 0.0106, intra_loss = 0.0000, div_loss = 0.0061, 0.435 seconds/batch
2025-05-14 21:39:53,591 - Epoch 11, Batch 200, lr = 0.00014, final_loss = 2.7021, nll_loss = 2.5873, ref_nll_loss = 2.8170, ivc_loss = 0.0400, neg_loss_1 = 0.0020, neg_loss_2 = 0.0032, ref_loss = 0.0108, intra_loss = 0.0000, div_loss = 0.0063, 0.428 seconds/batch
2025-05-14 21:40:11,305 - Epoch 11, Batch 250, lr = 0.00014, final_loss = 2.7166, nll_loss = 2.6059, ref_nll_loss = 2.8273, ivc_loss = 0.0603, neg_loss_1 = 0.0010, neg_loss_2 = 0.0063, ref_loss = 0.0126, intra_loss = 0.0000, div_loss = 0.0122, 0.414 seconds/batch
2025-05-14 21:40:29,807 - Epoch 11, Batch 300, lr = 0.00014, final_loss = 2.7369, nll_loss = 2.6222, ref_nll_loss = 2.8515, ivc_loss = 0.0435, neg_loss_1 = 0.0021, neg_loss_2 = 0.0042, ref_loss = 0.0111, intra_loss = 0.0027, div_loss = 0.0058, 0.406 seconds/batch
2025-05-14 21:40:30,853 - Epoch 11, Batch 306, lr = 0.00014, final_loss = 2.7176, nll_loss = 2.5955, ref_nll_loss = 2.8397, ivc_loss = 0.0271, neg_loss_1 = 0.0010, neg_loss_2 = 0.0026, ref_loss = 0.0067, intra_loss = 0.0000, div_loss = 0.0047, 0.402 seconds/batch
2025-05-14 21:40:30,863 - merge_alpha: 0.1192508339881897, range_width: 0.3488296568393707
2025-05-14 21:41:46,404 - | R@1,mIoU 0.0885 | R@1,IoU@0.1 0.2904 | R@1,IoU@0.3 0.0957 | R@1,IoU@0.5 0.0332 | R@1,IoU@0.7 0.0062 | R@1,IoU@0.9 0.0007 | R@5,mIoU 0.1962 | R@5,IoU@0.1 0.5734 | R@5,IoU@0.3 0.2134 | R@5,IoU@0.5 0.1005 | R@5,IoU@0.7 0.0402 | R@5,IoU@0.9 0.0025 |
2025-05-14 21:41:46,407 - ============================================================
2025-05-14 21:41:46,407 - Start Epoch 12
2025-05-14 21:42:12,741 - Epoch 12, Batch 50, lr = 0.00014, final_loss = 2.7333, nll_loss = 2.6205, ref_nll_loss = 2.8461, ivc_loss = 0.0378, neg_loss_1 = 0.0016, neg_loss_2 = 0.0049, ref_loss = 0.0108, intra_loss = 0.0000, div_loss = 0.0047, 0.527 seconds/batch
2025-05-14 21:42:32,925 - Epoch 12, Batch 100, lr = 0.00014, final_loss = 2.6855, nll_loss = 2.5694, ref_nll_loss = 2.8015, ivc_loss = 0.0371, neg_loss_1 = 0.0020, neg_loss_2 = 0.0041, ref_loss = 0.0106, intra_loss = 0.0000, div_loss = 0.0049, 0.465 seconds/batch
2025-05-14 21:42:51,282 - Epoch 12, Batch 150, lr = 0.00013, final_loss = 2.6923, nll_loss = 2.5741, ref_nll_loss = 2.8105, ivc_loss = 0.0402, neg_loss_1 = 0.0015, neg_loss_2 = 0.0041, ref_loss = 0.0116, intra_loss = 0.0000, div_loss = 0.0058, 0.433 seconds/batch
2025-05-14 21:43:09,725 - Epoch 12, Batch 200, lr = 0.00013, final_loss = 2.6675, nll_loss = 2.5522, ref_nll_loss = 2.7829, ivc_loss = 0.0371, neg_loss_1 = 0.0012, neg_loss_2 = 0.0038, ref_loss = 0.0111, intra_loss = 0.0000, div_loss = 0.0052, 0.417 seconds/batch
2025-05-14 21:43:27,248 - Epoch 12, Batch 250, lr = 0.00013, final_loss = 2.7146, nll_loss = 2.5991, ref_nll_loss = 2.8301, ivc_loss = 0.0409, neg_loss_1 = 0.0024, neg_loss_2 = 0.0039, ref_loss = 0.0119, intra_loss = 0.0000, div_loss = 0.0055, 0.403 seconds/batch
2025-05-14 21:43:45,367 - Epoch 12, Batch 300, lr = 0.00013, final_loss = 2.6888, nll_loss = 2.5721, ref_nll_loss = 2.8055, ivc_loss = 0.0398, neg_loss_1 = 0.0017, neg_loss_2 = 0.0049, ref_loss = 0.0117, intra_loss = 0.0000, div_loss = 0.0049, 0.397 seconds/batch
2025-05-14 21:43:47,364 - Epoch 12, Batch 306, lr = 0.00013, final_loss = 2.7578, nll_loss = 2.6297, ref_nll_loss = 2.8858, ivc_loss = 0.0269, neg_loss_1 = 0.0009, neg_loss_2 = 0.0029, ref_loss = 0.0055, intra_loss = 0.0000, div_loss = 0.0052, 0.395 seconds/batch
2025-05-14 21:43:47,373 - merge_alpha: 0.11989028751850128, range_width: 0.3532651960849762
2025-05-14 21:45:04,642 - | R@1,mIoU 0.0909 | R@1,IoU@0.1 0.2924 | R@1,IoU@0.3 0.0957 | R@1,IoU@0.5 0.0340 | R@1,IoU@0.7 0.0092 | R@1,IoU@0.9 0.0012 | R@5,mIoU 0.1958 | R@5,IoU@0.1 0.5694 | R@5,IoU@0.3 0.2117 | R@5,IoU@0.5 0.1015 | R@5,IoU@0.7 0.0417 | R@5,IoU@0.9 0.0052 |
2025-05-14 21:45:04,644 - ============================================================
2025-05-14 21:45:04,644 - Start Epoch 13
2025-05-14 21:45:29,308 - Epoch 13, Batch 50, lr = 0.00013, final_loss = 2.6535, nll_loss = 2.5332, ref_nll_loss = 2.7738, ivc_loss = 0.0338, neg_loss_1 = 0.0012, neg_loss_2 = 0.0043, ref_loss = 0.0087, intra_loss = 0.0000, div_loss = 0.0050, 0.493 seconds/batch
2025-05-14 21:45:50,375 - Epoch 13, Batch 100, lr = 0.00013, final_loss = 2.6571, nll_loss = 2.5398, ref_nll_loss = 2.7744, ivc_loss = 0.0368, neg_loss_1 = 0.0022, neg_loss_2 = 0.0036, ref_loss = 0.0102, intra_loss = 0.0000, div_loss = 0.0051, 0.457 seconds/batch
2025-05-14 21:46:08,588 - Epoch 13, Batch 150, lr = 0.00013, final_loss = 2.6871, nll_loss = 2.5674, ref_nll_loss = 2.8069, ivc_loss = 0.0372, neg_loss_1 = 0.0020, neg_loss_2 = 0.0044, ref_loss = 0.0099, intra_loss = 0.0000, div_loss = 0.0051, 0.426 seconds/batch
2025-05-14 21:46:27,651 - Epoch 13, Batch 200, lr = 0.00013, final_loss = 2.6567, nll_loss = 2.5401, ref_nll_loss = 2.7732, ivc_loss = 0.0407, neg_loss_1 = 0.0025, neg_loss_2 = 0.0044, ref_loss = 0.0114, intra_loss = 0.0000, div_loss = 0.0053, 0.415 seconds/batch
2025-05-14 21:46:46,087 - Epoch 13, Batch 250, lr = 0.00013, final_loss = 2.6596, nll_loss = 2.5433, ref_nll_loss = 2.7759, ivc_loss = 0.0396, neg_loss_1 = 0.0015, neg_loss_2 = 0.0049, ref_loss = 0.0108, intra_loss = 0.0001, div_loss = 0.0055, 0.406 seconds/batch
2025-05-14 21:47:03,582 - Epoch 13, Batch 300, lr = 0.00013, final_loss = 2.6869, nll_loss = 2.5703, ref_nll_loss = 2.8034, ivc_loss = 0.0429, neg_loss_1 = 0.0016, neg_loss_2 = 0.0051, ref_loss = 0.0110, intra_loss = 0.0000, div_loss = 0.0066, 0.396 seconds/batch
2025-05-14 21:47:05,783 - Epoch 13, Batch 306, lr = 0.00013, final_loss = 2.7615, nll_loss = 2.6452, ref_nll_loss = 2.8778, ivc_loss = 0.0335, neg_loss_1 = 0.0008, neg_loss_2 = 0.0035, ref_loss = 0.0067, intra_loss = 0.0000, div_loss = 0.0068, 0.396 seconds/batch
2025-05-14 21:47:05,792 - merge_alpha: 0.11877119541168213, range_width: 0.3595256805419922
2025-05-14 21:48:23,798 - | R@1,mIoU 0.0912 | R@1,IoU@0.1 0.2829 | R@1,IoU@0.3 0.0960 | R@1,IoU@0.5 0.0345 | R@1,IoU@0.7 0.0092 | R@1,IoU@0.9 0.0017 | R@5,mIoU 0.1988 | R@5,IoU@0.1 0.5664 | R@5,IoU@0.3 0.2179 | R@5,IoU@0.5 0.1067 | R@5,IoU@0.7 0.0420 | R@5,IoU@0.9 0.0107 |
2025-05-14 21:48:23,800 - ============================================================
2025-05-14 21:48:23,800 - Start Epoch 14
2025-05-14 21:48:51,065 - Epoch 14, Batch 50, lr = 0.00013, final_loss = 2.6160, nll_loss = 2.4986, ref_nll_loss = 2.7333, ivc_loss = 0.0405, neg_loss_1 = 0.0019, neg_loss_2 = 0.0034, ref_loss = 0.0097, intra_loss = 0.0000, div_loss = 0.0072, 0.545 seconds/batch
2025-05-14 21:49:10,175 - Epoch 14, Batch 100, lr = 0.00013, final_loss = 2.6494, nll_loss = 2.5331, ref_nll_loss = 2.7658, ivc_loss = 0.0389, neg_loss_1 = 0.0016, neg_loss_2 = 0.0033, ref_loss = 0.0111, intra_loss = 0.0000, div_loss = 0.0060, 0.464 seconds/batch
2025-05-14 21:49:30,057 - Epoch 14, Batch 150, lr = 0.00012, final_loss = 2.6576, nll_loss = 2.5381, ref_nll_loss = 2.7770, ivc_loss = 0.0383, neg_loss_1 = 0.0014, neg_loss_2 = 0.0032, ref_loss = 0.0111, intra_loss = 0.0000, div_loss = 0.0059, 0.442 seconds/batch
2025-05-14 21:49:47,165 - Epoch 14, Batch 200, lr = 0.00012, final_loss = 2.6705, nll_loss = 2.5526, ref_nll_loss = 2.7884, ivc_loss = 0.0427, neg_loss_1 = 0.0020, neg_loss_2 = 0.0051, ref_loss = 0.0106, intra_loss = 0.0000, div_loss = 0.0065, 0.417 seconds/batch
2025-05-14 21:50:06,971 - Epoch 14, Batch 250, lr = 0.00012, final_loss = 2.6424, nll_loss = 2.5258, ref_nll_loss = 2.7591, ivc_loss = 0.0386, neg_loss_1 = 0.0022, neg_loss_2 = 0.0040, ref_loss = 0.0108, intra_loss = 0.0000, div_loss = 0.0053, 0.413 seconds/batch
2025-05-14 21:50:25,040 - Epoch 14, Batch 300, lr = 0.00012, final_loss = 2.6818, nll_loss = 2.5584, ref_nll_loss = 2.8051, ivc_loss = 0.0392, neg_loss_1 = 0.0016, neg_loss_2 = 0.0047, ref_loss = 0.0078, intra_loss = 0.0025, div_loss = 0.0062, 0.404 seconds/batch
2025-05-14 21:50:26,074 - Epoch 14, Batch 306, lr = 0.00012, final_loss = 2.7040, nll_loss = 2.5916, ref_nll_loss = 2.8164, ivc_loss = 0.0336, neg_loss_1 = 0.0009, neg_loss_2 = 0.0036, ref_loss = 0.0088, intra_loss = 0.0000, div_loss = 0.0055, 0.400 seconds/batch
2025-05-14 21:50:26,084 - merge_alpha: 0.1204594224691391, range_width: 0.3686266541481018
2025-05-14 21:51:41,666 - | R@1,mIoU 0.0955 | R@1,IoU@0.1 0.3007 | R@1,IoU@0.3 0.0937 | R@1,IoU@0.5 0.0347 | R@1,IoU@0.7 0.0105 | R@1,IoU@0.9 0.0022 | R@5,mIoU 0.1989 | R@5,IoU@0.1 0.5676 | R@5,IoU@0.3 0.2154 | R@5,IoU@0.5 0.1032 | R@5,IoU@0.7 0.0435 | R@5,IoU@0.9 0.0127 |
2025-05-14 21:51:41,831 - save model to checkpoints/TACoS/8_2025-05-14_21-05-09/model-best.pt, num_updates 4284.
2025-05-14 21:51:41,832 - Best results have been updated.
2025-05-14 21:51:41,832 - ============================================================
2025-05-14 21:51:41,832 - Start Epoch 15
2025-05-14 21:52:10,882 - Epoch 15, Batch 50, lr = 0.00012, final_loss = 2.6488, nll_loss = 2.5299, ref_nll_loss = 2.7677, ivc_loss = 0.0418, neg_loss_1 = 0.0014, neg_loss_2 = 0.0051, ref_loss = 0.0097, intra_loss = 0.0000, div_loss = 0.0070, 0.581 seconds/batch
2025-05-14 21:52:29,115 - Epoch 15, Batch 100, lr = 0.00012, final_loss = 2.6239, nll_loss = 2.5025, ref_nll_loss = 2.7453, ivc_loss = 0.0351, neg_loss_1 = 0.0011, neg_loss_2 = 0.0038, ref_loss = 0.0093, intra_loss = 0.0000, div_loss = 0.0055, 0.473 seconds/batch
2025-05-14 21:52:47,883 - Epoch 15, Batch 150, lr = 0.00012, final_loss = 2.6312, nll_loss = 2.5061, ref_nll_loss = 2.7564, ivc_loss = 0.0367, neg_loss_1 = 0.0023, neg_loss_2 = 0.0033, ref_loss = 0.0092, intra_loss = 0.0000, div_loss = 0.0058, 0.440 seconds/batch
2025-05-14 21:53:06,163 - Epoch 15, Batch 200, lr = 0.00012, final_loss = 2.6532, nll_loss = 2.5352, ref_nll_loss = 2.7712, ivc_loss = 0.0420, neg_loss_1 = 0.0021, neg_loss_2 = 0.0050, ref_loss = 0.0102, intra_loss = 0.0000, div_loss = 0.0064, 0.422 seconds/batch
2025-05-14 21:53:24,736 - Epoch 15, Batch 250, lr = 0.00012, final_loss = 2.6414, nll_loss = 2.5202, ref_nll_loss = 2.7625, ivc_loss = 0.0375, neg_loss_1 = 0.0013, neg_loss_2 = 0.0042, ref_loss = 0.0095, intra_loss = 0.0000, div_loss = 0.0060, 0.412 seconds/batch
2025-05-14 21:53:41,278 - Epoch 15, Batch 300, lr = 0.00012, final_loss = 2.6134, nll_loss = 2.4922, ref_nll_loss = 2.7347, ivc_loss = 0.0393, neg_loss_1 = 0.0016, neg_loss_2 = 0.0042, ref_loss = 0.0095, intra_loss = 0.0000, div_loss = 0.0065, 0.398 seconds/batch
2025-05-14 21:53:42,451 - Epoch 15, Batch 306, lr = 0.00012, final_loss = 2.5921, nll_loss = 2.4706, ref_nll_loss = 2.7137, ivc_loss = 0.0418, neg_loss_1 = 0.0010, neg_loss_2 = 0.0019, ref_loss = 0.0078, intra_loss = 0.0000, div_loss = 0.0103, 0.394 seconds/batch
2025-05-14 21:53:42,460 - merge_alpha: 0.12046226859092712, range_width: 0.3800755739212036
2025-05-14 21:54:59,063 - | R@1,mIoU 0.0937 | R@1,IoU@0.1 0.2904 | R@1,IoU@0.3 0.0997 | R@1,IoU@0.5 0.0405 | R@1,IoU@0.7 0.0102 | R@1,IoU@0.9 0.0015 | R@5,mIoU 0.1978 | R@5,IoU@0.1 0.5689 | R@5,IoU@0.3 0.2182 | R@5,IoU@0.5 0.1027 | R@5,IoU@0.7 0.0430 | R@5,IoU@0.9 0.0042 |
2025-05-14 21:54:59,065 - ============================================================
2025-05-14 21:54:59,065 - Start Epoch 16
2025-05-14 21:55:26,738 - Epoch 16, Batch 50, lr = 0.00012, final_loss = 2.6423, nll_loss = 2.5199, ref_nll_loss = 2.7646, ivc_loss = 0.0410, neg_loss_1 = 0.0016, neg_loss_2 = 0.0041, ref_loss = 0.0088, intra_loss = 0.0000, div_loss = 0.0077, 0.553 seconds/batch
2025-05-14 21:55:48,460 - Epoch 16, Batch 100, lr = 0.00012, final_loss = 2.6386, nll_loss = 2.5152, ref_nll_loss = 2.7620, ivc_loss = 0.0384, neg_loss_1 = 0.0013, neg_loss_2 = 0.0037, ref_loss = 0.0101, intra_loss = 0.0000, div_loss = 0.0063, 0.494 seconds/batch
2025-05-14 21:56:07,622 - Epoch 16, Batch 150, lr = 0.00012, final_loss = 2.6109, nll_loss = 2.4890, ref_nll_loss = 2.7329, ivc_loss = 0.0377, neg_loss_1 = 0.0011, neg_loss_2 = 0.0038, ref_loss = 0.0100, intra_loss = 0.0000, div_loss = 0.0061, 0.457 seconds/batch
2025-05-14 21:56:25,632 - Epoch 16, Batch 200, lr = 0.00012, final_loss = 2.6073, nll_loss = 2.4865, ref_nll_loss = 2.7280, ivc_loss = 0.0513, neg_loss_1 = 0.0021, neg_loss_2 = 0.0041, ref_loss = 0.0136, intra_loss = 0.0029, div_loss = 0.0075, 0.433 seconds/batch
2025-05-14 21:56:43,884 - Epoch 16, Batch 250, lr = 0.00011, final_loss = 2.6341, nll_loss = 2.5171, ref_nll_loss = 2.7511, ivc_loss = 0.0505, neg_loss_1 = 0.0025, neg_loss_2 = 0.0049, ref_loss = 0.0112, intra_loss = 0.0014, div_loss = 0.0085, 0.419 seconds/batch
2025-05-14 21:57:02,260 - Epoch 16, Batch 300, lr = 0.00011, final_loss = 2.6105, nll_loss = 2.4903, ref_nll_loss = 2.7308, ivc_loss = 0.0418, neg_loss_1 = 0.0018, neg_loss_2 = 0.0045, ref_loss = 0.0113, intra_loss = 0.0000, div_loss = 0.0062, 0.411 seconds/batch
2025-05-14 21:57:03,314 - Epoch 16, Batch 306, lr = 0.00011, final_loss = 2.5927, nll_loss = 2.4718, ref_nll_loss = 2.7135, ivc_loss = 0.0553, neg_loss_1 = 0.0060, neg_loss_2 = 0.0058, ref_loss = 0.0085, intra_loss = 0.0000, div_loss = 0.0100, 0.406 seconds/batch
2025-05-14 21:57:03,323 - merge_alpha: 0.12140338122844696, range_width: 0.3853817582130432
2025-05-14 21:58:18,749 - | R@1,mIoU 0.0941 | R@1,IoU@0.1 0.3017 | R@1,IoU@0.3 0.1040 | R@1,IoU@0.5 0.0310 | R@1,IoU@0.7 0.0112 | R@1,IoU@0.9 0.0022 | R@5,mIoU 0.2016 | R@5,IoU@0.1 0.5856 | R@5,IoU@0.3 0.2209 | R@5,IoU@0.5 0.1030 | R@5,IoU@0.7 0.0460 | R@5,IoU@0.9 0.0077 |
2025-05-14 21:58:18,751 - ============================================================
2025-05-14 21:58:18,751 - Start Epoch 17
2025-05-14 21:58:43,967 - Epoch 17, Batch 50, lr = 0.00011, final_loss = 2.6233, nll_loss = 2.5043, ref_nll_loss = 2.7424, ivc_loss = 0.0411, neg_loss_1 = 0.0020, neg_loss_2 = 0.0036, ref_loss = 0.0099, intra_loss = 0.0000, div_loss = 0.0071, 0.504 seconds/batch
2025-05-14 21:59:03,977 - Epoch 17, Batch 100, lr = 0.00011, final_loss = 2.6031, nll_loss = 2.4814, ref_nll_loss = 2.7248, ivc_loss = 0.0432, neg_loss_1 = 0.0012, neg_loss_2 = 0.0052, ref_loss = 0.0091, intra_loss = 0.0000, div_loss = 0.0080, 0.452 seconds/batch
2025-05-14 21:59:25,788 - Epoch 17, Batch 150, lr = 0.00011, final_loss = 2.5807, nll_loss = 2.4577, ref_nll_loss = 2.7037, ivc_loss = 0.0357, neg_loss_1 = 0.0012, neg_loss_2 = 0.0032, ref_loss = 0.0100, intra_loss = 0.0000, div_loss = 0.0056, 0.447 seconds/batch
2025-05-14 21:59:41,104 - Epoch 17, Batch 200, lr = 0.00011, final_loss = 2.6231, nll_loss = 2.5027, ref_nll_loss = 2.7434, ivc_loss = 0.0413, neg_loss_1 = 0.0024, neg_loss_2 = 0.0035, ref_loss = 0.0102, intra_loss = 0.0000, div_loss = 0.0068, 0.412 seconds/batch
2025-05-14 22:00:02,559 - Epoch 17, Batch 250, lr = 0.00011, final_loss = 2.6017, nll_loss = 2.4770, ref_nll_loss = 2.7265, ivc_loss = 0.0358, neg_loss_1 = 0.0010, neg_loss_2 = 0.0032, ref_loss = 0.0093, intra_loss = 0.0000, div_loss = 0.0062, 0.415 seconds/batch
2025-05-14 22:00:18,616 - Epoch 17, Batch 300, lr = 0.00011, final_loss = 2.6016, nll_loss = 2.4716, ref_nll_loss = 2.7316, ivc_loss = 0.0331, neg_loss_1 = 0.0016, neg_loss_2 = 0.0030, ref_loss = 0.0081, intra_loss = 0.0000, div_loss = 0.0056, 0.400 seconds/batch
2025-05-14 22:00:19,649 - Epoch 17, Batch 306, lr = 0.00011, final_loss = 2.6025, nll_loss = 2.4810, ref_nll_loss = 2.7241, ivc_loss = 0.0383, neg_loss_1 = 0.0007, neg_loss_2 = 0.0060, ref_loss = 0.0093, intra_loss = 0.0000, div_loss = 0.0057, 0.395 seconds/batch
2025-05-14 22:00:19,659 - merge_alpha: 0.12156626582145691, range_width: 0.3922778069972992
2025-05-14 22:01:36,464 - | R@1,mIoU 0.0951 | R@1,IoU@0.1 0.2967 | R@1,IoU@0.3 0.1000 | R@1,IoU@0.5 0.0327 | R@1,IoU@0.7 0.0105 | R@1,IoU@0.9 0.0017 | R@5,mIoU 0.1992 | R@5,IoU@0.1 0.5751 | R@5,IoU@0.3 0.2162 | R@5,IoU@0.5 0.1057 | R@5,IoU@0.7 0.0410 | R@5,IoU@0.9 0.0122 |
2025-05-14 22:01:36,466 - ============================================================
2025-05-14 22:01:36,466 - Start Epoch 18
2025-05-14 22:02:04,422 - Epoch 18, Batch 50, lr = 0.00011, final_loss = 2.6080, nll_loss = 2.4862, ref_nll_loss = 2.7297, ivc_loss = 0.0402, neg_loss_1 = 0.0012, neg_loss_2 = 0.0041, ref_loss = 0.0097, intra_loss = 0.0000, div_loss = 0.0071, 0.559 seconds/batch
2025-05-14 22:02:24,900 - Epoch 18, Batch 100, lr = 0.00011, final_loss = 2.5742, nll_loss = 2.4512, ref_nll_loss = 2.6972, ivc_loss = 0.0431, neg_loss_1 = 0.0011, neg_loss_2 = 0.0034, ref_loss = 0.0101, intra_loss = 0.0000, div_loss = 0.0085, 0.484 seconds/batch
2025-05-14 22:02:42,189 - Epoch 18, Batch 150, lr = 0.00011, final_loss = 2.5914, nll_loss = 2.4670, ref_nll_loss = 2.7158, ivc_loss = 0.0387, neg_loss_1 = 0.0018, neg_loss_2 = 0.0035, ref_loss = 0.0093, intra_loss = 0.0000, div_loss = 0.0068, 0.438 seconds/batch
2025-05-14 22:03:02,073 - Epoch 18, Batch 200, lr = 0.00011, final_loss = 2.6075, nll_loss = 2.4803, ref_nll_loss = 2.7347, ivc_loss = 0.0375, neg_loss_1 = 0.0014, neg_loss_2 = 0.0046, ref_loss = 0.0099, intra_loss = 0.0000, div_loss = 0.0054, 0.428 seconds/batch
2025-05-14 22:03:21,739 - Epoch 18, Batch 250, lr = 0.00011, final_loss = 2.5830, nll_loss = 2.4587, ref_nll_loss = 2.7073, ivc_loss = 0.0343, neg_loss_1 = 0.0017, neg_loss_2 = 0.0036, ref_loss = 0.0085, intra_loss = 0.0000, div_loss = 0.0055, 0.421 seconds/batch
2025-05-14 22:03:36,357 - Epoch 18, Batch 300, lr = 0.00011, final_loss = 2.5926, nll_loss = 2.4686, ref_nll_loss = 2.7166, ivc_loss = 0.0379, neg_loss_1 = 0.0016, neg_loss_2 = 0.0033, ref_loss = 0.0091, intra_loss = 0.0000, div_loss = 0.0068, 0.400 seconds/batch
2025-05-14 22:03:37,385 - Epoch 18, Batch 306, lr = 0.00011, final_loss = 2.4938, nll_loss = 2.3718, ref_nll_loss = 2.6158, ivc_loss = 0.0509, neg_loss_1 = 0.0013, neg_loss_2 = 0.0064, ref_loss = 0.0126, intra_loss = 0.0000, div_loss = 0.0082, 0.395 seconds/batch
2025-05-14 22:03:37,395 - merge_alpha: 0.12336172163486481, range_width: 0.4004286229610443
2025-05-14 22:04:57,854 - | R@1,mIoU 0.0924 | R@1,IoU@0.1 0.2957 | R@1,IoU@0.3 0.0980 | R@1,IoU@0.5 0.0337 | R@1,IoU@0.7 0.0085 | R@1,IoU@0.9 0.0007 | R@5,mIoU 0.1970 | R@5,IoU@0.1 0.5804 | R@5,IoU@0.3 0.2077 | R@5,IoU@0.5 0.0995 | R@5,IoU@0.7 0.0420 | R@5,IoU@0.9 0.0037 |
2025-05-14 22:04:57,856 - ============================================================
2025-05-14 22:04:57,856 - Start Epoch 19
2025-05-14 22:05:21,270 - Epoch 19, Batch 50, lr = 0.00011, final_loss = 2.5918, nll_loss = 2.4635, ref_nll_loss = 2.7201, ivc_loss = 0.0486, neg_loss_1 = 0.0013, neg_loss_2 = 0.0044, ref_loss = 0.0097, intra_loss = 0.0000, div_loss = 0.0102, 0.468 seconds/batch
2025-05-14 22:05:40,738 - Epoch 19, Batch 100, lr = 0.00011, final_loss = 2.5812, nll_loss = 2.4552, ref_nll_loss = 2.7071, ivc_loss = 0.0409, neg_loss_1 = 0.0011, neg_loss_2 = 0.0040, ref_loss = 0.0090, intra_loss = 0.0000, div_loss = 0.0078, 0.429 seconds/batch
2025-05-14 22:06:01,625 - Epoch 19, Batch 150, lr = 0.00011, final_loss = 2.5798, nll_loss = 2.4489, ref_nll_loss = 2.7108, ivc_loss = 0.0402, neg_loss_1 = 0.0012, neg_loss_2 = 0.0043, ref_loss = 0.0097, intra_loss = 0.0000, div_loss = 0.0069, 0.425 seconds/batch
2025-05-14 22:06:21,313 - Epoch 19, Batch 200, lr = 0.00011, final_loss = 2.5770, nll_loss = 2.4497, ref_nll_loss = 2.7043, ivc_loss = 0.0347, neg_loss_1 = 0.0014, neg_loss_2 = 0.0039, ref_loss = 0.0085, intra_loss = 0.0000, div_loss = 0.0056, 0.417 seconds/batch
2025-05-14 22:06:41,238 - Epoch 19, Batch 250, lr = 0.00011, final_loss = 2.5917, nll_loss = 2.4669, ref_nll_loss = 2.7165, ivc_loss = 0.0374, neg_loss_1 = 0.0013, neg_loss_2 = 0.0036, ref_loss = 0.0102, intra_loss = 0.0000, div_loss = 0.0059, 0.414 seconds/batch
2025-05-14 22:06:59,489 - Epoch 19, Batch 300, lr = 0.00010, final_loss = 2.5398, nll_loss = 2.4193, ref_nll_loss = 2.6603, ivc_loss = 0.0406, neg_loss_1 = 0.0016, neg_loss_2 = 0.0040, ref_loss = 0.0109, intra_loss = 0.0000, div_loss = 0.0064, 0.405 seconds/batch
2025-05-14 22:07:00,518 - Epoch 19, Batch 306, lr = 0.00010, final_loss = 2.5811, nll_loss = 2.4577, ref_nll_loss = 2.7044, ivc_loss = 0.0411, neg_loss_1 = 0.0017, neg_loss_2 = 0.0048, ref_loss = 0.0085, intra_loss = 0.0000, div_loss = 0.0074, 0.401 seconds/batch
2025-05-14 22:07:00,526 - merge_alpha: 0.12252071499824524, range_width: 0.4048449695110321
2025-05-14 22:08:20,105 - | R@1,mIoU 0.0939 | R@1,IoU@0.1 0.2932 | R@1,IoU@0.3 0.1002 | R@1,IoU@0.5 0.0375 | R@1,IoU@0.7 0.0112 | R@1,IoU@0.9 0.0012 | R@5,mIoU 0.2022 | R@5,IoU@0.1 0.5801 | R@5,IoU@0.3 0.2257 | R@5,IoU@0.5 0.1090 | R@5,IoU@0.7 0.0457 | R@5,IoU@0.9 0.0077 |
2025-05-14 22:08:20,108 - ============================================================
2025-05-14 22:08:20,108 - Start Epoch 20
2025-05-14 22:08:45,814 - Epoch 20, Batch 50, lr = 0.00010, final_loss = 2.5576, nll_loss = 2.4268, ref_nll_loss = 2.6883, ivc_loss = 0.0374, neg_loss_1 = 0.0021, neg_loss_2 = 0.0040, ref_loss = 0.0085, intra_loss = 0.0000, div_loss = 0.0063, 0.514 seconds/batch
2025-05-14 22:09:07,094 - Epoch 20, Batch 100, lr = 0.00010, final_loss = 2.5388, nll_loss = 2.4082, ref_nll_loss = 2.6693, ivc_loss = 0.0330, neg_loss_1 = 0.0011, neg_loss_2 = 0.0032, ref_loss = 0.0084, intra_loss = 0.0000, div_loss = 0.0056, 0.470 seconds/batch
2025-05-14 22:09:24,517 - Epoch 20, Batch 150, lr = 0.00010, final_loss = 2.5427, nll_loss = 2.4119, ref_nll_loss = 2.6736, ivc_loss = 0.0335, neg_loss_1 = 0.0008, neg_loss_2 = 0.0030, ref_loss = 0.0090, intra_loss = 0.0000, div_loss = 0.0057, 0.429 seconds/batch
2025-05-14 22:09:43,356 - Epoch 20, Batch 200, lr = 0.00010, final_loss = 2.5719, nll_loss = 2.4430, ref_nll_loss = 2.7007, ivc_loss = 0.0333, neg_loss_1 = 0.0016, neg_loss_2 = 0.0027, ref_loss = 0.0085, intra_loss = 0.0000, div_loss = 0.0057, 0.416 seconds/batch
2025-05-14 22:10:05,047 - Epoch 20, Batch 250, lr = 0.00010, final_loss = 2.5913, nll_loss = 2.4669, ref_nll_loss = 2.7157, ivc_loss = 0.0360, neg_loss_1 = 0.0012, neg_loss_2 = 0.0035, ref_loss = 0.0098, intra_loss = 0.0000, div_loss = 0.0057, 0.420 seconds/batch
2025-05-14 22:10:22,324 - Epoch 20, Batch 300, lr = 0.00010, final_loss = 2.5472, nll_loss = 2.4139, ref_nll_loss = 2.6805, ivc_loss = 0.0315, neg_loss_1 = 0.0010, neg_loss_2 = 0.0032, ref_loss = 0.0076, intra_loss = 0.0000, div_loss = 0.0056, 0.407 seconds/batch
2025-05-14 22:10:24,355 - Epoch 20, Batch 306, lr = 0.00010, final_loss = 2.6095, nll_loss = 2.4776, ref_nll_loss = 2.7415, ivc_loss = 0.0324, neg_loss_1 = 0.0015, neg_loss_2 = 0.0028, ref_loss = 0.0079, intra_loss = 0.0000, div_loss = 0.0057, 0.406 seconds/batch
2025-05-14 22:10:24,365 - merge_alpha: 0.12300387769937515, range_width: 0.39763593673706055
2025-05-14 22:11:39,948 - | R@1,mIoU 0.0979 | R@1,IoU@0.1 0.3064 | R@1,IoU@0.3 0.1025 | R@1,IoU@0.5 0.0400 | R@1,IoU@0.7 0.0117 | R@1,IoU@0.9 0.0010 | R@5,mIoU 0.1993 | R@5,IoU@0.1 0.5759 | R@5,IoU@0.3 0.2159 | R@5,IoU@0.5 0.1032 | R@5,IoU@0.7 0.0435 | R@5,IoU@0.9 0.0040 |
2025-05-14 22:11:40,114 - save model to checkpoints/TACoS/8_2025-05-14_21-05-09/model-best.pt, num_updates 6120.
2025-05-14 22:11:40,115 - Best results have been updated.
2025-05-14 22:11:40,115 - ============================================================
2025-05-14 22:11:40,115 - Start Epoch 21
2025-05-14 22:12:05,643 - Epoch 21, Batch 50, lr = 0.00010, final_loss = 2.5424, nll_loss = 2.4134, ref_nll_loss = 2.6715, ivc_loss = 0.0333, neg_loss_1 = 0.0021, neg_loss_2 = 0.0035, ref_loss = 0.0079, intra_loss = 0.0000, div_loss = 0.0053, 0.511 seconds/batch
2025-05-14 22:12:27,018 - Epoch 21, Batch 100, lr = 0.00010, final_loss = 2.5426, nll_loss = 2.4085, ref_nll_loss = 2.6766, ivc_loss = 0.0339, neg_loss_1 = 0.0009, neg_loss_2 = 0.0032, ref_loss = 0.0083, intra_loss = 0.0000, div_loss = 0.0062, 0.469 seconds/batch
2025-05-14 22:12:46,752 - Epoch 21, Batch 150, lr = 0.00010, final_loss = 2.5448, nll_loss = 2.4115, ref_nll_loss = 2.6780, ivc_loss = 0.0349, neg_loss_1 = 0.0009, neg_loss_2 = 0.0030, ref_loss = 0.0072, intra_loss = 0.0025, div_loss = 0.0064, 0.444 seconds/batch
2025-05-14 22:13:05,188 - Epoch 21, Batch 200, lr = 0.00010, final_loss = 2.5266, nll_loss = 2.3939, ref_nll_loss = 2.6594, ivc_loss = 0.0439, neg_loss_1 = 0.0012, neg_loss_2 = 0.0038, ref_loss = 0.0092, intra_loss = 0.0000, div_loss = 0.0090, 0.425 seconds/batch
2025-05-14 22:13:23,347 - Epoch 21, Batch 250, lr = 0.00010, final_loss = 2.5509, nll_loss = 2.4215, ref_nll_loss = 2.6802, ivc_loss = 0.0402, neg_loss_1 = 0.0018, neg_loss_2 = 0.0031, ref_loss = 0.0079, intra_loss = 0.0000, div_loss = 0.0084, 0.413 seconds/batch
2025-05-14 22:13:42,221 - Epoch 21, Batch 300, lr = 0.00010, final_loss = 2.5595, nll_loss = 2.4290, ref_nll_loss = 2.6900, ivc_loss = 0.0350, neg_loss_1 = 0.0012, neg_loss_2 = 0.0028, ref_loss = 0.0091, intra_loss = 0.0000, div_loss = 0.0061, 0.407 seconds/batch
2025-05-14 22:13:43,255 - Epoch 21, Batch 306, lr = 0.00010, final_loss = 2.6590, nll_loss = 2.5378, ref_nll_loss = 2.7801, ivc_loss = 0.0346, neg_loss_1 = 0.0004, neg_loss_2 = 0.0032, ref_loss = 0.0090, intra_loss = 0.0000, div_loss = 0.0063, 0.402 seconds/batch
2025-05-14 22:13:43,264 - merge_alpha: 0.12477914243936539, range_width: 0.3933158814907074
2025-05-14 22:14:58,795 - | R@1,mIoU 0.0961 | R@1,IoU@0.1 0.3057 | R@1,IoU@0.3 0.0980 | R@1,IoU@0.5 0.0380 | R@1,IoU@0.7 0.0112 | R@1,IoU@0.9 0.0007 | R@5,mIoU 0.1968 | R@5,IoU@0.1 0.5691 | R@5,IoU@0.3 0.2097 | R@5,IoU@0.5 0.1020 | R@5,IoU@0.7 0.0420 | R@5,IoU@0.9 0.0050 |
2025-05-14 22:14:58,797 - ============================================================
2025-05-14 22:14:58,797 - Start Epoch 22
2025-05-14 22:15:24,169 - Epoch 22, Batch 50, lr = 0.00010, final_loss = 2.5021, nll_loss = 2.3730, ref_nll_loss = 2.6311, ivc_loss = 0.0349, neg_loss_1 = 0.0014, neg_loss_2 = 0.0024, ref_loss = 0.0084, intra_loss = 0.0000, div_loss = 0.0066, 0.507 seconds/batch
2025-05-14 22:15:44,243 - Epoch 22, Batch 100, lr = 0.00010, final_loss = 2.5059, nll_loss = 2.3752, ref_nll_loss = 2.6367, ivc_loss = 0.0309, neg_loss_1 = 0.0007, neg_loss_2 = 0.0031, ref_loss = 0.0073, intra_loss = 0.0000, div_loss = 0.0057, 0.454 seconds/batch
2025-05-14 22:16:01,806 - Epoch 22, Batch 150, lr = 0.00010, final_loss = 2.5638, nll_loss = 2.4316, ref_nll_loss = 2.6961, ivc_loss = 0.0347, neg_loss_1 = 0.0015, neg_loss_2 = 0.0032, ref_loss = 0.0077, intra_loss = 0.0000, div_loss = 0.0064, 0.420 seconds/batch
2025-05-14 22:16:22,981 - Epoch 22, Batch 200, lr = 0.00010, final_loss = 2.5204, nll_loss = 2.3869, ref_nll_loss = 2.6540, ivc_loss = 0.0357, neg_loss_1 = 0.0016, neg_loss_2 = 0.0036, ref_loss = 0.0085, intra_loss = 0.0000, div_loss = 0.0061, 0.421 seconds/batch
2025-05-14 22:16:40,790 - Epoch 22, Batch 250, lr = 0.00010, final_loss = 2.5283, nll_loss = 2.3911, ref_nll_loss = 2.6655, ivc_loss = 0.0316, neg_loss_1 = 0.0014, neg_loss_2 = 0.0026, ref_loss = 0.0077, intra_loss = 0.0000, div_loss = 0.0056, 0.408 seconds/batch
2025-05-14 22:16:58,561 - Epoch 22, Batch 300, lr = 0.00010, final_loss = 2.5683, nll_loss = 2.4359, ref_nll_loss = 2.7008, ivc_loss = 0.0318, neg_loss_1 = 0.0006, neg_loss_2 = 0.0025, ref_loss = 0.0078, intra_loss = 0.0000, div_loss = 0.0061, 0.399 seconds/batch
2025-05-14 22:17:00,246 - Epoch 22, Batch 306, lr = 0.00010, final_loss = 2.5119, nll_loss = 2.3916, ref_nll_loss = 2.6323, ivc_loss = 0.0319, neg_loss_1 = 0.0006, neg_loss_2 = 0.0040, ref_loss = 0.0083, intra_loss = 0.0000, div_loss = 0.0050, 0.397 seconds/batch
2025-05-14 22:17:00,255 - merge_alpha: 0.1252017766237259, range_width: 0.39380744099617004
2025-05-14 22:18:19,106 - | R@1,mIoU 0.0973 | R@1,IoU@0.1 0.3099 | R@1,IoU@0.3 0.1030 | R@1,IoU@0.5 0.0362 | R@1,IoU@0.7 0.0105 | R@1,IoU@0.9 0.0012 | R@5,mIoU 0.1996 | R@5,IoU@0.1 0.5759 | R@5,IoU@0.3 0.2152 | R@5,IoU@0.5 0.1022 | R@5,IoU@0.7 0.0435 | R@5,IoU@0.9 0.0050 |
2025-05-14 22:18:19,108 - ============================================================
2025-05-14 22:18:19,108 - Start Epoch 23
2025-05-14 22:18:46,373 - Epoch 23, Batch 50, lr = 0.00010, final_loss = 2.5002, nll_loss = 2.3649, ref_nll_loss = 2.6355, ivc_loss = 0.0302, neg_loss_1 = 0.0010, neg_loss_2 = 0.0020, ref_loss = 0.0074, intra_loss = 0.0000, div_loss = 0.0058, 0.545 seconds/batch
2025-05-14 22:19:06,471 - Epoch 23, Batch 100, lr = 0.00010, final_loss = 2.5028, nll_loss = 2.3663, ref_nll_loss = 2.6394, ivc_loss = 0.0333, neg_loss_1 = 0.0017, neg_loss_2 = 0.0039, ref_loss = 0.0073, intra_loss = 0.0000, div_loss = 0.0056, 0.474 seconds/batch
2025-05-14 22:19:22,465 - Epoch 23, Batch 150, lr = 0.00010, final_loss = 2.5507, nll_loss = 2.4182, ref_nll_loss = 2.6833, ivc_loss = 0.0332, neg_loss_1 = 0.0013, neg_loss_2 = 0.0039, ref_loss = 0.0083, intra_loss = 0.0000, div_loss = 0.0051, 0.422 seconds/batch
2025-05-14 22:19:42,611 - Epoch 23, Batch 200, lr = 0.00010, final_loss = 2.5088, nll_loss = 2.3690, ref_nll_loss = 2.6487, ivc_loss = 0.0327, neg_loss_1 = 0.0012, neg_loss_2 = 0.0041, ref_loss = 0.0072, intra_loss = 0.0000, div_loss = 0.0056, 0.418 seconds/batch
2025-05-14 22:20:01,764 - Epoch 23, Batch 250, lr = 0.00010, final_loss = 2.5673, nll_loss = 2.4348, ref_nll_loss = 2.6999, ivc_loss = 0.0332, neg_loss_1 = 0.0012, neg_loss_2 = 0.0031, ref_loss = 0.0084, intra_loss = 0.0000, div_loss = 0.0057, 0.411 seconds/batch
2025-05-14 22:20:17,423 - Epoch 23, Batch 300, lr = 0.00010, final_loss = 2.5348, nll_loss = 2.4015, ref_nll_loss = 2.6681, ivc_loss = 0.0330, neg_loss_1 = 0.0011, neg_loss_2 = 0.0033, ref_loss = 0.0077, intra_loss = 0.0000, div_loss = 0.0060, 0.394 seconds/batch
2025-05-14 22:20:18,820 - Epoch 23, Batch 306, lr = 0.00010, final_loss = 2.4663, nll_loss = 2.3330, ref_nll_loss = 2.5996, ivc_loss = 0.0305, neg_loss_1 = 0.0016, neg_loss_2 = 0.0017, ref_loss = 0.0079, intra_loss = 0.0000, div_loss = 0.0055, 0.391 seconds/batch
2025-05-14 22:20:18,830 - merge_alpha: 0.1256866306066513, range_width: 0.3896181285381317
2025-05-14 22:21:34,232 - | R@1,mIoU 0.0950 | R@1,IoU@0.1 0.2969 | R@1,IoU@0.3 0.0970 | R@1,IoU@0.5 0.0345 | R@1,IoU@0.7 0.0100 | R@1,IoU@0.9 0.0007 | R@5,mIoU 0.2005 | R@5,IoU@0.1 0.5686 | R@5,IoU@0.3 0.2182 | R@5,IoU@0.5 0.1047 | R@5,IoU@0.7 0.0442 | R@5,IoU@0.9 0.0092 |
2025-05-14 22:21:34,234 - ============================================================
2025-05-14 22:21:34,235 - Start Epoch 24
2025-05-14 22:22:00,515 - Epoch 24, Batch 50, lr = 0.00010, final_loss = 2.5039, nll_loss = 2.3714, ref_nll_loss = 2.6365, ivc_loss = 0.0348, neg_loss_1 = 0.0008, neg_loss_2 = 0.0035, ref_loss = 0.0091, intra_loss = 0.0000, div_loss = 0.0059, 0.526 seconds/batch
2025-05-14 22:22:19,454 - Epoch 24, Batch 100, lr = 0.00009, final_loss = 2.5032, nll_loss = 2.3680, ref_nll_loss = 2.6384, ivc_loss = 0.0304, neg_loss_1 = 0.0014, neg_loss_2 = 0.0019, ref_loss = 0.0078, intra_loss = 0.0000, div_loss = 0.0055, 0.452 seconds/batch
2025-05-14 22:22:39,001 - Epoch 24, Batch 150, lr = 0.00009, final_loss = 2.5161, nll_loss = 2.3794, ref_nll_loss = 2.6528, ivc_loss = 0.0312, neg_loss_1 = 0.0012, neg_loss_2 = 0.0029, ref_loss = 0.0075, intra_loss = 0.0000, div_loss = 0.0056, 0.432 seconds/batch
2025-05-14 22:22:58,182 - Epoch 24, Batch 200, lr = 0.00009, final_loss = 2.5070, nll_loss = 2.3721, ref_nll_loss = 2.6419, ivc_loss = 0.0332, neg_loss_1 = 0.0012, neg_loss_2 = 0.0033, ref_loss = 0.0085, intra_loss = 0.0000, div_loss = 0.0055, 0.420 seconds/batch
2025-05-14 22:23:16,813 - Epoch 24, Batch 250, lr = 0.00009, final_loss = 2.5308, nll_loss = 2.3978, ref_nll_loss = 2.6638, ivc_loss = 0.0339, neg_loss_1 = 0.0013, neg_loss_2 = 0.0031, ref_loss = 0.0090, intra_loss = 0.0000, div_loss = 0.0056, 0.410 seconds/batch
2025-05-14 22:23:34,703 - Epoch 24, Batch 300, lr = 0.00009, final_loss = 2.5300, nll_loss = 2.3953, ref_nll_loss = 2.6647, ivc_loss = 0.0335, neg_loss_1 = 0.0016, neg_loss_2 = 0.0036, ref_loss = 0.0073, intra_loss = 0.0000, div_loss = 0.0059, 0.402 seconds/batch
2025-05-14 22:23:36,762 - Epoch 24, Batch 306, lr = 0.00009, final_loss = 2.4979, nll_loss = 2.3589, ref_nll_loss = 2.6369, ivc_loss = 0.0243, neg_loss_1 = 0.0002, neg_loss_2 = 0.0024, ref_loss = 0.0049, intra_loss = 0.0000, div_loss = 0.0052, 0.400 seconds/batch
2025-05-14 22:23:36,771 - merge_alpha: 0.12603579461574554, range_width: 0.38680118322372437
2025-05-14 22:24:54,397 - | R@1,mIoU 0.0954 | R@1,IoU@0.1 0.2954 | R@1,IoU@0.3 0.1030 | R@1,IoU@0.5 0.0407 | R@1,IoU@0.7 0.0112 | R@1,IoU@0.9 0.0012 | R@5,mIoU 0.2020 | R@5,IoU@0.1 0.5834 | R@5,IoU@0.3 0.2219 | R@5,IoU@0.5 0.1057 | R@5,IoU@0.7 0.0432 | R@5,IoU@0.9 0.0060 |
2025-05-14 22:24:54,399 - ============================================================
2025-05-14 22:24:54,399 - Start Epoch 25
2025-05-14 22:25:19,516 - Epoch 25, Batch 50, lr = 0.00009, final_loss = 2.4890, nll_loss = 2.3547, ref_nll_loss = 2.6233, ivc_loss = 0.0319, neg_loss_1 = 0.0013, neg_loss_2 = 0.0029, ref_loss = 0.0084, intra_loss = 0.0000, div_loss = 0.0052, 0.502 seconds/batch
2025-05-14 22:25:41,361 - Epoch 25, Batch 100, lr = 0.00009, final_loss = 2.4832, nll_loss = 2.3505, ref_nll_loss = 2.6159, ivc_loss = 0.0338, neg_loss_1 = 0.0024, neg_loss_2 = 0.0034, ref_loss = 0.0078, intra_loss = 0.0000, div_loss = 0.0053, 0.470 seconds/batch
2025-05-14 22:26:00,400 - Epoch 25, Batch 150, lr = 0.00009, final_loss = 2.4757, nll_loss = 2.3389, ref_nll_loss = 2.6125, ivc_loss = 0.0378, neg_loss_1 = 0.0013, neg_loss_2 = 0.0034, ref_loss = 0.0084, intra_loss = 0.0000, div_loss = 0.0073, 0.440 seconds/batch
2025-05-14 22:26:18,514 - Epoch 25, Batch 200, lr = 0.00009, final_loss = 2.5172, nll_loss = 2.3820, ref_nll_loss = 2.6524, ivc_loss = 0.0348, neg_loss_1 = 0.0015, neg_loss_2 = 0.0025, ref_loss = 0.0081, intra_loss = 0.0000, div_loss = 0.0066, 0.421 seconds/batch
2025-05-14 22:26:40,256 - Epoch 25, Batch 250, lr = 0.00009, final_loss = 2.5296, nll_loss = 2.3906, ref_nll_loss = 2.6686, ivc_loss = 0.0289, neg_loss_1 = 0.0007, neg_loss_2 = 0.0017, ref_loss = 0.0074, intra_loss = 0.0000, div_loss = 0.0057, 0.423 seconds/batch
2025-05-14 22:26:54,674 - Epoch 25, Batch 300, lr = 0.00009, final_loss = 2.5023, nll_loss = 2.3629, ref_nll_loss = 2.6417, ivc_loss = 0.0345, neg_loss_1 = 0.0015, neg_loss_2 = 0.0025, ref_loss = 0.0077, intra_loss = 0.0000, div_loss = 0.0067, 0.401 seconds/batch
2025-05-14 22:26:55,715 - Epoch 25, Batch 306, lr = 0.00009, final_loss = 2.5455, nll_loss = 2.4257, ref_nll_loss = 2.6654, ivc_loss = 0.0323, neg_loss_1 = 0.0001, neg_loss_2 = 0.0015, ref_loss = 0.0106, intra_loss = 0.0000, div_loss = 0.0056, 0.396 seconds/batch
2025-05-14 22:26:55,724 - merge_alpha: 0.12645146250724792, range_width: 0.3869231641292572
2025-05-14 22:28:10,337 - | R@1,mIoU 0.0942 | R@1,IoU@0.1 0.2977 | R@1,IoU@0.3 0.0942 | R@1,IoU@0.5 0.0385 | R@1,IoU@0.7 0.0107 | R@1,IoU@0.9 0.0007 | R@5,mIoU 0.1990 | R@5,IoU@0.1 0.5729 | R@5,IoU@0.3 0.2134 | R@5,IoU@0.5 0.1045 | R@5,IoU@0.7 0.0437 | R@5,IoU@0.9 0.0060 |
2025-05-14 22:28:10,339 - ============================================================
2025-05-14 22:28:10,339 - Start Epoch 26
2025-05-14 22:28:34,864 - Epoch 26, Batch 50, lr = 0.00009, final_loss = 2.4669, nll_loss = 2.3287, ref_nll_loss = 2.6051, ivc_loss = 0.0296, neg_loss_1 = 0.0009, neg_loss_2 = 0.0027, ref_loss = 0.0064, intra_loss = 0.0000, div_loss = 0.0059, 0.490 seconds/batch
2025-05-14 22:28:54,532 - Epoch 26, Batch 100, lr = 0.00009, final_loss = 2.4786, nll_loss = 2.3416, ref_nll_loss = 2.6156, ivc_loss = 0.0319, neg_loss_1 = 0.0012, neg_loss_2 = 0.0030, ref_loss = 0.0074, intra_loss = 0.0000, div_loss = 0.0058, 0.442 seconds/batch
2025-05-14 22:29:14,197 - Epoch 26, Batch 150, lr = 0.00009, final_loss = 2.4764, nll_loss = 2.3353, ref_nll_loss = 2.6176, ivc_loss = 0.0328, neg_loss_1 = 0.0010, neg_loss_2 = 0.0039, ref_loss = 0.0066, intra_loss = 0.0000, div_loss = 0.0062, 0.426 seconds/batch
2025-05-14 22:29:35,508 - Epoch 26, Batch 200, lr = 0.00009, final_loss = 2.4975, nll_loss = 2.3537, ref_nll_loss = 2.6413, ivc_loss = 0.0267, neg_loss_1 = 0.0009, neg_loss_2 = 0.0019, ref_loss = 0.0058, intra_loss = 0.0000, div_loss = 0.0055, 0.426 seconds/batch
2025-05-14 22:29:53,114 - Epoch 26, Batch 250, lr = 0.00009, final_loss = 2.4948, nll_loss = 2.3539, ref_nll_loss = 2.6356, ivc_loss = 0.0297, neg_loss_1 = 0.0010, neg_loss_2 = 0.0024, ref_loss = 0.0067, intra_loss = 0.0000, div_loss = 0.0058, 0.411 seconds/batch
2025-05-14 22:30:09,742 - Epoch 26, Batch 300, lr = 0.00009, final_loss = 2.5294, nll_loss = 2.3901, ref_nll_loss = 2.6688, ivc_loss = 0.0300, neg_loss_1 = 0.0011, neg_loss_2 = 0.0027, ref_loss = 0.0074, intra_loss = 0.0000, div_loss = 0.0052, 0.398 seconds/batch
2025-05-14 22:30:10,803 - Epoch 26, Batch 306, lr = 0.00009, final_loss = 2.5155, nll_loss = 2.3690, ref_nll_loss = 2.6619, ivc_loss = 0.0361, neg_loss_1 = 0.0019, neg_loss_2 = 0.0052, ref_loss = 0.0078, intra_loss = 0.0000, div_loss = 0.0055, 0.394 seconds/batch
2025-05-14 22:30:10,813 - merge_alpha: 0.12670065462589264, range_width: 0.3858569264411926
2025-05-14 22:31:26,636 - | R@1,mIoU 0.0936 | R@1,IoU@0.1 0.2977 | R@1,IoU@0.3 0.0970 | R@1,IoU@0.5 0.0372 | R@1,IoU@0.7 0.0100 | R@1,IoU@0.9 0.0010 | R@5,mIoU 0.1974 | R@5,IoU@0.1 0.5694 | R@5,IoU@0.3 0.2079 | R@5,IoU@0.5 0.1017 | R@5,IoU@0.7 0.0442 | R@5,IoU@0.9 0.0060 |
2025-05-14 22:31:26,638 - ============================================================
2025-05-14 22:31:26,638 - Start Epoch 27
2025-05-14 22:31:53,449 - Epoch 27, Batch 50, lr = 0.00009, final_loss = 2.4657, nll_loss = 2.3253, ref_nll_loss = 2.6062, ivc_loss = 0.0277, neg_loss_1 = 0.0007, neg_loss_2 = 0.0015, ref_loss = 0.0072, intra_loss = 0.0000, div_loss = 0.0055, 0.536 seconds/batch
2025-05-14 22:32:13,799 - Epoch 27, Batch 100, lr = 0.00009, final_loss = 2.4782, nll_loss = 2.3362, ref_nll_loss = 2.6203, ivc_loss = 0.0318, neg_loss_1 = 0.0013, neg_loss_2 = 0.0029, ref_loss = 0.0070, intra_loss = 0.0000, div_loss = 0.0060, 0.472 seconds/batch
2025-05-14 22:32:31,334 - Epoch 27, Batch 150, lr = 0.00009, final_loss = 2.4864, nll_loss = 2.3475, ref_nll_loss = 2.6252, ivc_loss = 0.0325, neg_loss_1 = 0.0007, neg_loss_2 = 0.0034, ref_loss = 0.0071, intra_loss = 0.0000, div_loss = 0.0063, 0.431 seconds/batch
2025-05-14 22:32:51,974 - Epoch 27, Batch 200, lr = 0.00009, final_loss = 2.5090, nll_loss = 2.3724, ref_nll_loss = 2.6457, ivc_loss = 0.0328, neg_loss_1 = 0.0004, neg_loss_2 = 0.0035, ref_loss = 0.0084, intra_loss = 0.0000, div_loss = 0.0058, 0.427 seconds/batch
2025-05-14 22:33:13,648 - Epoch 27, Batch 250, lr = 0.00009, final_loss = 2.4991, nll_loss = 2.3588, ref_nll_loss = 2.6393, ivc_loss = 0.0288, neg_loss_1 = 0.0006, neg_loss_2 = 0.0030, ref_loss = 0.0061, intra_loss = 0.0000, div_loss = 0.0058, 0.428 seconds/batch
2025-05-14 22:33:28,378 - Epoch 27, Batch 300, lr = 0.00009, final_loss = 2.4697, nll_loss = 2.3304, ref_nll_loss = 2.6090, ivc_loss = 0.0351, neg_loss_1 = 0.0008, neg_loss_2 = 0.0038, ref_loss = 0.0078, intra_loss = 0.0000, div_loss = 0.0066, 0.406 seconds/batch
2025-05-14 22:33:29,412 - Epoch 27, Batch 306, lr = 0.00009, final_loss = 2.5305, nll_loss = 2.3848, ref_nll_loss = 2.6763, ivc_loss = 0.0272, neg_loss_1 = 0.0005, neg_loss_2 = 0.0006, ref_loss = 0.0081, intra_loss = 0.0000, div_loss = 0.0054, 0.401 seconds/batch
2025-05-14 22:33:29,422 - merge_alpha: 0.12678386270999908, range_width: 0.38587233424186707
2025-05-14 22:34:45,563 - | R@1,mIoU 0.0945 | R@1,IoU@0.1 0.2954 | R@1,IoU@0.3 0.0985 | R@1,IoU@0.5 0.0377 | R@1,IoU@0.7 0.0102 | R@1,IoU@0.9 0.0010 | R@5,mIoU 0.2001 | R@5,IoU@0.1 0.5761 | R@5,IoU@0.3 0.2184 | R@5,IoU@0.5 0.1035 | R@5,IoU@0.7 0.0427 | R@5,IoU@0.9 0.0070 |
2025-05-14 22:34:45,565 - ============================================================
2025-05-14 22:34:45,565 - Start Epoch 28
2025-05-14 22:35:10,903 - Epoch 28, Batch 50, lr = 0.00009, final_loss = 2.4358, nll_loss = 2.2965, ref_nll_loss = 2.5751, ivc_loss = 0.0300, neg_loss_1 = 0.0009, neg_loss_2 = 0.0025, ref_loss = 0.0066, intra_loss = 0.0000, div_loss = 0.0060, 0.507 seconds/batch
2025-05-14 22:35:30,604 - Epoch 28, Batch 100, lr = 0.00009, final_loss = 2.4722, nll_loss = 2.3324, ref_nll_loss = 2.6120, ivc_loss = 0.0282, neg_loss_1 = 0.0013, neg_loss_2 = 0.0023, ref_loss = 0.0064, intra_loss = 0.0000, div_loss = 0.0053, 0.450 seconds/batch
2025-05-14 22:35:51,477 - Epoch 28, Batch 150, lr = 0.00009, final_loss = 2.4671, nll_loss = 2.3252, ref_nll_loss = 2.6090, ivc_loss = 0.0355, neg_loss_1 = 0.0011, neg_loss_2 = 0.0029, ref_loss = 0.0071, intra_loss = 0.0000, div_loss = 0.0075, 0.439 seconds/batch
2025-05-14 22:36:09,142 - Epoch 28, Batch 200, lr = 0.00009, final_loss = 2.4854, nll_loss = 2.3395, ref_nll_loss = 2.6312, ivc_loss = 0.0329, neg_loss_1 = 0.0008, neg_loss_2 = 0.0043, ref_loss = 0.0064, intra_loss = 0.0000, div_loss = 0.0062, 0.418 seconds/batch
2025-05-14 22:36:28,375 - Epoch 28, Batch 250, lr = 0.00009, final_loss = 2.4835, nll_loss = 2.3500, ref_nll_loss = 2.6170, ivc_loss = 0.0311, neg_loss_1 = 0.0009, neg_loss_2 = 0.0030, ref_loss = 0.0082, intra_loss = 0.0000, div_loss = 0.0052, 0.411 seconds/batch
2025-05-14 22:36:44,715 - Epoch 28, Batch 300, lr = 0.00009, final_loss = 2.5028, nll_loss = 2.3625, ref_nll_loss = 2.6431, ivc_loss = 0.0315, neg_loss_1 = 0.0010, neg_loss_2 = 0.0026, ref_loss = 0.0084, intra_loss = 0.0000, div_loss = 0.0054, 0.397 seconds/batch
2025-05-14 22:36:45,762 - Epoch 28, Batch 306, lr = 0.00009, final_loss = 2.4506, nll_loss = 2.3062, ref_nll_loss = 2.5949, ivc_loss = 0.0258, neg_loss_1 = 0.0003, neg_loss_2 = 0.0014, ref_loss = 0.0059, intra_loss = 0.0000, div_loss = 0.0058, 0.393 seconds/batch
2025-05-14 22:36:45,772 - merge_alpha: 0.12747012078762054, range_width: 0.3844318985939026
2025-05-14 22:38:05,082 - | R@1,mIoU 0.0926 | R@1,IoU@0.1 0.2869 | R@1,IoU@0.3 0.0970 | R@1,IoU@0.5 0.0382 | R@1,IoU@0.7 0.0112 | R@1,IoU@0.9 0.0010 | R@5,mIoU 0.1990 | R@5,IoU@0.1 0.5731 | R@5,IoU@0.3 0.2154 | R@5,IoU@0.5 0.1017 | R@5,IoU@0.7 0.0442 | R@5,IoU@0.9 0.0050 |
2025-05-14 22:38:05,085 - ============================================================
2025-05-14 22:38:05,085 - Start Epoch 29
2025-05-14 22:38:31,928 - Epoch 29, Batch 50, lr = 0.00009, final_loss = 2.4492, nll_loss = 2.3048, ref_nll_loss = 2.5936, ivc_loss = 0.0288, neg_loss_1 = 0.0008, neg_loss_2 = 0.0031, ref_loss = 0.0062, intra_loss = 0.0000, div_loss = 0.0055, 0.537 seconds/batch
2025-05-14 22:38:51,387 - Epoch 29, Batch 100, lr = 0.00009, final_loss = 2.4545, nll_loss = 2.3109, ref_nll_loss = 2.5982, ivc_loss = 0.0316, neg_loss_1 = 0.0010, neg_loss_2 = 0.0041, ref_loss = 0.0070, intra_loss = 0.0000, div_loss = 0.0053, 0.463 seconds/batch
2025-05-14 22:39:11,234 - Epoch 29, Batch 150, lr = 0.00009, final_loss = 2.4422, nll_loss = 2.2953, ref_nll_loss = 2.5891, ivc_loss = 0.0266, neg_loss_1 = 0.0008, neg_loss_2 = 0.0020, ref_loss = 0.0063, intra_loss = 0.0000, div_loss = 0.0052, 0.441 seconds/batch
2025-05-14 22:39:29,475 - Epoch 29, Batch 200, lr = 0.00009, final_loss = 2.4851, nll_loss = 2.3444, ref_nll_loss = 2.6258, ivc_loss = 0.0282, neg_loss_1 = 0.0003, neg_loss_2 = 0.0027, ref_loss = 0.0074, intra_loss = 0.0000, div_loss = 0.0050, 0.422 seconds/batch
2025-05-14 22:39:46,697 - Epoch 29, Batch 250, lr = 0.00009, final_loss = 2.4689, nll_loss = 2.3294, ref_nll_loss = 2.6085, ivc_loss = 0.0323, neg_loss_1 = 0.0017, neg_loss_2 = 0.0030, ref_loss = 0.0081, intra_loss = 0.0000, div_loss = 0.0053, 0.406 seconds/batch
2025-05-14 22:40:05,531 - Epoch 29, Batch 300, lr = 0.00008, final_loss = 2.4798, nll_loss = 2.3346, ref_nll_loss = 2.6250, ivc_loss = 0.0320, neg_loss_1 = 0.0016, neg_loss_2 = 0.0026, ref_loss = 0.0071, intra_loss = 0.0000, div_loss = 0.0060, 0.401 seconds/batch
2025-05-14 22:40:06,565 - Epoch 29, Batch 306, lr = 0.00008, final_loss = 2.4665, nll_loss = 2.3279, ref_nll_loss = 2.6050, ivc_loss = 0.0346, neg_loss_1 = 0.0018, neg_loss_2 = 0.0016, ref_loss = 0.0089, intra_loss = 0.0000, div_loss = 0.0065, 0.397 seconds/batch
2025-05-14 22:40:06,574 - merge_alpha: 0.12866537272930145, range_width: 0.38888853788375854
2025-05-14 22:41:26,133 - | R@1,mIoU 0.0910 | R@1,IoU@0.1 0.2869 | R@1,IoU@0.3 0.0965 | R@1,IoU@0.5 0.0382 | R@1,IoU@0.7 0.0090 | R@1,IoU@0.9 0.0000 | R@5,mIoU 0.2011 | R@5,IoU@0.1 0.5734 | R@5,IoU@0.3 0.2197 | R@5,IoU@0.5 0.1075 | R@5,IoU@0.7 0.0442 | R@5,IoU@0.9 0.0057 |
2025-05-14 22:41:26,136 - ============================================================
2025-05-14 22:41:26,136 - Start Epoch 30
2025-05-14 22:41:52,322 - Epoch 30, Batch 50, lr = 0.00008, final_loss = 2.4653, nll_loss = 2.3215, ref_nll_loss = 2.6091, ivc_loss = 0.0300, neg_loss_1 = 0.0010, neg_loss_2 = 0.0026, ref_loss = 0.0067, intra_loss = 0.0000, div_loss = 0.0058, 0.524 seconds/batch
2025-05-14 22:42:10,909 - Epoch 30, Batch 100, lr = 0.00008, final_loss = 2.4282, nll_loss = 2.2834, ref_nll_loss = 2.5731, ivc_loss = 0.0296, neg_loss_1 = 0.0008, neg_loss_2 = 0.0023, ref_loss = 0.0061, intra_loss = 0.0000, div_loss = 0.0064, 0.448 seconds/batch
2025-05-14 22:42:30,850 - Epoch 30, Batch 150, lr = 0.00008, final_loss = 2.4167, nll_loss = 2.2757, ref_nll_loss = 2.5578, ivc_loss = 0.0305, neg_loss_1 = 0.0009, neg_loss_2 = 0.0021, ref_loss = 0.0072, intra_loss = 0.0000, div_loss = 0.0061, 0.431 seconds/batch
2025-05-14 22:42:49,898 - Epoch 30, Batch 200, lr = 0.00008, final_loss = 2.4561, nll_loss = 2.3123, ref_nll_loss = 2.5998, ivc_loss = 0.0321, neg_loss_1 = 0.0009, neg_loss_2 = 0.0028, ref_loss = 0.0086, intra_loss = 0.0000, div_loss = 0.0055, 0.419 seconds/batch
2025-05-14 22:43:09,510 - Epoch 30, Batch 250, lr = 0.00008, final_loss = 2.4928, nll_loss = 2.3532, ref_nll_loss = 2.6325, ivc_loss = 0.0346, neg_loss_1 = 0.0017, neg_loss_2 = 0.0025, ref_loss = 0.0094, intra_loss = 0.0000, div_loss = 0.0057, 0.413 seconds/batch
2025-05-14 22:43:26,444 - Epoch 30, Batch 300, lr = 0.00008, final_loss = 2.4683, nll_loss = 2.3205, ref_nll_loss = 2.6160, ivc_loss = 0.0267, neg_loss_1 = 0.0006, neg_loss_2 = 0.0023, ref_loss = 0.0055, intra_loss = 0.0000, div_loss = 0.0056, 0.401 seconds/batch
2025-05-14 22:43:27,484 - Epoch 30, Batch 306, lr = 0.00008, final_loss = 2.4968, nll_loss = 2.3624, ref_nll_loss = 2.6312, ivc_loss = 0.0301, neg_loss_1 = 0.0010, neg_loss_2 = 0.0017, ref_loss = 0.0088, intra_loss = 0.0000, div_loss = 0.0051, 0.397 seconds/batch
2025-05-14 22:43:27,494 - merge_alpha: 0.12887847423553467, range_width: 0.38919851183891296
2025-05-14 22:44:43,152 - | R@1,mIoU 0.0929 | R@1,IoU@0.1 0.2947 | R@1,IoU@0.3 0.0915 | R@1,IoU@0.5 0.0327 | R@1,IoU@0.7 0.0085 | R@1,IoU@0.9 0.0012 | R@5,mIoU 0.2018 | R@5,IoU@0.1 0.5796 | R@5,IoU@0.3 0.2174 | R@5,IoU@0.5 0.1082 | R@5,IoU@0.7 0.0452 | R@5,IoU@0.9 0.0067 |
2025-05-14 22:44:43,154 - ============================================================
2025-05-14 22:44:43,154 - Best results:
2025-05-14 22:44:43,154 - | R@1,mIoU 0.0979 | R@1,IoU@0.1 0.3064 | R@1,IoU@0.3 0.1025 | R@1,IoU@0.5 0.0400 | R@1,IoU@0.7 0.0117 | R@1,IoU@0.9 0.0010 | R@5,mIoU 0.1993 | R@5,IoU@0.1 0.5759 | R@5,IoU@0.3 0.2159 | R@5,IoU@0.5 0.1032 | R@5,IoU@0.7 0.0435 | R@5,IoU@0.9 0.0040 |
