2025-05-14 17:55:52,879 - {'dataset': {'dataset': 'Ego4D', 'feature_path': 'ego4d_features_sf.hdf5', 'vocab_size': 2604, 'word_dim': 300, 'frame_dim': 2304, 'max_num_words': 20, 'max_num_frames': 200, 'target_stride': 1, 'train_data': 'data/ego4d/slowfast/slowfast_train.json', 'test_data': 'data/ego4d/slowfast/slowfast_val.json', 'val_data': 'data/ego4d/slowfast/slowfast_val.json', 'vocab_path': 'data/ego4d/slowfast/glove.pkl'}, 'train': {'optimizer': {'lr': 0.0004, 'weight_decay': 0, 'warmup_updates': 400, 'warmup_init_lr': 1e-07}, 'batch_size': 32, 'max_num_epochs': 30, 'model_saved_path': 'checkpoints/Ego4D/8_2025-05-14_17-55-52'}, 'model': {'name': 'PCNet', 'config': {'frames_input_size': 2304, 'words_input_size': 300, 'hidden_size': 256, 'use_negative': True, 'num_props': 8, 'sigma': 9, 'sigma_neg': 9, 'gamma': 0.5, 'dropout': 0.1, 'DualTransformer': {'d_model': 256, 'num_heads': 8, 'num_decoder_layers1': 3, 'num_decoder_layers2': 3, 'dropout': 0.1}, 'num_iteration': 4}}, 'loss': {'margin_1': 0.1, 'margin_2': 0.15, 'cf_margin_1': 0.1, 'cf_margin_2': 0.15, 'lambda': 0.146, 'alpha_1': 1, 'alpha_2': 5, 'inter_lambda': 0.146, 'co_cl_loss': 0.4, 'co_qua_loss': 1.0}, 'vote': False, 'seed': 8}
2025-05-14 17:55:53,507 - train: 10230 samples, test: 3498 samples
2025-05-14 17:55:54,024 - Start Epoch 1
2025-05-14 17:56:07,105 - Epoch 1, Batch 50, lr = 0.00005, final_loss = 7.0963, nll_loss = 7.0555, ref_nll_loss = 7.1371, ivc_loss = 1.4098, neg_loss_1 = 0.0399, neg_loss_2 = 0.0421, ref_loss = 0.0394, intra_loss = 0.6216, div_loss = 0.1334, 0.262 seconds/batch
2025-05-14 17:56:16,592 - Epoch 1, Batch 100, lr = 0.00010, final_loss = 5.5543, nll_loss = 5.5234, ref_nll_loss = 5.5851, ivc_loss = 0.5934, neg_loss_1 = 0.0216, neg_loss_2 = 0.0235, ref_loss = 0.0503, intra_loss = 0.3079, div_loss = 0.0380, 0.226 seconds/batch
2025-05-14 17:56:26,193 - Epoch 1, Batch 150, lr = 0.00015, final_loss = 4.5797, nll_loss = 4.5457, ref_nll_loss = 4.6136, ivc_loss = 0.5882, neg_loss_1 = 0.0261, neg_loss_2 = 0.0228, ref_loss = 0.0456, intra_loss = 0.3385, div_loss = 0.0310, 0.214 seconds/batch
2025-05-14 17:56:35,747 - Epoch 1, Batch 200, lr = 0.00020, final_loss = 4.0059, nll_loss = 3.9654, ref_nll_loss = 4.0464, ivc_loss = 0.4636, neg_loss_1 = 0.0216, neg_loss_2 = 0.0236, ref_loss = 0.0409, intra_loss = 0.2701, div_loss = 0.0215, 0.209 seconds/batch
2025-05-14 17:56:45,120 - Epoch 1, Batch 250, lr = 0.00025, final_loss = 3.6994, nll_loss = 3.6523, ref_nll_loss = 3.7466, ivc_loss = 0.4816, neg_loss_1 = 0.0267, neg_loss_2 = 0.0272, ref_loss = 0.0370, intra_loss = 0.2458, div_loss = 0.0290, 0.204 seconds/batch
2025-05-14 17:56:54,634 - Epoch 1, Batch 300, lr = 0.00030, final_loss = 3.5222, nll_loss = 3.4704, ref_nll_loss = 3.5741, ivc_loss = 0.3695, neg_loss_1 = 0.0280, neg_loss_2 = 0.0277, ref_loss = 0.0342, intra_loss = 0.1802, div_loss = 0.0199, 0.202 seconds/batch
2025-05-14 17:56:57,470 - Epoch 1, Batch 320, lr = 0.00032, final_loss = 3.4465, nll_loss = 3.3927, ref_nll_loss = 3.5003, ivc_loss = 0.3170, neg_loss_1 = 0.0278, neg_loss_2 = 0.0268, ref_loss = 0.0346, intra_loss = 0.1421, div_loss = 0.0172, 0.198 seconds/batch
2025-05-14 17:56:57,476 - merge_alpha: 0.03975914418697357, range_width: 0.2038574367761612
2025-05-14 17:57:14,009 - | R@1,mIoU 0.0187 | R@1,IoU@0.1 0.0469 | R@1,IoU@0.3 0.0114 | R@1,IoU@0.5 0.0034 | R@1,IoU@0.7 0.0009 | R@1,IoU@0.9 0.0003 | R@5,mIoU 0.0440 | R@5,IoU@0.1 0.1098 | R@5,IoU@0.3 0.0252 | R@5,IoU@0.5 0.0100 | R@5,IoU@0.7 0.0043 | R@5,IoU@0.9 0.0006 |
2025-05-14 17:57:14,045 - save model to checkpoints/Ego4D/8_2025-05-14_17-55-52/model-best.pt, num_updates 320.
2025-05-14 17:57:14,045 - Best results have been updated.
2025-05-14 17:57:14,045 - ============================================================
2025-05-14 17:57:14,045 - Start Epoch 2
2025-05-14 17:57:26,209 - Epoch 2, Batch 50, lr = 0.00037, final_loss = 3.4020, nll_loss = 3.3434, ref_nll_loss = 3.4607, ivc_loss = 0.3699, neg_loss_1 = 0.0280, neg_loss_2 = 0.0308, ref_loss = 0.0320, intra_loss = 0.1562, div_loss = 0.0246, 0.243 seconds/batch
2025-05-14 17:57:35,936 - Epoch 2, Batch 100, lr = 0.00039, final_loss = 3.2780, nll_loss = 3.2166, ref_nll_loss = 3.3395, ivc_loss = 0.3088, neg_loss_1 = 0.0300, neg_loss_2 = 0.0259, ref_loss = 0.0314, intra_loss = 0.1308, div_loss = 0.0181, 0.219 seconds/batch
2025-05-14 17:57:45,782 - Epoch 2, Batch 150, lr = 0.00037, final_loss = 3.2197, nll_loss = 3.1621, ref_nll_loss = 3.2774, ivc_loss = 0.2763, neg_loss_1 = 0.0218, neg_loss_2 = 0.0230, ref_loss = 0.0341, intra_loss = 0.1294, div_loss = 0.0136, 0.212 seconds/batch
2025-05-14 17:57:55,589 - Epoch 2, Batch 200, lr = 0.00035, final_loss = 3.2261, nll_loss = 3.1666, ref_nll_loss = 3.2857, ivc_loss = 0.2477, neg_loss_1 = 0.0181, neg_loss_2 = 0.0174, ref_loss = 0.0339, intra_loss = 0.1184, div_loss = 0.0120, 0.208 seconds/batch
2025-05-14 17:58:05,486 - Epoch 2, Batch 250, lr = 0.00034, final_loss = 3.1756, nll_loss = 3.1134, ref_nll_loss = 3.2377, ivc_loss = 0.2362, neg_loss_1 = 0.0100, neg_loss_2 = 0.0113, ref_loss = 0.0365, intra_loss = 0.1359, div_loss = 0.0085, 0.206 seconds/batch
2025-05-14 17:58:14,544 - Epoch 2, Batch 300, lr = 0.00032, final_loss = 3.0994, nll_loss = 3.0386, ref_nll_loss = 3.1602, ivc_loss = 0.2005, neg_loss_1 = 0.0064, neg_loss_2 = 0.0069, ref_loss = 0.0366, intra_loss = 0.0994, div_loss = 0.0102, 0.202 seconds/batch
2025-05-14 17:58:17,437 - Epoch 2, Batch 320, lr = 0.00032, final_loss = 3.1015, nll_loss = 3.0406, ref_nll_loss = 3.1625, ivc_loss = 0.2050, neg_loss_1 = 0.0045, neg_loss_2 = 0.0082, ref_loss = 0.0391, intra_loss = 0.1134, div_loss = 0.0080, 0.198 seconds/batch
2025-05-14 17:58:17,441 - merge_alpha: 0.08676822483539581, range_width: 0.2123255431652069
2025-05-14 17:58:33,489 - | R@1,mIoU 0.0198 | R@1,IoU@0.1 0.0483 | R@1,IoU@0.3 0.0111 | R@1,IoU@0.5 0.0026 | R@1,IoU@0.7 0.0011 | R@1,IoU@0.9 0.0000 | R@5,mIoU 0.0530 | R@5,IoU@0.1 0.1318 | R@5,IoU@0.3 0.0323 | R@5,IoU@0.5 0.0111 | R@5,IoU@0.7 0.0034 | R@5,IoU@0.9 0.0006 |
2025-05-14 17:58:33,876 - save model to checkpoints/Ego4D/8_2025-05-14_17-55-52/model-best.pt, num_updates 640.
2025-05-14 17:58:33,877 - Best results have been updated.
2025-05-14 17:58:33,877 - ============================================================
2025-05-14 17:58:33,877 - Start Epoch 3
2025-05-14 17:58:46,833 - Epoch 3, Batch 50, lr = 0.00030, final_loss = 3.0683, nll_loss = 2.9998, ref_nll_loss = 3.1368, ivc_loss = 0.2042, neg_loss_1 = 0.0088, neg_loss_2 = 0.0080, ref_loss = 0.0332, intra_loss = 0.0948, div_loss = 0.0119, 0.259 seconds/batch
2025-05-14 17:58:56,336 - Epoch 3, Batch 100, lr = 0.00029, final_loss = 3.0234, nll_loss = 2.9555, ref_nll_loss = 3.0913, ivc_loss = 0.1546, neg_loss_1 = 0.0065, neg_loss_2 = 0.0060, ref_loss = 0.0335, intra_loss = 0.0474, div_loss = 0.0122, 0.225 seconds/batch
2025-05-14 17:59:05,841 - Epoch 3, Batch 150, lr = 0.00028, final_loss = 2.9751, nll_loss = 2.9047, ref_nll_loss = 3.0455, ivc_loss = 0.1333, neg_loss_1 = 0.0078, neg_loss_2 = 0.0080, ref_loss = 0.0299, intra_loss = 0.0380, div_loss = 0.0099, 0.213 seconds/batch
2025-05-14 17:59:15,560 - Epoch 3, Batch 200, lr = 0.00028, final_loss = 2.9936, nll_loss = 2.9197, ref_nll_loss = 3.0674, ivc_loss = 0.1330, neg_loss_1 = 0.0076, neg_loss_2 = 0.0084, ref_loss = 0.0296, intra_loss = 0.0373, div_loss = 0.0100, 0.208 seconds/batch
2025-05-14 17:59:25,475 - Epoch 3, Batch 250, lr = 0.00027, final_loss = 2.9976, nll_loss = 2.9204, ref_nll_loss = 3.0748, ivc_loss = 0.1420, neg_loss_1 = 0.0065, neg_loss_2 = 0.0080, ref_loss = 0.0267, intra_loss = 0.0456, div_loss = 0.0111, 0.206 seconds/batch
2025-05-14 17:59:34,491 - Epoch 3, Batch 300, lr = 0.00026, final_loss = 3.0022, nll_loss = 2.9259, ref_nll_loss = 3.0784, ivc_loss = 0.1393, neg_loss_1 = 0.0064, neg_loss_2 = 0.0070, ref_loss = 0.0290, intra_loss = 0.0506, div_loss = 0.0093, 0.202 seconds/batch
2025-05-14 17:59:37,340 - Epoch 3, Batch 320, lr = 0.00026, final_loss = 2.9279, nll_loss = 2.8536, ref_nll_loss = 3.0023, ivc_loss = 0.1506, neg_loss_1 = 0.0061, neg_loss_2 = 0.0049, ref_loss = 0.0274, intra_loss = 0.0596, div_loss = 0.0105, 0.198 seconds/batch
2025-05-14 17:59:37,344 - merge_alpha: 0.11464451998472214, range_width: 0.2304990440607071
2025-05-14 17:59:54,005 - | R@1,mIoU 0.0188 | R@1,IoU@0.1 0.0460 | R@1,IoU@0.3 0.0074 | R@1,IoU@0.5 0.0017 | R@1,IoU@0.7 0.0003 | R@1,IoU@0.9 0.0000 | R@5,mIoU 0.0513 | R@5,IoU@0.1 0.1272 | R@5,IoU@0.3 0.0294 | R@5,IoU@0.5 0.0111 | R@5,IoU@0.7 0.0026 | R@5,IoU@0.9 0.0000 |
2025-05-14 17:59:54,008 - ============================================================
2025-05-14 17:59:54,008 - Start Epoch 4
2025-05-14 18:00:06,170 - Epoch 4, Batch 50, lr = 0.00025, final_loss = 2.9488, nll_loss = 2.8718, ref_nll_loss = 3.0258, ivc_loss = 0.1450, neg_loss_1 = 0.0091, neg_loss_2 = 0.0071, ref_loss = 0.0262, intra_loss = 0.0525, div_loss = 0.0100, 0.243 seconds/batch
2025-05-14 18:00:15,775 - Epoch 4, Batch 100, lr = 0.00025, final_loss = 2.9138, nll_loss = 2.8361, ref_nll_loss = 2.9914, ivc_loss = 0.1227, neg_loss_1 = 0.0087, neg_loss_2 = 0.0068, ref_loss = 0.0248, intra_loss = 0.0401, div_loss = 0.0084, 0.218 seconds/batch
2025-05-14 18:00:25,644 - Epoch 4, Batch 150, lr = 0.00024, final_loss = 2.9162, nll_loss = 2.8383, ref_nll_loss = 2.9942, ivc_loss = 0.1117, neg_loss_1 = 0.0088, neg_loss_2 = 0.0076, ref_loss = 0.0249, intra_loss = 0.0312, div_loss = 0.0079, 0.211 seconds/batch
2025-05-14 18:00:35,374 - Epoch 4, Batch 200, lr = 0.00023, final_loss = 2.8965, nll_loss = 2.8185, ref_nll_loss = 2.9744, ivc_loss = 0.1232, neg_loss_1 = 0.0080, neg_loss_2 = 0.0069, ref_loss = 0.0246, intra_loss = 0.0389, div_loss = 0.0090, 0.207 seconds/batch
2025-05-14 18:00:44,949 - Epoch 4, Batch 250, lr = 0.00023, final_loss = 2.9150, nll_loss = 2.8348, ref_nll_loss = 2.9951, ivc_loss = 0.1129, neg_loss_1 = 0.0078, neg_loss_2 = 0.0071, ref_loss = 0.0251, intra_loss = 0.0374, div_loss = 0.0071, 0.204 seconds/batch
2025-05-14 18:00:54,016 - Epoch 4, Batch 300, lr = 0.00023, final_loss = 2.8676, nll_loss = 2.7886, ref_nll_loss = 2.9467, ivc_loss = 0.1003, neg_loss_1 = 0.0063, neg_loss_2 = 0.0070, ref_loss = 0.0237, intra_loss = 0.0286, div_loss = 0.0070, 0.200 seconds/batch
2025-05-14 18:00:56,880 - Epoch 4, Batch 320, lr = 0.00022, final_loss = 2.8922, nll_loss = 2.8170, ref_nll_loss = 2.9673, ivc_loss = 0.0868, neg_loss_1 = 0.0054, neg_loss_2 = 0.0074, ref_loss = 0.0266, intra_loss = 0.0228, div_loss = 0.0049, 0.196 seconds/batch
2025-05-14 18:00:56,884 - merge_alpha: 0.13639196753501892, range_width: 0.2527869939804077
2025-05-14 18:01:13,094 - | R@1,mIoU 0.0205 | R@1,IoU@0.1 0.0503 | R@1,IoU@0.3 0.0100 | R@1,IoU@0.5 0.0029 | R@1,IoU@0.7 0.0017 | R@1,IoU@0.9 0.0003 | R@5,mIoU 0.0554 | R@5,IoU@0.1 0.1401 | R@5,IoU@0.3 0.0354 | R@5,IoU@0.5 0.0111 | R@5,IoU@0.7 0.0040 | R@5,IoU@0.9 0.0011 |
2025-05-14 18:01:13,192 - save model to checkpoints/Ego4D/8_2025-05-14_17-55-52/model-best.pt, num_updates 1280.
2025-05-14 18:01:13,193 - Best results have been updated.
2025-05-14 18:01:13,193 - ============================================================
2025-05-14 18:01:13,193 - Start Epoch 5
2025-05-14 18:01:25,675 - Epoch 5, Batch 50, lr = 0.00022, final_loss = 2.8699, nll_loss = 2.7891, ref_nll_loss = 2.9507, ivc_loss = 0.1222, neg_loss_1 = 0.0079, neg_loss_2 = 0.0091, ref_loss = 0.0245, intra_loss = 0.0450, div_loss = 0.0071, 0.250 seconds/batch
2025-05-14 18:01:35,371 - Epoch 5, Batch 100, lr = 0.00022, final_loss = 2.8380, nll_loss = 2.7588, ref_nll_loss = 2.9172, ivc_loss = 0.1051, neg_loss_1 = 0.0070, neg_loss_2 = 0.0061, ref_loss = 0.0237, intra_loss = 0.0423, div_loss = 0.0052, 0.222 seconds/batch
2025-05-14 18:01:45,116 - Epoch 5, Batch 150, lr = 0.00021, final_loss = 2.8500, nll_loss = 2.7672, ref_nll_loss = 2.9327, ivc_loss = 0.1170, neg_loss_1 = 0.0080, neg_loss_2 = 0.0076, ref_loss = 0.0240, intra_loss = 0.0325, div_loss = 0.0090, 0.213 seconds/batch
2025-05-14 18:01:54,825 - Epoch 5, Batch 200, lr = 0.00021, final_loss = 2.8276, nll_loss = 2.7476, ref_nll_loss = 2.9076, ivc_loss = 0.1016, neg_loss_1 = 0.0078, neg_loss_2 = 0.0058, ref_loss = 0.0214, intra_loss = 0.0260, div_loss = 0.0081, 0.208 seconds/batch
2025-05-14 18:02:04,310 - Epoch 5, Batch 250, lr = 0.00020, final_loss = 2.8261, nll_loss = 2.7450, ref_nll_loss = 2.9073, ivc_loss = 0.1114, neg_loss_1 = 0.0056, neg_loss_2 = 0.0058, ref_loss = 0.0226, intra_loss = 0.0348, div_loss = 0.0085, 0.204 seconds/batch
2025-05-14 18:02:13,440 - Epoch 5, Batch 300, lr = 0.00020, final_loss = 2.8747, nll_loss = 2.7929, ref_nll_loss = 2.9565, ivc_loss = 0.0876, neg_loss_1 = 0.0034, neg_loss_2 = 0.0059, ref_loss = 0.0214, intra_loss = 0.0348, div_loss = 0.0044, 0.201 seconds/batch
2025-05-14 18:02:16,317 - Epoch 5, Batch 320, lr = 0.00020, final_loss = 2.8676, nll_loss = 2.7925, ref_nll_loss = 2.9427, ivc_loss = 0.0828, neg_loss_1 = 0.0054, neg_loss_2 = 0.0055, ref_loss = 0.0278, intra_loss = 0.0218, div_loss = 0.0045, 0.197 seconds/batch
2025-05-14 18:02:16,320 - merge_alpha: 0.14936357736587524, range_width: 0.2640763521194458
2025-05-14 18:02:33,332 - | R@1,mIoU 0.0206 | R@1,IoU@0.1 0.0543 | R@1,IoU@0.3 0.0091 | R@1,IoU@0.5 0.0020 | R@1,IoU@0.7 0.0003 | R@1,IoU@0.9 0.0000 | R@5,mIoU 0.0551 | R@5,IoU@0.1 0.1409 | R@5,IoU@0.3 0.0320 | R@5,IoU@0.5 0.0109 | R@5,IoU@0.7 0.0029 | R@5,IoU@0.9 0.0009 |
2025-05-14 18:02:33,478 - save model to checkpoints/Ego4D/8_2025-05-14_17-55-52/model-best.pt, num_updates 1600.
2025-05-14 18:02:33,479 - Best results have been updated.
2025-05-14 18:02:33,479 - ============================================================
2025-05-14 18:02:33,479 - Start Epoch 6
2025-05-14 18:02:46,251 - Epoch 6, Batch 50, lr = 0.00020, final_loss = 2.8035, nll_loss = 2.7240, ref_nll_loss = 2.8830, ivc_loss = 0.0894, neg_loss_1 = 0.0064, neg_loss_2 = 0.0052, ref_loss = 0.0229, intra_loss = 0.0267, div_loss = 0.0057, 0.255 seconds/batch
2025-05-14 18:02:56,062 - Epoch 6, Batch 100, lr = 0.00019, final_loss = 2.7925, nll_loss = 2.7106, ref_nll_loss = 2.8745, ivc_loss = 0.0629, neg_loss_1 = 0.0058, neg_loss_2 = 0.0047, ref_loss = 0.0236, intra_loss = 0.0111, div_loss = 0.0035, 0.226 seconds/batch
2025-05-14 18:03:06,099 - Epoch 6, Batch 150, lr = 0.00019, final_loss = 2.7909, nll_loss = 2.7097, ref_nll_loss = 2.8722, ivc_loss = 0.0576, neg_loss_1 = 0.0050, neg_loss_2 = 0.0062, ref_loss = 0.0219, intra_loss = 0.0106, div_loss = 0.0028, 0.217 seconds/batch
2025-05-14 18:03:15,665 - Epoch 6, Batch 200, lr = 0.00019, final_loss = 2.8188, nll_loss = 2.7351, ref_nll_loss = 2.9025, ivc_loss = 0.0675, neg_loss_1 = 0.0053, neg_loss_2 = 0.0048, ref_loss = 0.0221, intra_loss = 0.0173, div_loss = 0.0036, 0.211 seconds/batch
2025-05-14 18:03:25,565 - Epoch 6, Batch 250, lr = 0.00019, final_loss = 2.7825, nll_loss = 2.6997, ref_nll_loss = 2.8653, ivc_loss = 0.0649, neg_loss_1 = 0.0043, neg_loss_2 = 0.0043, ref_loss = 0.0195, intra_loss = 0.0109, div_loss = 0.0052, 0.208 seconds/batch
2025-05-14 18:03:34,776 - Epoch 6, Batch 300, lr = 0.00018, final_loss = 2.8077, nll_loss = 2.7211, ref_nll_loss = 2.8944, ivc_loss = 0.0606, neg_loss_1 = 0.0043, neg_loss_2 = 0.0043, ref_loss = 0.0193, intra_loss = 0.0161, div_loss = 0.0033, 0.204 seconds/batch
2025-05-14 18:03:37,666 - Epoch 6, Batch 320, lr = 0.00018, final_loss = 2.7587, nll_loss = 2.6816, ref_nll_loss = 2.8359, ivc_loss = 0.0495, neg_loss_1 = 0.0021, neg_loss_2 = 0.0040, ref_loss = 0.0249, intra_loss = 0.0004, div_loss = 0.0036, 0.201 seconds/batch
2025-05-14 18:03:37,670 - merge_alpha: 0.15465624630451202, range_width: 0.25952377915382385
2025-05-14 18:03:53,851 - | R@1,mIoU 0.0210 | R@1,IoU@0.1 0.0546 | R@1,IoU@0.3 0.0114 | R@1,IoU@0.5 0.0023 | R@1,IoU@0.7 0.0006 | R@1,IoU@0.9 0.0003 | R@5,mIoU 0.0553 | R@5,IoU@0.1 0.1401 | R@5,IoU@0.3 0.0343 | R@5,IoU@0.5 0.0120 | R@5,IoU@0.7 0.0037 | R@5,IoU@0.9 0.0009 |
2025-05-14 18:03:54,028 - save model to checkpoints/Ego4D/8_2025-05-14_17-55-52/model-best.pt, num_updates 1920.
2025-05-14 18:03:54,028 - Best results have been updated.
2025-05-14 18:03:54,028 - ============================================================
2025-05-14 18:03:54,029 - Start Epoch 7
2025-05-14 18:04:06,511 - Epoch 7, Batch 50, lr = 0.00018, final_loss = 2.7220, nll_loss = 2.6390, ref_nll_loss = 2.8050, ivc_loss = 0.0863, neg_loss_1 = 0.0051, neg_loss_2 = 0.0036, ref_loss = 0.0207, intra_loss = 0.0192, div_loss = 0.0075, 0.250 seconds/batch
2025-05-14 18:04:16,359 - Epoch 7, Batch 100, lr = 0.00018, final_loss = 2.7668, nll_loss = 2.6823, ref_nll_loss = 2.8514, ivc_loss = 0.0652, neg_loss_1 = 0.0059, neg_loss_2 = 0.0048, ref_loss = 0.0207, intra_loss = 0.0150, div_loss = 0.0038, 0.223 seconds/batch
2025-05-14 18:04:26,391 - Epoch 7, Batch 150, lr = 0.00018, final_loss = 2.7514, nll_loss = 2.6655, ref_nll_loss = 2.8373, ivc_loss = 0.0637, neg_loss_1 = 0.0049, neg_loss_2 = 0.0058, ref_loss = 0.0197, intra_loss = 0.0199, div_loss = 0.0027, 0.216 seconds/batch
2025-05-14 18:04:36,171 - Epoch 7, Batch 200, lr = 0.00017, final_loss = 2.7594, nll_loss = 2.6749, ref_nll_loss = 2.8439, ivc_loss = 0.0695, neg_loss_1 = 0.0047, neg_loss_2 = 0.0047, ref_loss = 0.0193, intra_loss = 0.0221, div_loss = 0.0037, 0.211 seconds/batch
2025-05-14 18:04:45,862 - Epoch 7, Batch 250, lr = 0.00017, final_loss = 2.7928, nll_loss = 2.7129, ref_nll_loss = 2.8728, ivc_loss = 0.0574, neg_loss_1 = 0.0045, neg_loss_2 = 0.0041, ref_loss = 0.0212, intra_loss = 0.0147, div_loss = 0.0026, 0.207 seconds/batch
2025-05-14 18:04:55,005 - Epoch 7, Batch 300, lr = 0.00017, final_loss = 2.7509, nll_loss = 2.6648, ref_nll_loss = 2.8371, ivc_loss = 0.0479, neg_loss_1 = 0.0038, neg_loss_2 = 0.0052, ref_loss = 0.0190, intra_loss = 0.0051, div_loss = 0.0030, 0.203 seconds/batch
2025-05-14 18:04:57,890 - Epoch 7, Batch 320, lr = 0.00017, final_loss = 2.7479, nll_loss = 2.6630, ref_nll_loss = 2.8328, ivc_loss = 0.0512, neg_loss_1 = 0.0050, neg_loss_2 = 0.0022, ref_loss = 0.0187, intra_loss = 0.0065, div_loss = 0.0038, 0.200 seconds/batch
2025-05-14 18:04:57,893 - merge_alpha: 0.15620627999305725, range_width: 0.2629488408565521
2025-05-14 18:05:14,186 - | R@1,mIoU 0.0200 | R@1,IoU@0.1 0.0557 | R@1,IoU@0.3 0.0094 | R@1,IoU@0.5 0.0023 | R@1,IoU@0.7 0.0006 | R@1,IoU@0.9 0.0003 | R@5,mIoU 0.0544 | R@5,IoU@0.1 0.1409 | R@5,IoU@0.3 0.0312 | R@5,IoU@0.5 0.0114 | R@5,IoU@0.7 0.0040 | R@5,IoU@0.9 0.0014 |
2025-05-14 18:05:14,189 - ============================================================
2025-05-14 18:05:14,189 - Start Epoch 8
2025-05-14 18:05:27,016 - Epoch 8, Batch 50, lr = 0.00017, final_loss = 2.6944, nll_loss = 2.6103, ref_nll_loss = 2.7785, ivc_loss = 0.0575, neg_loss_1 = 0.0044, neg_loss_2 = 0.0050, ref_loss = 0.0206, intra_loss = 0.0053, div_loss = 0.0044, 0.257 seconds/batch
2025-05-14 18:05:36,431 - Epoch 8, Batch 100, lr = 0.00017, final_loss = 2.7156, nll_loss = 2.6361, ref_nll_loss = 2.7952, ivc_loss = 0.0643, neg_loss_1 = 0.0046, neg_loss_2 = 0.0046, ref_loss = 0.0219, intra_loss = 0.0038, div_loss = 0.0059, 0.222 seconds/batch
2025-05-14 18:05:46,085 - Epoch 8, Batch 150, lr = 0.00016, final_loss = 2.7270, nll_loss = 2.6420, ref_nll_loss = 2.8119, ivc_loss = 0.0583, neg_loss_1 = 0.0043, neg_loss_2 = 0.0049, ref_loss = 0.0200, intra_loss = 0.0146, div_loss = 0.0029, 0.213 seconds/batch
2025-05-14 18:05:55,598 - Epoch 8, Batch 200, lr = 0.00016, final_loss = 2.7274, nll_loss = 2.6426, ref_nll_loss = 2.8122, ivc_loss = 0.0618, neg_loss_1 = 0.0054, neg_loss_2 = 0.0040, ref_loss = 0.0214, intra_loss = 0.0153, div_loss = 0.0032, 0.207 seconds/batch
2025-05-14 18:06:05,413 - Epoch 8, Batch 250, lr = 0.00016, final_loss = 2.7419, nll_loss = 2.6584, ref_nll_loss = 2.8254, ivc_loss = 0.0466, neg_loss_1 = 0.0031, neg_loss_2 = 0.0043, ref_loss = 0.0180, intra_loss = 0.0049, div_loss = 0.0033, 0.205 seconds/batch
2025-05-14 18:06:14,527 - Epoch 8, Batch 300, lr = 0.00016, final_loss = 2.7384, nll_loss = 2.6548, ref_nll_loss = 2.8219, ivc_loss = 0.0485, neg_loss_1 = 0.0026, neg_loss_2 = 0.0051, ref_loss = 0.0193, intra_loss = 0.0074, div_loss = 0.0028, 0.201 seconds/batch
2025-05-14 18:06:17,422 - Epoch 8, Batch 320, lr = 0.00016, final_loss = 2.7392, nll_loss = 2.6532, ref_nll_loss = 2.8252, ivc_loss = 0.0554, neg_loss_1 = 0.0032, neg_loss_2 = 0.0030, ref_loss = 0.0170, intra_loss = 0.0177, div_loss = 0.0029, 0.198 seconds/batch
2025-05-14 18:06:17,426 - merge_alpha: 0.1600656360387802, range_width: 0.2624022960662842
2025-05-14 18:06:33,609 - | R@1,mIoU 0.0205 | R@1,IoU@0.1 0.0549 | R@1,IoU@0.3 0.0132 | R@1,IoU@0.5 0.0029 | R@1,IoU@0.7 0.0011 | R@1,IoU@0.9 0.0003 | R@5,mIoU 0.0546 | R@5,IoU@0.1 0.1389 | R@5,IoU@0.3 0.0349 | R@5,IoU@0.5 0.0117 | R@5,IoU@0.7 0.0040 | R@5,IoU@0.9 0.0006 |
2025-05-14 18:06:33,611 - ============================================================
2025-05-14 18:06:33,612 - Start Epoch 9
2025-05-14 18:06:46,313 - Epoch 9, Batch 50, lr = 0.00016, final_loss = 2.6746, nll_loss = 2.5911, ref_nll_loss = 2.7582, ivc_loss = 0.0541, neg_loss_1 = 0.0041, neg_loss_2 = 0.0048, ref_loss = 0.0200, intra_loss = 0.0090, div_loss = 0.0032, 0.254 seconds/batch
2025-05-14 18:06:56,002 - Epoch 9, Batch 100, lr = 0.00016, final_loss = 2.6906, nll_loss = 2.6081, ref_nll_loss = 2.7731, ivc_loss = 0.0528, neg_loss_1 = 0.0053, neg_loss_2 = 0.0058, ref_loss = 0.0197, intra_loss = 0.0059, div_loss = 0.0032, 0.224 seconds/batch
2025-05-14 18:07:05,834 - Epoch 9, Batch 150, lr = 0.00015, final_loss = 2.6817, nll_loss = 2.5990, ref_nll_loss = 2.7645, ivc_loss = 0.0655, neg_loss_1 = 0.0051, neg_loss_2 = 0.0044, ref_loss = 0.0198, intra_loss = 0.0137, div_loss = 0.0045, 0.215 seconds/batch
2025-05-14 18:07:15,427 - Epoch 9, Batch 200, lr = 0.00015, final_loss = 2.7167, nll_loss = 2.6351, ref_nll_loss = 2.7983, ivc_loss = 0.0565, neg_loss_1 = 0.0043, neg_loss_2 = 0.0033, ref_loss = 0.0208, intra_loss = 0.0066, div_loss = 0.0043, 0.209 seconds/batch
2025-05-14 18:07:25,037 - Epoch 9, Batch 250, lr = 0.00015, final_loss = 2.7025, nll_loss = 2.6182, ref_nll_loss = 2.7868, ivc_loss = 0.0469, neg_loss_1 = 0.0042, neg_loss_2 = 0.0054, ref_loss = 0.0190, intra_loss = 0.0043, div_loss = 0.0028, 0.206 seconds/batch
2025-05-14 18:07:34,169 - Epoch 9, Batch 300, lr = 0.00015, final_loss = 2.6991, nll_loss = 2.6131, ref_nll_loss = 2.7850, ivc_loss = 0.0758, neg_loss_1 = 0.0046, neg_loss_2 = 0.0043, ref_loss = 0.0176, intra_loss = 0.0127, div_loss = 0.0073, 0.202 seconds/batch
2025-05-14 18:07:37,042 - Epoch 9, Batch 320, lr = 0.00015, final_loss = 2.6756, nll_loss = 2.5963, ref_nll_loss = 2.7549, ivc_loss = 0.0583, neg_loss_1 = 0.0044, neg_loss_2 = 0.0046, ref_loss = 0.0210, intra_loss = 0.0134, div_loss = 0.0030, 0.198 seconds/batch
2025-05-14 18:07:37,046 - merge_alpha: 0.16412852704524994, range_width: 0.26833420991897583
2025-05-14 18:07:53,623 - | R@1,mIoU 0.0213 | R@1,IoU@0.1 0.0540 | R@1,IoU@0.3 0.0123 | R@1,IoU@0.5 0.0020 | R@1,IoU@0.7 0.0006 | R@1,IoU@0.9 0.0000 | R@5,mIoU 0.0547 | R@5,IoU@0.1 0.1372 | R@5,IoU@0.3 0.0343 | R@5,IoU@0.5 0.0123 | R@5,IoU@0.7 0.0031 | R@5,IoU@0.9 0.0003 |
2025-05-14 18:07:53,850 - save model to checkpoints/Ego4D/8_2025-05-14_17-55-52/model-best.pt, num_updates 2880.
2025-05-14 18:07:53,851 - Best results have been updated.
2025-05-14 18:07:53,851 - ============================================================
2025-05-14 18:07:53,851 - Start Epoch 10
2025-05-14 18:08:06,539 - Epoch 10, Batch 50, lr = 0.00015, final_loss = 2.6559, nll_loss = 2.5720, ref_nll_loss = 2.7398, ivc_loss = 0.0560, neg_loss_1 = 0.0048, neg_loss_2 = 0.0039, ref_loss = 0.0181, intra_loss = 0.0123, div_loss = 0.0034, 0.254 seconds/batch
2025-05-14 18:08:15,987 - Epoch 10, Batch 100, lr = 0.00015, final_loss = 2.6492, nll_loss = 2.5647, ref_nll_loss = 2.7338, ivc_loss = 0.0648, neg_loss_1 = 0.0040, neg_loss_2 = 0.0057, ref_loss = 0.0193, intra_loss = 0.0120, div_loss = 0.0047, 0.221 seconds/batch
2025-05-14 18:08:25,537 - Epoch 10, Batch 150, lr = 0.00015, final_loss = 2.6753, nll_loss = 2.5924, ref_nll_loss = 2.7583, ivc_loss = 0.0696, neg_loss_1 = 0.0048, neg_loss_2 = 0.0049, ref_loss = 0.0206, intra_loss = 0.0141, div_loss = 0.0051, 0.211 seconds/batch
2025-05-14 18:08:35,293 - Epoch 10, Batch 200, lr = 0.00014, final_loss = 2.6636, nll_loss = 2.5778, ref_nll_loss = 2.7494, ivc_loss = 0.0451, neg_loss_1 = 0.0039, neg_loss_2 = 0.0043, ref_loss = 0.0177, intra_loss = 0.0033, div_loss = 0.0032, 0.207 seconds/batch
2025-05-14 18:08:44,685 - Epoch 10, Batch 250, lr = 0.00014, final_loss = 2.6626, nll_loss = 2.5774, ref_nll_loss = 2.7478, ivc_loss = 0.0557, neg_loss_1 = 0.0036, neg_loss_2 = 0.0046, ref_loss = 0.0173, intra_loss = 0.0146, div_loss = 0.0031, 0.203 seconds/batch
2025-05-14 18:08:54,153 - Epoch 10, Batch 300, lr = 0.00014, final_loss = 2.6807, nll_loss = 2.5968, ref_nll_loss = 2.7647, ivc_loss = 0.0653, neg_loss_1 = 0.0065, neg_loss_2 = 0.0058, ref_loss = 0.0204, intra_loss = 0.0197, div_loss = 0.0026, 0.201 seconds/batch
2025-05-14 18:08:57,038 - Epoch 10, Batch 320, lr = 0.00014, final_loss = 2.6940, nll_loss = 2.6143, ref_nll_loss = 2.7737, ivc_loss = 0.0391, neg_loss_1 = 0.0052, neg_loss_2 = 0.0021, ref_loss = 0.0192, intra_loss = 0.0004, div_loss = 0.0024, 0.197 seconds/batch
2025-05-14 18:08:57,041 - merge_alpha: 0.16579106450080872, range_width: 0.2725203037261963
2025-05-14 18:09:13,045 - | R@1,mIoU 0.0208 | R@1,IoU@0.1 0.0560 | R@1,IoU@0.3 0.0123 | R@1,IoU@0.5 0.0026 | R@1,IoU@0.7 0.0006 | R@1,IoU@0.9 0.0000 | R@5,mIoU 0.0561 | R@5,IoU@0.1 0.1412 | R@5,IoU@0.3 0.0360 | R@5,IoU@0.5 0.0123 | R@5,IoU@0.7 0.0046 | R@5,IoU@0.9 0.0009 |
2025-05-14 18:09:13,047 - ============================================================
2025-05-14 18:09:13,047 - Start Epoch 11
2025-05-14 18:09:25,840 - Epoch 11, Batch 50, lr = 0.00014, final_loss = 2.6238, nll_loss = 2.5405, ref_nll_loss = 2.7072, ivc_loss = 0.0526, neg_loss_1 = 0.0049, neg_loss_2 = 0.0050, ref_loss = 0.0197, intra_loss = 0.0065, div_loss = 0.0033, 0.256 seconds/batch
2025-05-14 18:09:35,287 - Epoch 11, Batch 100, lr = 0.00014, final_loss = 2.6671, nll_loss = 2.5797, ref_nll_loss = 2.7545, ivc_loss = 0.0578, neg_loss_1 = 0.0062, neg_loss_2 = 0.0076, ref_loss = 0.0204, intra_loss = 0.0113, div_loss = 0.0025, 0.222 seconds/batch
2025-05-14 18:09:45,082 - Epoch 11, Batch 150, lr = 0.00014, final_loss = 2.6495, nll_loss = 2.5670, ref_nll_loss = 2.7320, ivc_loss = 0.0582, neg_loss_1 = 0.0038, neg_loss_2 = 0.0045, ref_loss = 0.0219, intra_loss = 0.0133, div_loss = 0.0029, 0.214 seconds/batch
2025-05-14 18:09:54,677 - Epoch 11, Batch 200, lr = 0.00014, final_loss = 2.6381, nll_loss = 2.5531, ref_nll_loss = 2.7232, ivc_loss = 0.0464, neg_loss_1 = 0.0042, neg_loss_2 = 0.0037, ref_loss = 0.0186, intra_loss = 0.0029, div_loss = 0.0034, 0.208 seconds/batch
2025-05-14 18:10:04,449 - Epoch 11, Batch 250, lr = 0.00014, final_loss = 2.6386, nll_loss = 2.5583, ref_nll_loss = 2.7189, ivc_loss = 0.0734, neg_loss_1 = 0.0062, neg_loss_2 = 0.0040, ref_loss = 0.0212, intra_loss = 0.0020, div_loss = 0.0080, 0.206 seconds/batch
2025-05-14 18:10:13,702 - Epoch 11, Batch 300, lr = 0.00014, final_loss = 2.6564, nll_loss = 2.5719, ref_nll_loss = 2.7408, ivc_loss = 0.0534, neg_loss_1 = 0.0054, neg_loss_2 = 0.0057, ref_loss = 0.0184, intra_loss = 0.0080, div_loss = 0.0032, 0.202 seconds/batch
2025-05-14 18:10:16,600 - Epoch 11, Batch 320, lr = 0.00013, final_loss = 2.6587, nll_loss = 2.5763, ref_nll_loss = 2.7410, ivc_loss = 0.0684, neg_loss_1 = 0.0043, neg_loss_2 = 0.0024, ref_loss = 0.0189, intra_loss = 0.0119, div_loss = 0.0062, 0.199 seconds/batch
2025-05-14 18:10:16,604 - merge_alpha: 0.16789494454860687, range_width: 0.27837130427360535
2025-05-14 18:10:33,286 - | R@1,mIoU 0.0213 | R@1,IoU@0.1 0.0566 | R@1,IoU@0.3 0.0100 | R@1,IoU@0.5 0.0023 | R@1,IoU@0.7 0.0014 | R@1,IoU@0.9 0.0000 | R@5,mIoU 0.0559 | R@5,IoU@0.1 0.1412 | R@5,IoU@0.3 0.0329 | R@5,IoU@0.5 0.0123 | R@5,IoU@0.7 0.0040 | R@5,IoU@0.9 0.0003 |
2025-05-14 18:10:33,289 - ============================================================
2025-05-14 18:10:33,289 - Start Epoch 12
2025-05-14 18:10:46,212 - Epoch 12, Batch 50, lr = 0.00013, final_loss = 2.6214, nll_loss = 2.5365, ref_nll_loss = 2.7062, ivc_loss = 0.0480, neg_loss_1 = 0.0059, neg_loss_2 = 0.0059, ref_loss = 0.0196, intra_loss = 0.0032, div_loss = 0.0027, 0.258 seconds/batch
2025-05-14 18:10:56,099 - Epoch 12, Batch 100, lr = 0.00013, final_loss = 2.6302, nll_loss = 2.5449, ref_nll_loss = 2.7154, ivc_loss = 0.0755, neg_loss_1 = 0.0074, neg_loss_2 = 0.0075, ref_loss = 0.0203, intra_loss = 0.0092, div_loss = 0.0062, 0.228 seconds/batch
2025-05-14 18:11:05,647 - Epoch 12, Batch 150, lr = 0.00013, final_loss = 2.6159, nll_loss = 2.5314, ref_nll_loss = 2.7004, ivc_loss = 0.0538, neg_loss_1 = 0.0061, neg_loss_2 = 0.0063, ref_loss = 0.0210, intra_loss = 0.0041, div_loss = 0.0033, 0.216 seconds/batch
2025-05-14 18:11:15,619 - Epoch 12, Batch 200, lr = 0.00013, final_loss = 2.6319, nll_loss = 2.5501, ref_nll_loss = 2.7137, ivc_loss = 0.0539, neg_loss_1 = 0.0064, neg_loss_2 = 0.0045, ref_loss = 0.0223, intra_loss = 0.0064, div_loss = 0.0029, 0.212 seconds/batch
2025-05-14 18:11:25,421 - Epoch 12, Batch 250, lr = 0.00013, final_loss = 2.6201, nll_loss = 2.5370, ref_nll_loss = 2.7032, ivc_loss = 0.0535, neg_loss_1 = 0.0073, neg_loss_2 = 0.0050, ref_loss = 0.0197, intra_loss = 0.0068, div_loss = 0.0029, 0.209 seconds/batch
2025-05-14 18:11:34,696 - Epoch 12, Batch 300, lr = 0.00013, final_loss = 2.6202, nll_loss = 2.5341, ref_nll_loss = 2.7062, ivc_loss = 0.0446, neg_loss_1 = 0.0071, neg_loss_2 = 0.0049, ref_loss = 0.0173, intra_loss = 0.0021, div_loss = 0.0026, 0.205 seconds/batch
2025-05-14 18:11:37,585 - Epoch 12, Batch 320, lr = 0.00013, final_loss = 2.6157, nll_loss = 2.5363, ref_nll_loss = 2.6952, ivc_loss = 0.0514, neg_loss_1 = 0.0079, neg_loss_2 = 0.0068, ref_loss = 0.0204, intra_loss = 0.0036, div_loss = 0.0026, 0.201 seconds/batch
2025-05-14 18:11:37,590 - merge_alpha: 0.17016516625881195, range_width: 0.27967891097068787
2025-05-14 18:11:54,033 - | R@1,mIoU 0.0233 | R@1,IoU@0.1 0.0583 | R@1,IoU@0.3 0.0154 | R@1,IoU@0.5 0.0049 | R@1,IoU@0.7 0.0014 | R@1,IoU@0.9 0.0000 | R@5,mIoU 0.0552 | R@5,IoU@0.1 0.1381 | R@5,IoU@0.3 0.0346 | R@5,IoU@0.5 0.0129 | R@5,IoU@0.7 0.0051 | R@5,IoU@0.9 0.0006 |
2025-05-14 18:11:54,221 - save model to checkpoints/Ego4D/8_2025-05-14_17-55-52/model-best.pt, num_updates 3840.
2025-05-14 18:11:54,221 - Best results have been updated.
2025-05-14 18:11:54,222 - ============================================================
2025-05-14 18:11:54,222 - Start Epoch 13
2025-05-14 18:12:06,867 - Epoch 13, Batch 50, lr = 0.00013, final_loss = 2.5903, nll_loss = 2.5085, ref_nll_loss = 2.6721, ivc_loss = 0.0496, neg_loss_1 = 0.0073, neg_loss_2 = 0.0057, ref_loss = 0.0193, intra_loss = 0.0056, div_loss = 0.0023, 0.253 seconds/batch
2025-05-14 18:12:16,584 - Epoch 13, Batch 100, lr = 0.00013, final_loss = 2.5986, nll_loss = 2.5168, ref_nll_loss = 2.6804, ivc_loss = 0.0572, neg_loss_1 = 0.0058, neg_loss_2 = 0.0072, ref_loss = 0.0223, intra_loss = 0.0037, div_loss = 0.0036, 0.224 seconds/batch
2025-05-14 18:12:26,264 - Epoch 13, Batch 150, lr = 0.00013, final_loss = 2.6124, nll_loss = 2.5286, ref_nll_loss = 2.6963, ivc_loss = 0.0572, neg_loss_1 = 0.0057, neg_loss_2 = 0.0067, ref_loss = 0.0211, intra_loss = 0.0094, div_loss = 0.0029, 0.214 seconds/batch
2025-05-14 18:12:36,063 - Epoch 13, Batch 200, lr = 0.00013, final_loss = 2.5922, nll_loss = 2.5090, ref_nll_loss = 2.6755, ivc_loss = 0.0509, neg_loss_1 = 0.0055, neg_loss_2 = 0.0062, ref_loss = 0.0201, intra_loss = 0.0025, div_loss = 0.0033, 0.209 seconds/batch
2025-05-14 18:12:46,096 - Epoch 13, Batch 250, lr = 0.00013, final_loss = 2.6131, nll_loss = 2.5287, ref_nll_loss = 2.6974, ivc_loss = 0.0611, neg_loss_1 = 0.0067, neg_loss_2 = 0.0063, ref_loss = 0.0204, intra_loss = 0.0124, div_loss = 0.0031, 0.207 seconds/batch
2025-05-14 18:12:55,283 - Epoch 13, Batch 300, lr = 0.00012, final_loss = 2.6210, nll_loss = 2.5355, ref_nll_loss = 2.7066, ivc_loss = 0.0562, neg_loss_1 = 0.0074, neg_loss_2 = 0.0056, ref_loss = 0.0188, intra_loss = 0.0064, div_loss = 0.0036, 0.204 seconds/batch
2025-05-14 18:12:58,242 - Epoch 13, Batch 320, lr = 0.00012, final_loss = 2.6421, nll_loss = 2.5581, ref_nll_loss = 2.7260, ivc_loss = 0.0754, neg_loss_1 = 0.0084, neg_loss_2 = 0.0048, ref_loss = 0.0202, intra_loss = 0.0244, div_loss = 0.0035, 0.200 seconds/batch
2025-05-14 18:12:58,245 - merge_alpha: 0.1701049506664276, range_width: 0.288548082113266
2025-05-14 18:13:14,495 - | R@1,mIoU 0.0232 | R@1,IoU@0.1 0.0620 | R@1,IoU@0.3 0.0149 | R@1,IoU@0.5 0.0040 | R@1,IoU@0.7 0.0014 | R@1,IoU@0.9 0.0003 | R@5,mIoU 0.0566 | R@5,IoU@0.1 0.1409 | R@5,IoU@0.3 0.0383 | R@5,IoU@0.5 0.0117 | R@5,IoU@0.7 0.0043 | R@5,IoU@0.9 0.0006 |
2025-05-14 18:13:14,498 - ============================================================
2025-05-14 18:13:14,498 - Start Epoch 14
2025-05-14 18:13:27,179 - Epoch 14, Batch 50, lr = 0.00012, final_loss = 2.5751, nll_loss = 2.4882, ref_nll_loss = 2.6620, ivc_loss = 0.0571, neg_loss_1 = 0.0052, neg_loss_2 = 0.0060, ref_loss = 0.0184, intra_loss = 0.0093, div_loss = 0.0037, 0.254 seconds/batch
2025-05-14 18:13:36,605 - Epoch 14, Batch 100, lr = 0.00012, final_loss = 2.5829, nll_loss = 2.4994, ref_nll_loss = 2.6665, ivc_loss = 0.0523, neg_loss_1 = 0.0074, neg_loss_2 = 0.0063, ref_loss = 0.0193, intra_loss = 0.0043, div_loss = 0.0030, 0.221 seconds/batch
2025-05-14 18:13:46,283 - Epoch 14, Batch 150, lr = 0.00012, final_loss = 2.5929, nll_loss = 2.5050, ref_nll_loss = 2.6807, ivc_loss = 0.0476, neg_loss_1 = 0.0057, neg_loss_2 = 0.0044, ref_loss = 0.0188, intra_loss = 0.0060, div_loss = 0.0025, 0.212 seconds/batch
2025-05-14 18:13:56,055 - Epoch 14, Batch 200, lr = 0.00012, final_loss = 2.5703, nll_loss = 2.4865, ref_nll_loss = 2.6540, ivc_loss = 0.0505, neg_loss_1 = 0.0046, neg_loss_2 = 0.0064, ref_loss = 0.0201, intra_loss = 0.0016, div_loss = 0.0036, 0.208 seconds/batch
2025-05-14 18:14:05,868 - Epoch 14, Batch 250, lr = 0.00012, final_loss = 2.5693, nll_loss = 2.4827, ref_nll_loss = 2.6558, ivc_loss = 0.0488, neg_loss_1 = 0.0063, neg_loss_2 = 0.0052, ref_loss = 0.0187, intra_loss = 0.0031, div_loss = 0.0031, 0.205 seconds/batch
2025-05-14 18:14:15,210 - Epoch 14, Batch 300, lr = 0.00012, final_loss = 2.6093, nll_loss = 2.5268, ref_nll_loss = 2.6919, ivc_loss = 0.0558, neg_loss_1 = 0.0068, neg_loss_2 = 0.0067, ref_loss = 0.0205, intra_loss = 0.0038, div_loss = 0.0036, 0.202 seconds/batch
2025-05-14 18:14:18,098 - Epoch 14, Batch 320, lr = 0.00012, final_loss = 2.5733, nll_loss = 2.4913, ref_nll_loss = 2.6554, ivc_loss = 0.0494, neg_loss_1 = 0.0057, neg_loss_2 = 0.0061, ref_loss = 0.0190, intra_loss = 0.0002, div_loss = 0.0037, 0.199 seconds/batch
2025-05-14 18:14:18,102 - merge_alpha: 0.17223383486270905, range_width: 0.2951173782348633
2025-05-14 18:14:34,291 - | R@1,mIoU 0.0236 | R@1,IoU@0.1 0.0589 | R@1,IoU@0.3 0.0140 | R@1,IoU@0.5 0.0057 | R@1,IoU@0.7 0.0023 | R@1,IoU@0.9 0.0000 | R@5,mIoU 0.0561 | R@5,IoU@0.1 0.1409 | R@5,IoU@0.3 0.0346 | R@5,IoU@0.5 0.0134 | R@5,IoU@0.7 0.0046 | R@5,IoU@0.9 0.0003 |
2025-05-14 18:14:34,480 - save model to checkpoints/Ego4D/8_2025-05-14_17-55-52/model-best.pt, num_updates 4480.
2025-05-14 18:14:34,481 - Best results have been updated.
2025-05-14 18:14:34,481 - ============================================================
2025-05-14 18:14:34,481 - Start Epoch 15
2025-05-14 18:14:47,032 - Epoch 15, Batch 50, lr = 0.00012, final_loss = 2.5616, nll_loss = 2.4801, ref_nll_loss = 2.6432, ivc_loss = 0.0524, neg_loss_1 = 0.0070, neg_loss_2 = 0.0054, ref_loss = 0.0200, intra_loss = 0.0061, div_loss = 0.0028, 0.251 seconds/batch
2025-05-14 18:14:56,607 - Epoch 15, Batch 100, lr = 0.00012, final_loss = 2.5522, nll_loss = 2.4707, ref_nll_loss = 2.6337, ivc_loss = 0.0554, neg_loss_1 = 0.0061, neg_loss_2 = 0.0065, ref_loss = 0.0198, intra_loss = 0.0088, div_loss = 0.0028, 0.221 seconds/batch
2025-05-14 18:15:06,488 - Epoch 15, Batch 150, lr = 0.00012, final_loss = 2.5590, nll_loss = 2.4764, ref_nll_loss = 2.6417, ivc_loss = 0.0589, neg_loss_1 = 0.0088, neg_loss_2 = 0.0060, ref_loss = 0.0219, intra_loss = 0.0095, div_loss = 0.0026, 0.213 seconds/batch
2025-05-14 18:15:16,189 - Epoch 15, Batch 200, lr = 0.00012, final_loss = 2.5531, nll_loss = 2.4701, ref_nll_loss = 2.6362, ivc_loss = 0.0529, neg_loss_1 = 0.0062, neg_loss_2 = 0.0068, ref_loss = 0.0206, intra_loss = 0.0044, div_loss = 0.0030, 0.209 seconds/batch
2025-05-14 18:15:25,749 - Epoch 15, Batch 250, lr = 0.00012, final_loss = 2.5845, nll_loss = 2.5001, ref_nll_loss = 2.6689, ivc_loss = 0.0537, neg_loss_1 = 0.0073, neg_loss_2 = 0.0053, ref_loss = 0.0220, intra_loss = 0.0072, div_loss = 0.0024, 0.205 seconds/batch
2025-05-14 18:15:34,870 - Epoch 15, Batch 300, lr = 0.00012, final_loss = 2.5757, nll_loss = 2.4889, ref_nll_loss = 2.6625, ivc_loss = 0.0640, neg_loss_1 = 0.0087, neg_loss_2 = 0.0080, ref_loss = 0.0202, intra_loss = 0.0115, div_loss = 0.0031, 0.201 seconds/batch
2025-05-14 18:15:37,755 - Epoch 15, Batch 320, lr = 0.00012, final_loss = 2.6216, nll_loss = 2.5344, ref_nll_loss = 2.7088, ivc_loss = 0.0482, neg_loss_1 = 0.0052, neg_loss_2 = 0.0062, ref_loss = 0.0185, intra_loss = 0.0001, div_loss = 0.0037, 0.198 seconds/batch
2025-05-14 18:15:37,759 - merge_alpha: 0.17341594398021698, range_width: 0.302003413438797
2025-05-14 18:15:54,645 - | R@1,mIoU 0.0232 | R@1,IoU@0.1 0.0620 | R@1,IoU@0.3 0.0126 | R@1,IoU@0.5 0.0051 | R@1,IoU@0.7 0.0014 | R@1,IoU@0.9 0.0003 | R@5,mIoU 0.0556 | R@5,IoU@0.1 0.1418 | R@5,IoU@0.3 0.0363 | R@5,IoU@0.5 0.0137 | R@5,IoU@0.7 0.0046 | R@5,IoU@0.9 0.0006 |
2025-05-14 18:15:54,648 - ============================================================
2025-05-14 18:15:54,648 - Start Epoch 16
2025-05-14 18:16:07,699 - Epoch 16, Batch 50, lr = 0.00011, final_loss = 2.5286, nll_loss = 2.4444, ref_nll_loss = 2.6129, ivc_loss = 0.0587, neg_loss_1 = 0.0083, neg_loss_2 = 0.0093, ref_loss = 0.0210, intra_loss = 0.0072, div_loss = 0.0026, 0.261 seconds/batch
2025-05-14 18:16:17,460 - Epoch 16, Batch 100, lr = 0.00011, final_loss = 2.5341, nll_loss = 2.4515, ref_nll_loss = 2.6166, ivc_loss = 0.0548, neg_loss_1 = 0.0072, neg_loss_2 = 0.0060, ref_loss = 0.0211, intra_loss = 0.0078, div_loss = 0.0025, 0.228 seconds/batch
2025-05-14 18:16:27,253 - Epoch 16, Batch 150, lr = 0.00011, final_loss = 2.5532, nll_loss = 2.4668, ref_nll_loss = 2.6396, ivc_loss = 0.0583, neg_loss_1 = 0.0059, neg_loss_2 = 0.0076, ref_loss = 0.0182, intra_loss = 0.0128, div_loss = 0.0028, 0.217 seconds/batch
2025-05-14 18:16:37,149 - Epoch 16, Batch 200, lr = 0.00011, final_loss = 2.5600, nll_loss = 2.4777, ref_nll_loss = 2.6423, ivc_loss = 0.0512, neg_loss_1 = 0.0051, neg_loss_2 = 0.0073, ref_loss = 0.0206, intra_loss = 0.0039, div_loss = 0.0029, 0.213 seconds/batch
2025-05-14 18:16:46,639 - Epoch 16, Batch 250, lr = 0.00011, final_loss = 2.5816, nll_loss = 2.5006, ref_nll_loss = 2.6626, ivc_loss = 0.0588, neg_loss_1 = 0.0065, neg_loss_2 = 0.0086, ref_loss = 0.0218, intra_loss = 0.0079, div_loss = 0.0028, 0.208 seconds/batch
2025-05-14 18:16:55,669 - Epoch 16, Batch 300, lr = 0.00011, final_loss = 2.5316, nll_loss = 2.4466, ref_nll_loss = 2.6167, ivc_loss = 0.0522, neg_loss_1 = 0.0082, neg_loss_2 = 0.0064, ref_loss = 0.0212, intra_loss = 0.0024, div_loss = 0.0028, 0.203 seconds/batch
2025-05-14 18:16:58,596 - Epoch 16, Batch 320, lr = 0.00011, final_loss = 2.5776, nll_loss = 2.4970, ref_nll_loss = 2.6583, ivc_loss = 0.0432, neg_loss_1 = 0.0056, neg_loss_2 = 0.0020, ref_loss = 0.0219, intra_loss = 0.0002, div_loss = 0.0027, 0.200 seconds/batch
2025-05-14 18:16:58,602 - merge_alpha: 0.17346584796905518, range_width: 0.3100118041038513
2025-05-14 18:17:15,115 - | R@1,mIoU 0.0241 | R@1,IoU@0.1 0.0629 | R@1,IoU@0.3 0.0152 | R@1,IoU@0.5 0.0054 | R@1,IoU@0.7 0.0011 | R@1,IoU@0.9 0.0006 | R@5,mIoU 0.0563 | R@5,IoU@0.1 0.1418 | R@5,IoU@0.3 0.0380 | R@5,IoU@0.5 0.0146 | R@5,IoU@0.7 0.0043 | R@5,IoU@0.9 0.0009 |
2025-05-14 18:17:15,259 - save model to checkpoints/Ego4D/8_2025-05-14_17-55-52/model-best.pt, num_updates 5120.
2025-05-14 18:17:15,259 - Best results have been updated.
2025-05-14 18:17:15,259 - ============================================================
2025-05-14 18:17:15,259 - Start Epoch 17
2025-05-14 18:17:27,480 - Epoch 17, Batch 50, lr = 0.00011, final_loss = 2.5212, nll_loss = 2.4367, ref_nll_loss = 2.6058, ivc_loss = 0.0540, neg_loss_1 = 0.0100, neg_loss_2 = 0.0091, ref_loss = 0.0222, intra_loss = 0.0003, div_loss = 0.0025, 0.244 seconds/batch
2025-05-14 18:17:37,225 - Epoch 17, Batch 100, lr = 0.00011, final_loss = 2.5102, nll_loss = 2.4265, ref_nll_loss = 2.5938, ivc_loss = 0.0637, neg_loss_1 = 0.0076, neg_loss_2 = 0.0092, ref_loss = 0.0198, intra_loss = 0.0076, div_loss = 0.0039, 0.220 seconds/batch
2025-05-14 18:17:46,888 - Epoch 17, Batch 150, lr = 0.00011, final_loss = 2.5529, nll_loss = 2.4680, ref_nll_loss = 2.6378, ivc_loss = 0.0584, neg_loss_1 = 0.0077, neg_loss_2 = 0.0071, ref_loss = 0.0191, intra_loss = 0.0078, div_loss = 0.0033, 0.211 seconds/batch
2025-05-14 18:17:56,692 - Epoch 17, Batch 200, lr = 0.00011, final_loss = 2.5301, nll_loss = 2.4447, ref_nll_loss = 2.6155, ivc_loss = 0.0478, neg_loss_1 = 0.0074, neg_loss_2 = 0.0056, ref_loss = 0.0199, intra_loss = 0.0023, div_loss = 0.0025, 0.207 seconds/batch
2025-05-14 18:18:06,560 - Epoch 17, Batch 250, lr = 0.00011, final_loss = 2.5369, nll_loss = 2.4533, ref_nll_loss = 2.6205, ivc_loss = 0.0479, neg_loss_1 = 0.0065, neg_loss_2 = 0.0070, ref_loss = 0.0204, intra_loss = 0.0024, div_loss = 0.0023, 0.205 seconds/batch
2025-05-14 18:18:15,638 - Epoch 17, Batch 300, lr = 0.00011, final_loss = 2.5359, nll_loss = 2.4504, ref_nll_loss = 2.6215, ivc_loss = 0.0472, neg_loss_1 = 0.0067, neg_loss_2 = 0.0073, ref_loss = 0.0201, intra_loss = 0.0001, div_loss = 0.0026, 0.201 seconds/batch
2025-05-14 18:18:18,578 - Epoch 17, Batch 320, lr = 0.00011, final_loss = 2.5593, nll_loss = 2.4705, ref_nll_loss = 2.6481, ivc_loss = 0.0627, neg_loss_1 = 0.0086, neg_loss_2 = 0.0097, ref_loss = 0.0188, intra_loss = 0.0001, div_loss = 0.0051, 0.198 seconds/batch
2025-05-14 18:18:18,582 - merge_alpha: 0.17428486049175262, range_width: 0.3128693103790283
2025-05-14 18:18:35,139 - | R@1,mIoU 0.0222 | R@1,IoU@0.1 0.0563 | R@1,IoU@0.3 0.0123 | R@1,IoU@0.5 0.0043 | R@1,IoU@0.7 0.0011 | R@1,IoU@0.9 0.0006 | R@5,mIoU 0.0557 | R@5,IoU@0.1 0.1398 | R@5,IoU@0.3 0.0346 | R@5,IoU@0.5 0.0132 | R@5,IoU@0.7 0.0043 | R@5,IoU@0.9 0.0009 |
2025-05-14 18:18:35,142 - ============================================================
2025-05-14 18:18:35,142 - Start Epoch 18
2025-05-14 18:18:47,967 - Epoch 18, Batch 50, lr = 0.00011, final_loss = 2.5158, nll_loss = 2.4297, ref_nll_loss = 2.6020, ivc_loss = 0.0614, neg_loss_1 = 0.0087, neg_loss_2 = 0.0086, ref_loss = 0.0207, intra_loss = 0.0068, div_loss = 0.0033, 0.257 seconds/batch
2025-05-14 18:18:57,827 - Epoch 18, Batch 100, lr = 0.00011, final_loss = 2.5042, nll_loss = 2.4214, ref_nll_loss = 2.5870, ivc_loss = 0.0575, neg_loss_1 = 0.0078, neg_loss_2 = 0.0097, ref_loss = 0.0223, intra_loss = 0.0035, div_loss = 0.0029, 0.227 seconds/batch
2025-05-14 18:19:07,477 - Epoch 18, Batch 150, lr = 0.00011, final_loss = 2.5332, nll_loss = 2.4474, ref_nll_loss = 2.6190, ivc_loss = 0.0557, neg_loss_1 = 0.0090, neg_loss_2 = 0.0075, ref_loss = 0.0198, intra_loss = 0.0029, div_loss = 0.0033, 0.216 seconds/batch
2025-05-14 18:19:17,406 - Epoch 18, Batch 200, lr = 0.00011, final_loss = 2.5301, nll_loss = 2.4441, ref_nll_loss = 2.6161, ivc_loss = 0.0553, neg_loss_1 = 0.0077, neg_loss_2 = 0.0069, ref_loss = 0.0204, intra_loss = 0.0086, div_loss = 0.0023, 0.211 seconds/batch
2025-05-14 18:19:26,870 - Epoch 18, Batch 250, lr = 0.00011, final_loss = 2.5240, nll_loss = 2.4422, ref_nll_loss = 2.6057, ivc_loss = 0.0522, neg_loss_1 = 0.0072, neg_loss_2 = 0.0092, ref_loss = 0.0226, intra_loss = 0.0002, div_loss = 0.0026, 0.207 seconds/batch
2025-05-14 18:19:36,010 - Epoch 18, Batch 300, lr = 0.00011, final_loss = 2.5122, nll_loss = 2.4260, ref_nll_loss = 2.5985, ivc_loss = 0.0642, neg_loss_1 = 0.0112, neg_loss_2 = 0.0089, ref_loss = 0.0202, intra_loss = 0.0041, div_loss = 0.0040, 0.203 seconds/batch
2025-05-14 18:19:38,898 - Epoch 18, Batch 320, lr = 0.00011, final_loss = 2.5369, nll_loss = 2.4555, ref_nll_loss = 2.6182, ivc_loss = 0.0694, neg_loss_1 = 0.0119, neg_loss_2 = 0.0156, ref_loss = 0.0225, intra_loss = 0.0043, div_loss = 0.0030, 0.199 seconds/batch
2025-05-14 18:19:38,902 - merge_alpha: 0.1744881272315979, range_width: 0.3166930079460144
2025-05-14 18:19:55,363 - | R@1,mIoU 0.0223 | R@1,IoU@0.1 0.0609 | R@1,IoU@0.3 0.0132 | R@1,IoU@0.5 0.0049 | R@1,IoU@0.7 0.0009 | R@1,IoU@0.9 0.0003 | R@5,mIoU 0.0551 | R@5,IoU@0.1 0.1387 | R@5,IoU@0.3 0.0354 | R@5,IoU@0.5 0.0137 | R@5,IoU@0.7 0.0040 | R@5,IoU@0.9 0.0014 |
2025-05-14 18:19:55,366 - ============================================================
2025-05-14 18:19:55,366 - Start Epoch 19
2025-05-14 18:20:07,975 - Epoch 19, Batch 50, lr = 0.00010, final_loss = 2.5005, nll_loss = 2.4149, ref_nll_loss = 2.5862, ivc_loss = 0.0563, neg_loss_1 = 0.0079, neg_loss_2 = 0.0089, ref_loss = 0.0206, intra_loss = 0.0062, div_loss = 0.0025, 0.252 seconds/batch
2025-05-14 18:20:17,421 - Epoch 19, Batch 100, lr = 0.00010, final_loss = 2.4958, nll_loss = 2.4148, ref_nll_loss = 2.5768, ivc_loss = 0.0703, neg_loss_1 = 0.0085, neg_loss_2 = 0.0105, ref_loss = 0.0218, intra_loss = 0.0023, div_loss = 0.0054, 0.221 seconds/batch
2025-05-14 18:20:27,032 - Epoch 19, Batch 150, lr = 0.00010, final_loss = 2.4936, nll_loss = 2.4095, ref_nll_loss = 2.5776, ivc_loss = 0.0605, neg_loss_1 = 0.0078, neg_loss_2 = 0.0091, ref_loss = 0.0206, intra_loss = 0.0054, div_loss = 0.0035, 0.211 seconds/batch
2025-05-14 18:20:37,115 - Epoch 19, Batch 200, lr = 0.00010, final_loss = 2.5033, nll_loss = 2.4170, ref_nll_loss = 2.5897, ivc_loss = 0.0613, neg_loss_1 = 0.0096, neg_loss_2 = 0.0099, ref_loss = 0.0198, intra_loss = 0.0067, div_loss = 0.0030, 0.209 seconds/batch
2025-05-14 18:20:46,854 - Epoch 19, Batch 250, lr = 0.00010, final_loss = 2.4921, nll_loss = 2.4066, ref_nll_loss = 2.5777, ivc_loss = 0.0536, neg_loss_1 = 0.0057, neg_loss_2 = 0.0085, ref_loss = 0.0183, intra_loss = 0.0077, div_loss = 0.0027, 0.206 seconds/batch
2025-05-14 18:20:56,131 - Epoch 19, Batch 300, lr = 0.00010, final_loss = 2.5261, nll_loss = 2.4371, ref_nll_loss = 2.6150, ivc_loss = 0.0557, neg_loss_1 = 0.0074, neg_loss_2 = 0.0094, ref_loss = 0.0182, intra_loss = 0.0099, div_loss = 0.0021, 0.203 seconds/batch
2025-05-14 18:20:59,010 - Epoch 19, Batch 320, lr = 0.00010, final_loss = 2.5276, nll_loss = 2.4420, ref_nll_loss = 2.6132, ivc_loss = 0.0592, neg_loss_1 = 0.0114, neg_loss_2 = 0.0094, ref_loss = 0.0232, intra_loss = 0.0044, div_loss = 0.0022, 0.199 seconds/batch
2025-05-14 18:20:59,014 - merge_alpha: 0.17667032778263092, range_width: 0.3216625154018402
2025-05-14 18:21:14,967 - | R@1,mIoU 0.0234 | R@1,IoU@0.1 0.0606 | R@1,IoU@0.3 0.0132 | R@1,IoU@0.5 0.0046 | R@1,IoU@0.7 0.0014 | R@1,IoU@0.9 0.0003 | R@5,mIoU 0.0570 | R@5,IoU@0.1 0.1435 | R@5,IoU@0.3 0.0363 | R@5,IoU@0.5 0.0149 | R@5,IoU@0.7 0.0046 | R@5,IoU@0.9 0.0011 |
2025-05-14 18:21:14,970 - ============================================================
2025-05-14 18:21:14,970 - Start Epoch 20
2025-05-14 18:21:27,236 - Epoch 20, Batch 50, lr = 0.00010, final_loss = 2.4731, nll_loss = 2.3914, ref_nll_loss = 2.5548, ivc_loss = 0.0536, neg_loss_1 = 0.0091, neg_loss_2 = 0.0092, ref_loss = 0.0223, intra_loss = 0.0002, div_loss = 0.0026, 0.245 seconds/batch
2025-05-14 18:21:36,818 - Epoch 20, Batch 100, lr = 0.00010, final_loss = 2.5002, nll_loss = 2.4151, ref_nll_loss = 2.5853, ivc_loss = 0.0553, neg_loss_1 = 0.0078, neg_loss_2 = 0.0072, ref_loss = 0.0210, intra_loss = 0.0033, div_loss = 0.0032, 0.218 seconds/batch
2025-05-14 18:21:46,839 - Epoch 20, Batch 150, lr = 0.00010, final_loss = 2.4898, nll_loss = 2.4089, ref_nll_loss = 2.5706, ivc_loss = 0.0534, neg_loss_1 = 0.0086, neg_loss_2 = 0.0071, ref_loss = 0.0223, intra_loss = 0.0021, div_loss = 0.0027, 0.212 seconds/batch
2025-05-14 18:21:56,279 - Epoch 20, Batch 200, lr = 0.00010, final_loss = 2.4914, nll_loss = 2.4045, ref_nll_loss = 2.5783, ivc_loss = 0.0573, neg_loss_1 = 0.0095, neg_loss_2 = 0.0099, ref_loss = 0.0193, intra_loss = 0.0060, div_loss = 0.0025, 0.207 seconds/batch
2025-05-14 18:22:05,814 - Epoch 20, Batch 250, lr = 0.00010, final_loss = 2.4876, nll_loss = 2.4038, ref_nll_loss = 2.5714, ivc_loss = 0.0614, neg_loss_1 = 0.0110, neg_loss_2 = 0.0079, ref_loss = 0.0213, intra_loss = 0.0084, div_loss = 0.0026, 0.203 seconds/batch
2025-05-14 18:22:15,027 - Epoch 20, Batch 300, lr = 0.00010, final_loss = 2.4684, nll_loss = 2.3834, ref_nll_loss = 2.5533, ivc_loss = 0.0595, neg_loss_1 = 0.0083, neg_loss_2 = 0.0088, ref_loss = 0.0210, intra_loss = 0.0040, div_loss = 0.0035, 0.200 seconds/batch
2025-05-14 18:22:17,900 - Epoch 20, Batch 320, lr = 0.00010, final_loss = 2.4777, nll_loss = 2.3912, ref_nll_loss = 2.5643, ivc_loss = 0.0640, neg_loss_1 = 0.0056, neg_loss_2 = 0.0099, ref_loss = 0.0196, intra_loss = 0.0095, div_loss = 0.0039, 0.197 seconds/batch
2025-05-14 18:22:17,905 - merge_alpha: 0.1775282323360443, range_width: 0.32788437604904175
2025-05-14 18:22:34,051 - | R@1,mIoU 0.0219 | R@1,IoU@0.1 0.0572 | R@1,IoU@0.3 0.0126 | R@1,IoU@0.5 0.0031 | R@1,IoU@0.7 0.0009 | R@1,IoU@0.9 0.0000 | R@5,mIoU 0.0561 | R@5,IoU@0.1 0.1409 | R@5,IoU@0.3 0.0354 | R@5,IoU@0.5 0.0132 | R@5,IoU@0.7 0.0037 | R@5,IoU@0.9 0.0014 |
2025-05-14 18:22:34,054 - ============================================================
2025-05-14 18:22:34,054 - Start Epoch 21
2025-05-14 18:22:46,618 - Epoch 21, Batch 50, lr = 0.00010, final_loss = 2.4588, nll_loss = 2.3749, ref_nll_loss = 2.5428, ivc_loss = 0.0564, neg_loss_1 = 0.0075, neg_loss_2 = 0.0069, ref_loss = 0.0214, intra_loss = 0.0034, div_loss = 0.0034, 0.251 seconds/batch
2025-05-14 18:22:56,464 - Epoch 21, Batch 100, lr = 0.00010, final_loss = 2.4805, nll_loss = 2.3968, ref_nll_loss = 2.5643, ivc_loss = 0.0503, neg_loss_1 = 0.0057, neg_loss_2 = 0.0080, ref_loss = 0.0215, intra_loss = 0.0001, div_loss = 0.0030, 0.224 seconds/batch
2025-05-14 18:23:05,685 - Epoch 21, Batch 150, lr = 0.00010, final_loss = 2.4805, nll_loss = 2.3945, ref_nll_loss = 2.5666, ivc_loss = 0.0640, neg_loss_1 = 0.0081, neg_loss_2 = 0.0092, ref_loss = 0.0219, intra_loss = 0.0121, div_loss = 0.0026, 0.211 seconds/batch
2025-05-14 18:23:15,303 - Epoch 21, Batch 200, lr = 0.00010, final_loss = 2.4803, nll_loss = 2.3965, ref_nll_loss = 2.5640, ivc_loss = 0.0588, neg_loss_1 = 0.0084, neg_loss_2 = 0.0099, ref_loss = 0.0225, intra_loss = 0.0018, div_loss = 0.0032, 0.206 seconds/batch
2025-05-14 18:23:25,158 - Epoch 21, Batch 250, lr = 0.00010, final_loss = 2.4604, nll_loss = 2.3786, ref_nll_loss = 2.5421, ivc_loss = 0.0566, neg_loss_1 = 0.0103, neg_loss_2 = 0.0105, ref_loss = 0.0218, intra_loss = 0.0014, div_loss = 0.0025, 0.204 seconds/batch
2025-05-14 18:23:34,539 - Epoch 21, Batch 300, lr = 0.00010, final_loss = 2.4919, nll_loss = 2.4083, ref_nll_loss = 2.5756, ivc_loss = 0.0475, neg_loss_1 = 0.0070, neg_loss_2 = 0.0076, ref_loss = 0.0217, intra_loss = 0.0001, div_loss = 0.0022, 0.202 seconds/batch
2025-05-14 18:23:37,441 - Epoch 21, Batch 320, lr = 0.00010, final_loss = 2.4960, nll_loss = 2.4103, ref_nll_loss = 2.5816, ivc_loss = 0.0514, neg_loss_1 = 0.0080, neg_loss_2 = 0.0082, ref_loss = 0.0189, intra_loss = 0.0005, div_loss = 0.0032, 0.198 seconds/batch
2025-05-14 18:23:37,445 - merge_alpha: 0.17755945026874542, range_width: 0.33673930168151855
2025-05-14 18:23:53,940 - | R@1,mIoU 0.0238 | R@1,IoU@0.1 0.0638 | R@1,IoU@0.3 0.0132 | R@1,IoU@0.5 0.0057 | R@1,IoU@0.7 0.0009 | R@1,IoU@0.9 0.0006 | R@5,mIoU 0.0565 | R@5,IoU@0.1 0.1427 | R@5,IoU@0.3 0.0343 | R@5,IoU@0.5 0.0140 | R@5,IoU@0.7 0.0049 | R@5,IoU@0.9 0.0014 |
2025-05-14 18:23:53,943 - ============================================================
2025-05-14 18:23:53,943 - Start Epoch 22
2025-05-14 18:24:06,425 - Epoch 22, Batch 50, lr = 0.00010, final_loss = 2.4348, nll_loss = 2.3474, ref_nll_loss = 2.5222, ivc_loss = 0.0635, neg_loss_1 = 0.0073, neg_loss_2 = 0.0072, ref_loss = 0.0195, intra_loss = 0.0036, div_loss = 0.0052, 0.250 seconds/batch
2025-05-14 18:24:16,237 - Epoch 22, Batch 100, lr = 0.00010, final_loss = 2.4518, nll_loss = 2.3684, ref_nll_loss = 2.5353, ivc_loss = 0.0564, neg_loss_1 = 0.0118, neg_loss_2 = 0.0077, ref_loss = 0.0239, intra_loss = 0.0002, div_loss = 0.0026, 0.223 seconds/batch
2025-05-14 18:24:25,849 - Epoch 22, Batch 150, lr = 0.00010, final_loss = 2.4678, nll_loss = 2.3833, ref_nll_loss = 2.5522, ivc_loss = 0.0581, neg_loss_1 = 0.0082, neg_loss_2 = 0.0076, ref_loss = 0.0228, intra_loss = 0.0015, div_loss = 0.0036, 0.213 seconds/batch
2025-05-14 18:24:35,510 - Epoch 22, Batch 200, lr = 0.00010, final_loss = 2.4827, nll_loss = 2.3964, ref_nll_loss = 2.5689, ivc_loss = 0.0510, neg_loss_1 = 0.0062, neg_loss_2 = 0.0073, ref_loss = 0.0194, intra_loss = 0.0051, div_loss = 0.0026, 0.208 seconds/batch
2025-05-14 18:24:45,063 - Epoch 22, Batch 250, lr = 0.00010, final_loss = 2.4664, nll_loss = 2.3755, ref_nll_loss = 2.5572, ivc_loss = 0.0549, neg_loss_1 = 0.0078, neg_loss_2 = 0.0092, ref_loss = 0.0177, intra_loss = 0.0067, div_loss = 0.0027, 0.204 seconds/batch
2025-05-14 18:24:54,469 - Epoch 22, Batch 300, lr = 0.00010, final_loss = 2.4651, nll_loss = 2.3799, ref_nll_loss = 2.5503, ivc_loss = 0.0551, neg_loss_1 = 0.0082, neg_loss_2 = 0.0089, ref_loss = 0.0217, intra_loss = 0.0033, div_loss = 0.0026, 0.202 seconds/batch
2025-05-14 18:24:57,357 - Epoch 22, Batch 320, lr = 0.00010, final_loss = 2.4572, nll_loss = 2.3734, ref_nll_loss = 2.5410, ivc_loss = 0.0659, neg_loss_1 = 0.0101, neg_loss_2 = 0.0120, ref_loss = 0.0204, intra_loss = 0.0091, div_loss = 0.0029, 0.198 seconds/batch
2025-05-14 18:24:57,361 - merge_alpha: 0.1789141297340393, range_width: 0.3369162678718567
2025-05-14 18:25:13,700 - | R@1,mIoU 0.0239 | R@1,IoU@0.1 0.0612 | R@1,IoU@0.3 0.0157 | R@1,IoU@0.5 0.0060 | R@1,IoU@0.7 0.0017 | R@1,IoU@0.9 0.0006 | R@5,mIoU 0.0561 | R@5,IoU@0.1 0.1421 | R@5,IoU@0.3 0.0343 | R@5,IoU@0.5 0.0132 | R@5,IoU@0.7 0.0046 | R@5,IoU@0.9 0.0009 |
2025-05-14 18:25:13,703 - ============================================================
2025-05-14 18:25:13,703 - Start Epoch 23
2025-05-14 18:25:26,964 - Epoch 23, Batch 50, lr = 0.00010, final_loss = 2.4390, nll_loss = 2.3523, ref_nll_loss = 2.5258, ivc_loss = 0.0594, neg_loss_1 = 0.0097, neg_loss_2 = 0.0096, ref_loss = 0.0206, intra_loss = 0.0078, div_loss = 0.0023, 0.265 seconds/batch
2025-05-14 18:25:37,025 - Epoch 23, Batch 100, lr = 0.00009, final_loss = 2.4669, nll_loss = 2.3819, ref_nll_loss = 2.5519, ivc_loss = 0.0589, neg_loss_1 = 0.0111, neg_loss_2 = 0.0080, ref_loss = 0.0238, intra_loss = 0.0015, div_loss = 0.0029, 0.233 seconds/batch
2025-05-14 18:25:46,901 - Epoch 23, Batch 150, lr = 0.00009, final_loss = 2.4394, nll_loss = 2.3533, ref_nll_loss = 2.5256, ivc_loss = 0.0604, neg_loss_1 = 0.0118, neg_loss_2 = 0.0106, ref_loss = 0.0195, intra_loss = 0.0045, div_loss = 0.0028, 0.221 seconds/batch
2025-05-14 18:25:56,694 - Epoch 23, Batch 200, lr = 0.00009, final_loss = 2.4491, nll_loss = 2.3654, ref_nll_loss = 2.5329, ivc_loss = 0.0607, neg_loss_1 = 0.0099, neg_loss_2 = 0.0095, ref_loss = 0.0231, intra_loss = 0.0024, div_loss = 0.0032, 0.215 seconds/batch
2025-05-14 18:26:06,732 - Epoch 23, Batch 250, lr = 0.00009, final_loss = 2.4486, nll_loss = 2.3624, ref_nll_loss = 2.5347, ivc_loss = 0.0636, neg_loss_1 = 0.0107, neg_loss_2 = 0.0109, ref_loss = 0.0215, intra_loss = 0.0078, div_loss = 0.0025, 0.212 seconds/batch
2025-05-14 18:26:15,927 - Epoch 23, Batch 300, lr = 0.00009, final_loss = 2.4431, nll_loss = 2.3566, ref_nll_loss = 2.5296, ivc_loss = 0.0547, neg_loss_1 = 0.0097, neg_loss_2 = 0.0097, ref_loss = 0.0212, intra_loss = 0.0019, div_loss = 0.0025, 0.207 seconds/batch
2025-05-14 18:26:18,827 - Epoch 23, Batch 320, lr = 0.00009, final_loss = 2.4392, nll_loss = 2.3536, ref_nll_loss = 2.5249, ivc_loss = 0.0628, neg_loss_1 = 0.0137, neg_loss_2 = 0.0124, ref_loss = 0.0200, intra_loss = 0.0043, div_loss = 0.0025, 0.204 seconds/batch
2025-05-14 18:26:18,830 - merge_alpha: 0.17930787801742554, range_width: 0.3409665524959564
2025-05-14 18:26:35,014 - | R@1,mIoU 0.0250 | R@1,IoU@0.1 0.0623 | R@1,IoU@0.3 0.0152 | R@1,IoU@0.5 0.0069 | R@1,IoU@0.7 0.0020 | R@1,IoU@0.9 0.0006 | R@5,mIoU 0.0565 | R@5,IoU@0.1 0.1407 | R@5,IoU@0.3 0.0363 | R@5,IoU@0.5 0.0129 | R@5,IoU@0.7 0.0043 | R@5,IoU@0.9 0.0009 |
2025-05-14 18:26:35,126 - save model to checkpoints/Ego4D/8_2025-05-14_17-55-52/model-best.pt, num_updates 7360.
2025-05-14 18:26:35,126 - Best results have been updated.
2025-05-14 18:26:35,127 - ============================================================
2025-05-14 18:26:35,127 - Start Epoch 24
2025-05-14 18:26:47,863 - Epoch 24, Batch 50, lr = 0.00009, final_loss = 2.4265, nll_loss = 2.3401, ref_nll_loss = 2.5130, ivc_loss = 0.0512, neg_loss_1 = 0.0085, neg_loss_2 = 0.0085, ref_loss = 0.0217, intra_loss = 0.0016, div_loss = 0.0022, 0.255 seconds/batch
2025-05-14 18:26:57,954 - Epoch 24, Batch 100, lr = 0.00009, final_loss = 2.4411, nll_loss = 2.3524, ref_nll_loss = 2.5298, ivc_loss = 0.0517, neg_loss_1 = 0.0082, neg_loss_2 = 0.0090, ref_loss = 0.0212, intra_loss = 0.0017, div_loss = 0.0023, 0.228 seconds/batch
2025-05-14 18:27:07,742 - Epoch 24, Batch 150, lr = 0.00009, final_loss = 2.4406, nll_loss = 2.3572, ref_nll_loss = 2.5239, ivc_loss = 0.0644, neg_loss_1 = 0.0090, neg_loss_2 = 0.0096, ref_loss = 0.0249, intra_loss = 0.0084, div_loss = 0.0025, 0.217 seconds/batch
2025-05-14 18:27:17,312 - Epoch 24, Batch 200, lr = 0.00009, final_loss = 2.4268, nll_loss = 2.3414, ref_nll_loss = 2.5123, ivc_loss = 0.0641, neg_loss_1 = 0.0089, neg_loss_2 = 0.0084, ref_loss = 0.0214, intra_loss = 0.0119, div_loss = 0.0027, 0.211 seconds/batch
2025-05-14 18:27:26,734 - Epoch 24, Batch 250, lr = 0.00009, final_loss = 2.4240, nll_loss = 2.3391, ref_nll_loss = 2.5089, ivc_loss = 0.0554, neg_loss_1 = 0.0101, neg_loss_2 = 0.0080, ref_loss = 0.0212, intra_loss = 0.0028, div_loss = 0.0027, 0.206 seconds/batch
2025-05-14 18:27:35,896 - Epoch 24, Batch 300, lr = 0.00009, final_loss = 2.4273, nll_loss = 2.3398, ref_nll_loss = 2.5149, ivc_loss = 0.0533, neg_loss_1 = 0.0088, neg_loss_2 = 0.0086, ref_loss = 0.0221, intra_loss = 0.0001, div_loss = 0.0027, 0.203 seconds/batch
2025-05-14 18:27:38,805 - Epoch 24, Batch 320, lr = 0.00009, final_loss = 2.4428, nll_loss = 2.3597, ref_nll_loss = 2.5259, ivc_loss = 0.0615, neg_loss_1 = 0.0108, neg_loss_2 = 0.0113, ref_loss = 0.0249, intra_loss = 0.0002, div_loss = 0.0029, 0.199 seconds/batch
2025-05-14 18:27:38,809 - merge_alpha: 0.17928017675876617, range_width: 0.34157535433769226
2025-05-14 18:27:55,315 - | R@1,mIoU 0.0227 | R@1,IoU@0.1 0.0589 | R@1,IoU@0.3 0.0146 | R@1,IoU@0.5 0.0049 | R@1,IoU@0.7 0.0017 | R@1,IoU@0.9 0.0003 | R@5,mIoU 0.0565 | R@5,IoU@0.1 0.1435 | R@5,IoU@0.3 0.0363 | R@5,IoU@0.5 0.0132 | R@5,IoU@0.7 0.0043 | R@5,IoU@0.9 0.0011 |
2025-05-14 18:27:55,318 - ============================================================
2025-05-14 18:27:55,318 - Start Epoch 25
2025-05-14 18:28:08,401 - Epoch 25, Batch 50, lr = 0.00009, final_loss = 2.4001, nll_loss = 2.3166, ref_nll_loss = 2.4835, ivc_loss = 0.0568, neg_loss_1 = 0.0083, neg_loss_2 = 0.0092, ref_loss = 0.0228, intra_loss = 0.0000, div_loss = 0.0033, 0.262 seconds/batch
2025-05-14 18:28:18,336 - Epoch 25, Batch 100, lr = 0.00009, final_loss = 2.4283, nll_loss = 2.3460, ref_nll_loss = 2.5105, ivc_loss = 0.0720, neg_loss_1 = 0.0122, neg_loss_2 = 0.0092, ref_loss = 0.0237, intra_loss = 0.0046, div_loss = 0.0044, 0.230 seconds/batch
2025-05-14 18:28:27,740 - Epoch 25, Batch 150, lr = 0.00009, final_loss = 2.4148, nll_loss = 2.3323, ref_nll_loss = 2.4972, ivc_loss = 0.0645, neg_loss_1 = 0.0092, neg_loss_2 = 0.0119, ref_loss = 0.0242, intra_loss = 0.0035, div_loss = 0.0031, 0.216 seconds/batch
2025-05-14 18:28:37,577 - Epoch 25, Batch 200, lr = 0.00009, final_loss = 2.4237, nll_loss = 2.3385, ref_nll_loss = 2.5090, ivc_loss = 0.0607, neg_loss_1 = 0.0118, neg_loss_2 = 0.0089, ref_loss = 0.0235, intra_loss = 0.0039, div_loss = 0.0025, 0.211 seconds/batch
2025-05-14 18:28:47,367 - Epoch 25, Batch 250, lr = 0.00009, final_loss = 2.4295, nll_loss = 2.3461, ref_nll_loss = 2.5128, ivc_loss = 0.0578, neg_loss_1 = 0.0082, neg_loss_2 = 0.0103, ref_loss = 0.0229, intra_loss = 0.0043, div_loss = 0.0024, 0.208 seconds/batch
2025-05-14 18:28:56,458 - Epoch 25, Batch 300, lr = 0.00009, final_loss = 2.4411, nll_loss = 2.3558, ref_nll_loss = 2.5265, ivc_loss = 0.0616, neg_loss_1 = 0.0115, neg_loss_2 = 0.0090, ref_loss = 0.0238, intra_loss = 0.0050, div_loss = 0.0025, 0.204 seconds/batch
2025-05-14 18:28:59,354 - Epoch 25, Batch 320, lr = 0.00009, final_loss = 2.4104, nll_loss = 2.3215, ref_nll_loss = 2.4994, ivc_loss = 0.0567, neg_loss_1 = 0.0118, neg_loss_2 = 0.0088, ref_loss = 0.0219, intra_loss = 0.0000, div_loss = 0.0028, 0.200 seconds/batch
2025-05-14 18:28:59,358 - merge_alpha: 0.18008814752101898, range_width: 0.34449246525764465
2025-05-14 18:29:15,831 - | R@1,mIoU 0.0234 | R@1,IoU@0.1 0.0640 | R@1,IoU@0.3 0.0140 | R@1,IoU@0.5 0.0037 | R@1,IoU@0.7 0.0009 | R@1,IoU@0.9 0.0003 | R@5,mIoU 0.0553 | R@5,IoU@0.1 0.1392 | R@5,IoU@0.3 0.0357 | R@5,IoU@0.5 0.0126 | R@5,IoU@0.7 0.0037 | R@5,IoU@0.9 0.0011 |
2025-05-14 18:29:15,834 - ============================================================
2025-05-14 18:29:15,834 - Start Epoch 26
2025-05-14 18:29:28,548 - Epoch 26, Batch 50, lr = 0.00009, final_loss = 2.3964, nll_loss = 2.3111, ref_nll_loss = 2.4817, ivc_loss = 0.0623, neg_loss_1 = 0.0092, neg_loss_2 = 0.0089, ref_loss = 0.0230, intra_loss = 0.0016, div_loss = 0.0039, 0.254 seconds/batch
2025-05-14 18:29:38,269 - Epoch 26, Batch 100, lr = 0.00009, final_loss = 2.3787, nll_loss = 2.2890, ref_nll_loss = 2.4683, ivc_loss = 0.0577, neg_loss_1 = 0.0109, neg_loss_2 = 0.0091, ref_loss = 0.0217, intra_loss = 0.0018, div_loss = 0.0028, 0.224 seconds/batch
2025-05-14 18:29:47,898 - Epoch 26, Batch 150, lr = 0.00009, final_loss = 2.3971, nll_loss = 2.3126, ref_nll_loss = 2.4817, ivc_loss = 0.0589, neg_loss_1 = 0.0126, neg_loss_2 = 0.0120, ref_loss = 0.0211, intra_loss = 0.0002, div_loss = 0.0026, 0.214 seconds/batch
2025-05-14 18:29:57,707 - Epoch 26, Batch 200, lr = 0.00009, final_loss = 2.4250, nll_loss = 2.3378, ref_nll_loss = 2.5123, ivc_loss = 0.0604, neg_loss_1 = 0.0099, neg_loss_2 = 0.0124, ref_loss = 0.0218, intra_loss = 0.0018, div_loss = 0.0029, 0.209 seconds/batch
2025-05-14 18:30:07,258 - Epoch 26, Batch 250, lr = 0.00009, final_loss = 2.4220, nll_loss = 2.3354, ref_nll_loss = 2.5086, ivc_loss = 0.0637, neg_loss_1 = 0.0116, neg_loss_2 = 0.0084, ref_loss = 0.0225, intra_loss = 0.0086, div_loss = 0.0025, 0.206 seconds/batch
2025-05-14 18:30:16,467 - Epoch 26, Batch 300, lr = 0.00009, final_loss = 2.4196, nll_loss = 2.3306, ref_nll_loss = 2.5085, ivc_loss = 0.0538, neg_loss_1 = 0.0124, neg_loss_2 = 0.0095, ref_loss = 0.0200, intra_loss = 0.0002, div_loss = 0.0023, 0.202 seconds/batch
2025-05-14 18:30:19,357 - Epoch 26, Batch 320, lr = 0.00009, final_loss = 2.4436, nll_loss = 2.3578, ref_nll_loss = 2.5294, ivc_loss = 0.0557, neg_loss_1 = 0.0102, neg_loss_2 = 0.0095, ref_loss = 0.0189, intra_loss = 0.0000, div_loss = 0.0034, 0.199 seconds/batch
2025-05-14 18:30:19,361 - merge_alpha: 0.17993974685668945, range_width: 0.34817856550216675
2025-05-14 18:30:35,742 - | R@1,mIoU 0.0226 | R@1,IoU@0.1 0.0580 | R@1,IoU@0.3 0.0117 | R@1,IoU@0.5 0.0037 | R@1,IoU@0.7 0.0011 | R@1,IoU@0.9 0.0003 | R@5,mIoU 0.0563 | R@5,IoU@0.1 0.1389 | R@5,IoU@0.3 0.0354 | R@5,IoU@0.5 0.0126 | R@5,IoU@0.7 0.0049 | R@5,IoU@0.9 0.0020 |
2025-05-14 18:30:35,745 - ============================================================
2025-05-14 18:30:35,745 - Start Epoch 27
2025-05-14 18:30:48,600 - Epoch 27, Batch 50, lr = 0.00009, final_loss = 2.3821, nll_loss = 2.2949, ref_nll_loss = 2.4694, ivc_loss = 0.0568, neg_loss_1 = 0.0072, neg_loss_2 = 0.0110, ref_loss = 0.0222, intra_loss = 0.0020, div_loss = 0.0029, 0.257 seconds/batch
2025-05-14 18:30:58,401 - Epoch 27, Batch 100, lr = 0.00009, final_loss = 2.3970, nll_loss = 2.3135, ref_nll_loss = 2.4804, ivc_loss = 0.0712, neg_loss_1 = 0.0109, neg_loss_2 = 0.0071, ref_loss = 0.0252, intra_loss = 0.0027, div_loss = 0.0051, 0.227 seconds/batch
2025-05-14 18:31:08,328 - Epoch 27, Batch 150, lr = 0.00009, final_loss = 2.4047, nll_loss = 2.3178, ref_nll_loss = 2.4916, ivc_loss = 0.0623, neg_loss_1 = 0.0122, neg_loss_2 = 0.0126, ref_loss = 0.0224, intra_loss = 0.0001, div_loss = 0.0030, 0.217 seconds/batch
2025-05-14 18:31:17,928 - Epoch 27, Batch 200, lr = 0.00009, final_loss = 2.4006, nll_loss = 2.3166, ref_nll_loss = 2.4847, ivc_loss = 0.0615, neg_loss_1 = 0.0120, neg_loss_2 = 0.0099, ref_loss = 0.0239, intra_loss = 0.0033, div_loss = 0.0025, 0.211 seconds/batch
2025-05-14 18:31:27,629 - Epoch 27, Batch 250, lr = 0.00009, final_loss = 2.3950, nll_loss = 2.3103, ref_nll_loss = 2.4797, ivc_loss = 0.0579, neg_loss_1 = 0.0107, neg_loss_2 = 0.0094, ref_loss = 0.0229, intra_loss = 0.0017, div_loss = 0.0026, 0.208 seconds/batch
2025-05-14 18:31:36,794 - Epoch 27, Batch 300, lr = 0.00009, final_loss = 2.4184, nll_loss = 2.3351, ref_nll_loss = 2.5018, ivc_loss = 0.0619, neg_loss_1 = 0.0104, neg_loss_2 = 0.0102, ref_loss = 0.0252, intra_loss = 0.0037, div_loss = 0.0025, 0.203 seconds/batch
2025-05-14 18:31:39,684 - Epoch 27, Batch 320, lr = 0.00009, final_loss = 2.3953, nll_loss = 2.3068, ref_nll_loss = 2.4839, ivc_loss = 0.0515, neg_loss_1 = 0.0085, neg_loss_2 = 0.0081, ref_loss = 0.0202, intra_loss = 0.0001, div_loss = 0.0029, 0.200 seconds/batch
2025-05-14 18:31:39,688 - merge_alpha: 0.18153239786624908, range_width: 0.3535858392715454
2025-05-14 18:31:55,641 - | R@1,mIoU 0.0235 | R@1,IoU@0.1 0.0620 | R@1,IoU@0.3 0.0152 | R@1,IoU@0.5 0.0054 | R@1,IoU@0.7 0.0020 | R@1,IoU@0.9 0.0000 | R@5,mIoU 0.0552 | R@5,IoU@0.1 0.1369 | R@5,IoU@0.3 0.0334 | R@5,IoU@0.5 0.0117 | R@5,IoU@0.7 0.0049 | R@5,IoU@0.9 0.0003 |
2025-05-14 18:31:55,644 - ============================================================
2025-05-14 18:31:55,644 - Start Epoch 28
2025-05-14 18:32:08,407 - Epoch 28, Batch 50, lr = 0.00009, final_loss = 2.3847, nll_loss = 2.2984, ref_nll_loss = 2.4710, ivc_loss = 0.0642, neg_loss_1 = 0.0084, neg_loss_2 = 0.0097, ref_loss = 0.0220, intra_loss = 0.0079, div_loss = 0.0032, 0.255 seconds/batch
2025-05-14 18:32:18,044 - Epoch 28, Batch 100, lr = 0.00009, final_loss = 2.3931, nll_loss = 2.3075, ref_nll_loss = 2.4787, ivc_loss = 0.0687, neg_loss_1 = 0.0123, neg_loss_2 = 0.0093, ref_loss = 0.0239, intra_loss = 0.0031, div_loss = 0.0040, 0.224 seconds/batch
2025-05-14 18:32:27,437 - Epoch 28, Batch 150, lr = 0.00009, final_loss = 2.3660, nll_loss = 2.2793, ref_nll_loss = 2.4527, ivc_loss = 0.0583, neg_loss_1 = 0.0128, neg_loss_2 = 0.0110, ref_loss = 0.0212, intra_loss = 0.0016, div_loss = 0.0023, 0.212 seconds/batch
2025-05-14 18:32:36,904 - Epoch 28, Batch 200, lr = 0.00009, final_loss = 2.3965, nll_loss = 2.3103, ref_nll_loss = 2.4826, ivc_loss = 0.0590, neg_loss_1 = 0.0112, neg_loss_2 = 0.0098, ref_loss = 0.0211, intra_loss = 0.0033, div_loss = 0.0027, 0.206 seconds/batch
2025-05-14 18:32:46,544 - Epoch 28, Batch 250, lr = 0.00008, final_loss = 2.3849, nll_loss = 2.2983, ref_nll_loss = 2.4715, ivc_loss = 0.0580, neg_loss_1 = 0.0092, neg_loss_2 = 0.0102, ref_loss = 0.0235, intra_loss = 0.0021, div_loss = 0.0026, 0.204 seconds/batch
2025-05-14 18:32:55,661 - Epoch 28, Batch 300, lr = 0.00008, final_loss = 2.3990, nll_loss = 2.3100, ref_nll_loss = 2.4879, ivc_loss = 0.0561, neg_loss_1 = 0.0115, neg_loss_2 = 0.0091, ref_loss = 0.0219, intra_loss = 0.0002, div_loss = 0.0027, 0.200 seconds/batch
2025-05-14 18:32:58,573 - Epoch 28, Batch 320, lr = 0.00008, final_loss = 2.3871, nll_loss = 2.3005, ref_nll_loss = 2.4737, ivc_loss = 0.0557, neg_loss_1 = 0.0098, neg_loss_2 = 0.0113, ref_loss = 0.0226, intra_loss = 0.0001, div_loss = 0.0024, 0.197 seconds/batch
2025-05-14 18:32:58,577 - merge_alpha: 0.18117381632328033, range_width: 0.3558216392993927
2025-05-14 18:33:14,996 - | R@1,mIoU 0.0231 | R@1,IoU@0.1 0.0612 | R@1,IoU@0.3 0.0137 | R@1,IoU@0.5 0.0046 | R@1,IoU@0.7 0.0017 | R@1,IoU@0.9 0.0003 | R@5,mIoU 0.0559 | R@5,IoU@0.1 0.1389 | R@5,IoU@0.3 0.0360 | R@5,IoU@0.5 0.0129 | R@5,IoU@0.7 0.0046 | R@5,IoU@0.9 0.0011 |
2025-05-14 18:33:14,998 - ============================================================
2025-05-14 18:33:14,998 - Start Epoch 29
2025-05-14 18:33:27,614 - Epoch 29, Batch 50, lr = 0.00008, final_loss = 2.3636, nll_loss = 2.2752, ref_nll_loss = 2.4520, ivc_loss = 0.0577, neg_loss_1 = 0.0095, neg_loss_2 = 0.0101, ref_loss = 0.0211, intra_loss = 0.0052, div_loss = 0.0023, 0.252 seconds/batch
2025-05-14 18:33:37,157 - Epoch 29, Batch 100, lr = 0.00008, final_loss = 2.3826, nll_loss = 2.2939, ref_nll_loss = 2.4712, ivc_loss = 0.0573, neg_loss_1 = 0.0109, neg_loss_2 = 0.0096, ref_loss = 0.0227, intra_loss = 0.0017, div_loss = 0.0025, 0.222 seconds/batch
2025-05-14 18:33:46,900 - Epoch 29, Batch 150, lr = 0.00008, final_loss = 2.3739, nll_loss = 2.2874, ref_nll_loss = 2.4603, ivc_loss = 0.0612, neg_loss_1 = 0.0115, neg_loss_2 = 0.0111, ref_loss = 0.0234, intra_loss = 0.0033, div_loss = 0.0024, 0.213 seconds/batch
2025-05-14 18:33:56,582 - Epoch 29, Batch 200, lr = 0.00008, final_loss = 2.3817, nll_loss = 2.2956, ref_nll_loss = 2.4679, ivc_loss = 0.0623, neg_loss_1 = 0.0100, neg_loss_2 = 0.0119, ref_loss = 0.0224, intra_loss = 0.0042, div_loss = 0.0028, 0.208 seconds/batch
2025-05-14 18:34:05,937 - Epoch 29, Batch 250, lr = 0.00008, final_loss = 2.3780, nll_loss = 2.2958, ref_nll_loss = 2.4601, ivc_loss = 0.0560, neg_loss_1 = 0.0090, neg_loss_2 = 0.0074, ref_loss = 0.0250, intra_loss = 0.0023, div_loss = 0.0025, 0.204 seconds/batch
2025-05-14 18:34:15,166 - Epoch 29, Batch 300, lr = 0.00008, final_loss = 2.3691, nll_loss = 2.2831, ref_nll_loss = 2.4551, ivc_loss = 0.0616, neg_loss_1 = 0.0113, neg_loss_2 = 0.0097, ref_loss = 0.0221, intra_loss = 0.0018, div_loss = 0.0033, 0.201 seconds/batch
2025-05-14 18:34:18,081 - Epoch 29, Batch 320, lr = 0.00008, final_loss = 2.3768, nll_loss = 2.2890, ref_nll_loss = 2.4645, ivc_loss = 0.0680, neg_loss_1 = 0.0107, neg_loss_2 = 0.0132, ref_loss = 0.0200, intra_loss = 0.0095, div_loss = 0.0029, 0.197 seconds/batch
2025-05-14 18:34:18,085 - merge_alpha: 0.1815427839756012, range_width: 0.35331106185913086
2025-05-14 18:34:34,590 - | R@1,mIoU 0.0225 | R@1,IoU@0.1 0.0566 | R@1,IoU@0.3 0.0126 | R@1,IoU@0.5 0.0054 | R@1,IoU@0.7 0.0014 | R@1,IoU@0.9 0.0000 | R@5,mIoU 0.0561 | R@5,IoU@0.1 0.1389 | R@5,IoU@0.3 0.0363 | R@5,IoU@0.5 0.0146 | R@5,IoU@0.7 0.0040 | R@5,IoU@0.9 0.0011 |
2025-05-14 18:34:34,593 - ============================================================
2025-05-14 18:34:34,593 - Start Epoch 30
2025-05-14 18:34:47,380 - Epoch 30, Batch 50, lr = 0.00008, final_loss = 2.3634, nll_loss = 2.2800, ref_nll_loss = 2.4467, ivc_loss = 0.0596, neg_loss_1 = 0.0102, neg_loss_2 = 0.0114, ref_loss = 0.0228, intra_loss = 0.0026, div_loss = 0.0025, 0.256 seconds/batch
2025-05-14 18:34:57,157 - Epoch 30, Batch 100, lr = 0.00008, final_loss = 2.3413, nll_loss = 2.2555, ref_nll_loss = 2.4271, ivc_loss = 0.0626, neg_loss_1 = 0.0124, neg_loss_2 = 0.0106, ref_loss = 0.0230, intra_loss = 0.0014, div_loss = 0.0030, 0.226 seconds/batch
2025-05-14 18:35:06,738 - Epoch 30, Batch 150, lr = 0.00008, final_loss = 2.3666, nll_loss = 2.2792, ref_nll_loss = 2.4540, ivc_loss = 0.0574, neg_loss_1 = 0.0103, neg_loss_2 = 0.0096, ref_loss = 0.0222, intra_loss = 0.0022, div_loss = 0.0026, 0.214 seconds/batch
2025-05-14 18:35:16,446 - Epoch 30, Batch 200, lr = 0.00008, final_loss = 2.3806, nll_loss = 2.2931, ref_nll_loss = 2.4680, ivc_loss = 0.0558, neg_loss_1 = 0.0099, neg_loss_2 = 0.0103, ref_loss = 0.0202, intra_loss = 0.0042, div_loss = 0.0022, 0.209 seconds/batch
2025-05-14 18:35:25,975 - Epoch 30, Batch 250, lr = 0.00008, final_loss = 2.3641, nll_loss = 2.2759, ref_nll_loss = 2.4522, ivc_loss = 0.0592, neg_loss_1 = 0.0087, neg_loss_2 = 0.0085, ref_loss = 0.0226, intra_loss = 0.0058, div_loss = 0.0027, 0.206 seconds/batch
2025-05-14 18:35:35,364 - Epoch 30, Batch 300, lr = 0.00008, final_loss = 2.3540, nll_loss = 2.2659, ref_nll_loss = 2.4421, ivc_loss = 0.0582, neg_loss_1 = 0.0097, neg_loss_2 = 0.0110, ref_loss = 0.0194, intra_loss = 0.0035, div_loss = 0.0029, 0.203 seconds/batch
2025-05-14 18:35:38,252 - Epoch 30, Batch 320, lr = 0.00008, final_loss = 2.3742, nll_loss = 2.2812, ref_nll_loss = 2.4672, ivc_loss = 0.0611, neg_loss_1 = 0.0115, neg_loss_2 = 0.0136, ref_loss = 0.0192, intra_loss = 0.0035, div_loss = 0.0027, 0.199 seconds/batch
2025-05-14 18:35:38,256 - merge_alpha: 0.18226826190948486, range_width: 0.3589574098587036
2025-05-14 18:35:54,813 - | R@1,mIoU 0.0237 | R@1,IoU@0.1 0.0597 | R@1,IoU@0.3 0.0152 | R@1,IoU@0.5 0.0063 | R@1,IoU@0.7 0.0017 | R@1,IoU@0.9 0.0003 | R@5,mIoU 0.0564 | R@5,IoU@0.1 0.1389 | R@5,IoU@0.3 0.0354 | R@5,IoU@0.5 0.0137 | R@5,IoU@0.7 0.0054 | R@5,IoU@0.9 0.0003 |
2025-05-14 18:35:54,815 - ============================================================
2025-05-14 18:35:54,815 - Best results:
2025-05-14 18:35:54,815 - | R@1,mIoU 0.0250 | R@1,IoU@0.1 0.0623 | R@1,IoU@0.3 0.0152 | R@1,IoU@0.5 0.0069 | R@1,IoU@0.7 0.0020 | R@1,IoU@0.9 0.0006 | R@5,mIoU 0.0565 | R@5,IoU@0.1 0.1407 | R@5,IoU@0.3 0.0363 | R@5,IoU@0.5 0.0129 | R@5,IoU@0.7 0.0043 | R@5,IoU@0.9 0.0009 |
