2025-05-14 13:26:12,334 - {'dataset': {'dataset': 'CharadesSTA', 'feature_path': 'i3d_features.hdf5', 'vocab_size': 1111, 'word_dim': 300, 'frame_dim': 1024, 'max_num_words': 20, 'max_num_frames': 200, 'target_stride': 1, 'train_data': 'data/charades/train.json', 'test_data': 'data/charades/test_trivial.json', 'val_data': 'data/charades/test_trivial.json', 'vocab_path': 'data/charades/glove.pkl'}, 'train': {'optimizer': {'lr': 0.0004, 'weight_decay': 0, 'warmup_updates': 400, 'warmup_init_lr': 1e-07}, 'batch_size': 32, 'max_num_epochs': 30, 'model_saved_path': 'checkpoints/CharadesSTA/8_2025-05-14_13-26-12'}, 'model': {'name': 'PCNet', 'config': {'frames_input_size': 1024, 'words_input_size': 300, 'hidden_size': 256, 'use_negative': True, 'num_props': 8, 'sigma': 9, 'sigma_neg': 9, 'gamma': 0.5, 'dropout': 0.1, 'DualTransformer': {'d_model': 256, 'num_heads': 4, 'num_decoder_layers1': 3, 'num_decoder_layers2': 3, 'dropout': 0.1}, 'num_iteration': 4}}, 'loss': {'margin_1': 0.15, 'margin_2': 0.15, 'lambda': 0.146, 'alpha_1': 1, 'alpha_2': 5, 'co_cl_loss': 0.5, 'co_qua_loss': 1.0, 'inter_lambda': 0.146}, 'vote': False, 'seed': 8}
2025-05-14 13:26:12,745 - train: 8281 samples, test: 3096 samples
2025-05-14 13:26:13,149 - Start Epoch 1
2025-05-14 13:26:20,984 - Epoch 1, Batch 50, lr = 0.00005, final_loss = 6.1603, nll_loss = 6.1205, ref_nll_loss = 6.2002, ivc_loss = 1.4146, neg_loss_1 = 0.0633, neg_loss_2 = 0.0477, ref_loss = 0.0791, intra_loss = 0.5672, div_loss = 0.1315, 0.157 seconds/batch
2025-05-14 13:26:27,225 - Epoch 1, Batch 100, lr = 0.00010, final_loss = 4.6834, nll_loss = 4.6491, ref_nll_loss = 4.7177, ivc_loss = 0.8107, neg_loss_1 = 0.0507, neg_loss_2 = 0.0348, ref_loss = 0.0860, intra_loss = 0.2767, div_loss = 0.0725, 0.141 seconds/batch
2025-05-14 13:26:33,565 - Epoch 1, Batch 150, lr = 0.00015, final_loss = 3.9823, nll_loss = 3.9317, ref_nll_loss = 4.0330, ivc_loss = 0.5632, neg_loss_1 = 0.0404, neg_loss_2 = 0.0371, ref_loss = 0.0668, intra_loss = 0.2303, div_loss = 0.0377, 0.136 seconds/batch
2025-05-14 13:26:39,789 - Epoch 1, Batch 200, lr = 0.00020, final_loss = 3.5558, nll_loss = 3.4966, ref_nll_loss = 3.6151, ivc_loss = 0.4559, neg_loss_1 = 0.0445, neg_loss_2 = 0.0360, ref_loss = 0.0623, intra_loss = 0.1950, div_loss = 0.0236, 0.133 seconds/batch
2025-05-14 13:26:45,867 - Epoch 1, Batch 250, lr = 0.00025, final_loss = 3.3515, nll_loss = 3.2831, ref_nll_loss = 3.4198, ivc_loss = 0.3839, neg_loss_1 = 0.0427, neg_loss_2 = 0.0386, ref_loss = 0.0533, intra_loss = 0.1399, div_loss = 0.0219, 0.131 seconds/batch
2025-05-14 13:26:46,969 - Epoch 1, Batch 259, lr = 0.00026, final_loss = 3.2359, nll_loss = 3.1654, ref_nll_loss = 3.3064, ivc_loss = 0.2594, neg_loss_1 = 0.0332, neg_loss_2 = 0.0326, ref_loss = 0.0491, intra_loss = 0.0600, div_loss = 0.0169, 0.131 seconds/batch
2025-05-14 13:26:46,971 - merge_alpha: 0.030738960951566696, range_width: 0.19236372411251068
2025-05-14 13:26:53,084 - | R@1,mIoU 0.3201 | R@1,IoU@0.1 0.5914 | R@1,IoU@0.3 0.4829 | R@1,IoU@0.5 0.3566 | R@1,IoU@0.7 0.1499 | R@1,IoU@0.9 0.0197 | R@5,mIoU 0.6230 | R@5,IoU@0.1 0.9677 | R@5,IoU@0.3 0.9079 | R@5,IoU@0.5 0.7739 | R@5,IoU@0.7 0.4189 | R@5,IoU@0.9 0.0568 |
2025-05-14 13:26:53,105 - save model to checkpoints/CharadesSTA/8_2025-05-14_13-26-12/model-best.pt, num_updates 259.
2025-05-14 13:26:53,105 - Best results have been updated.
2025-05-14 13:26:53,105 - ============================================================
2025-05-14 13:26:53,105 - Start Epoch 2
2025-05-14 13:27:00,126 - Epoch 2, Batch 50, lr = 0.00031, final_loss = 3.1622, nll_loss = 3.0903, ref_nll_loss = 3.2341, ivc_loss = 0.3003, neg_loss_1 = 0.0393, neg_loss_2 = 0.0352, ref_loss = 0.0517, intra_loss = 0.0778, div_loss = 0.0193, 0.140 seconds/batch
2025-05-14 13:27:06,372 - Epoch 2, Batch 100, lr = 0.00036, final_loss = 3.1031, nll_loss = 3.0247, ref_nll_loss = 3.1815, ivc_loss = 0.3199, neg_loss_1 = 0.0343, neg_loss_2 = 0.0345, ref_loss = 0.0468, intra_loss = 0.0892, div_loss = 0.0230, 0.133 seconds/batch
2025-05-14 13:27:12,541 - Epoch 2, Batch 150, lr = 0.00040, final_loss = 3.0188, nll_loss = 2.9346, ref_nll_loss = 3.1031, ivc_loss = 0.2581, neg_loss_1 = 0.0318, neg_loss_2 = 0.0320, ref_loss = 0.0456, intra_loss = 0.0634, div_loss = 0.0171, 0.130 seconds/batch
2025-05-14 13:27:18,713 - Epoch 2, Batch 200, lr = 0.00037, final_loss = 2.9809, nll_loss = 2.8892, ref_nll_loss = 3.0726, ivc_loss = 0.2060, neg_loss_1 = 0.0292, neg_loss_2 = 0.0297, ref_loss = 0.0429, intra_loss = 0.0445, div_loss = 0.0119, 0.128 seconds/batch
2025-05-14 13:27:24,765 - Epoch 2, Batch 250, lr = 0.00035, final_loss = 2.8858, nll_loss = 2.7922, ref_nll_loss = 2.9794, ivc_loss = 0.1819, neg_loss_1 = 0.0264, neg_loss_2 = 0.0215, ref_loss = 0.0400, intra_loss = 0.0350, div_loss = 0.0118, 0.127 seconds/batch
2025-05-14 13:27:25,881 - Epoch 2, Batch 259, lr = 0.00035, final_loss = 2.9127, nll_loss = 2.8275, ref_nll_loss = 2.9979, ivc_loss = 0.1626, neg_loss_1 = 0.0327, neg_loss_2 = 0.0208, ref_loss = 0.0468, intra_loss = 0.0451, div_loss = 0.0034, 0.127 seconds/batch
2025-05-14 13:27:25,884 - merge_alpha: 0.066864974796772, range_width: 0.20253925025463104
2025-05-14 13:27:31,837 - | R@1,mIoU 0.4125 | R@1,IoU@0.1 0.7293 | R@1,IoU@0.3 0.6266 | R@1,IoU@0.5 0.4664 | R@1,IoU@0.7 0.2183 | R@1,IoU@0.9 0.0326 | R@5,mIoU 0.6769 | R@5,IoU@0.1 0.9903 | R@5,IoU@0.3 0.9632 | R@5,IoU@0.5 0.8427 | R@5,IoU@0.7 0.5184 | R@5,IoU@0.9 0.0895 |
2025-05-14 13:27:31,941 - save model to checkpoints/CharadesSTA/8_2025-05-14_13-26-12/model-best.pt, num_updates 518.
2025-05-14 13:27:31,942 - Best results have been updated.
2025-05-14 13:27:31,942 - ============================================================
2025-05-14 13:27:31,942 - Start Epoch 3
2025-05-14 13:27:38,889 - Epoch 3, Batch 50, lr = 0.00034, final_loss = 2.8588, nll_loss = 2.7610, ref_nll_loss = 2.9567, ivc_loss = 0.1151, neg_loss_1 = 0.0229, neg_loss_2 = 0.0197, ref_loss = 0.0366, intra_loss = 0.0150, div_loss = 0.0042, 0.139 seconds/batch
2025-05-14 13:27:45,080 - Epoch 3, Batch 100, lr = 0.00032, final_loss = 2.7810, nll_loss = 2.6805, ref_nll_loss = 2.8815, ivc_loss = 0.1169, neg_loss_1 = 0.0235, neg_loss_2 = 0.0181, ref_loss = 0.0376, intra_loss = 0.0165, div_loss = 0.0042, 0.131 seconds/batch
2025-05-14 13:27:51,363 - Epoch 3, Batch 150, lr = 0.00031, final_loss = 2.8085, nll_loss = 2.7064, ref_nll_loss = 2.9106, ivc_loss = 0.1456, neg_loss_1 = 0.0234, neg_loss_2 = 0.0179, ref_loss = 0.0360, intra_loss = 0.0466, div_loss = 0.0043, 0.129 seconds/batch
2025-05-14 13:27:57,562 - Epoch 3, Batch 200, lr = 0.00030, final_loss = 2.7325, nll_loss = 2.6294, ref_nll_loss = 2.8355, ivc_loss = 0.0989, neg_loss_1 = 0.0190, neg_loss_2 = 0.0146, ref_loss = 0.0330, intra_loss = 0.0124, div_loss = 0.0040, 0.128 seconds/batch
2025-05-14 13:28:03,615 - Epoch 3, Batch 250, lr = 0.00029, final_loss = 2.6842, nll_loss = 2.5802, ref_nll_loss = 2.7882, ivc_loss = 0.1184, neg_loss_1 = 0.0216, neg_loss_2 = 0.0148, ref_loss = 0.0359, intra_loss = 0.0289, div_loss = 0.0034, 0.127 seconds/batch
2025-05-14 13:28:04,719 - Epoch 3, Batch 259, lr = 0.00029, final_loss = 2.7228, nll_loss = 2.6197, ref_nll_loss = 2.8259, ivc_loss = 0.0886, neg_loss_1 = 0.0191, neg_loss_2 = 0.0188, ref_loss = 0.0336, intra_loss = 0.0009, div_loss = 0.0032, 0.127 seconds/batch
2025-05-14 13:28:04,722 - merge_alpha: 0.06408137828111649, range_width: 0.2105385661125183
2025-05-14 13:28:10,831 - | R@1,mIoU 0.4301 | R@1,IoU@0.1 0.7432 | R@1,IoU@0.3 0.6495 | R@1,IoU@0.5 0.4990 | R@1,IoU@0.7 0.2277 | R@1,IoU@0.9 0.0310 | R@5,mIoU 0.6819 | R@5,IoU@0.1 0.9926 | R@5,IoU@0.3 0.9693 | R@5,IoU@0.5 0.8605 | R@5,IoU@0.7 0.5245 | R@5,IoU@0.9 0.0775 |
2025-05-14 13:28:10,956 - save model to checkpoints/CharadesSTA/8_2025-05-14_13-26-12/model-best.pt, num_updates 777.
2025-05-14 13:28:10,956 - Best results have been updated.
2025-05-14 13:28:10,956 - ============================================================
2025-05-14 13:28:10,956 - Start Epoch 4
2025-05-14 13:28:17,973 - Epoch 4, Batch 50, lr = 0.00028, final_loss = 2.6705, nll_loss = 2.5627, ref_nll_loss = 2.7784, ivc_loss = 0.1024, neg_loss_1 = 0.0191, neg_loss_2 = 0.0142, ref_loss = 0.0320, intra_loss = 0.0180, div_loss = 0.0038, 0.140 seconds/batch
2025-05-14 13:28:24,191 - Epoch 4, Batch 100, lr = 0.00027, final_loss = 2.6644, nll_loss = 2.5543, ref_nll_loss = 2.7746, ivc_loss = 0.0840, neg_loss_1 = 0.0178, neg_loss_2 = 0.0138, ref_loss = 0.0302, intra_loss = 0.0075, div_loss = 0.0029, 0.132 seconds/batch
2025-05-14 13:28:30,390 - Epoch 4, Batch 150, lr = 0.00026, final_loss = 2.6797, nll_loss = 2.5709, ref_nll_loss = 2.7885, ivc_loss = 0.1016, neg_loss_1 = 0.0181, neg_loss_2 = 0.0131, ref_loss = 0.0312, intra_loss = 0.0198, div_loss = 0.0039, 0.130 seconds/batch
2025-05-14 13:28:36,571 - Epoch 4, Batch 200, lr = 0.00026, final_loss = 2.6278, nll_loss = 2.5156, ref_nll_loss = 2.7399, ivc_loss = 0.0985, neg_loss_1 = 0.0179, neg_loss_2 = 0.0111, ref_loss = 0.0307, intra_loss = 0.0162, div_loss = 0.0045, 0.128 seconds/batch
2025-05-14 13:28:42,661 - Epoch 4, Batch 250, lr = 0.00025, final_loss = 2.6219, nll_loss = 2.5099, ref_nll_loss = 2.7339, ivc_loss = 0.0960, neg_loss_1 = 0.0200, neg_loss_2 = 0.0141, ref_loss = 0.0311, intra_loss = 0.0140, div_loss = 0.0033, 0.127 seconds/batch
2025-05-14 13:28:43,771 - Epoch 4, Batch 259, lr = 0.00025, final_loss = 2.5980, nll_loss = 2.4887, ref_nll_loss = 2.7072, ivc_loss = 0.1044, neg_loss_1 = 0.0179, neg_loss_2 = 0.0164, ref_loss = 0.0288, intra_loss = 0.0259, div_loss = 0.0031, 0.127 seconds/batch
2025-05-14 13:28:43,774 - merge_alpha: 0.061700865626335144, range_width: 0.21728970110416412
2025-05-14 13:28:49,908 - | R@1,mIoU 0.4446 | R@1,IoU@0.1 0.7700 | R@1,IoU@0.3 0.6712 | R@1,IoU@0.5 0.5113 | R@1,IoU@0.7 0.2387 | R@1,IoU@0.9 0.0339 | R@5,mIoU 0.6880 | R@5,IoU@0.1 0.9952 | R@5,IoU@0.3 0.9745 | R@5,IoU@0.5 0.8689 | R@5,IoU@0.7 0.5310 | R@5,IoU@0.9 0.0885 |
2025-05-14 13:28:50,015 - save model to checkpoints/CharadesSTA/8_2025-05-14_13-26-12/model-best.pt, num_updates 1036.
2025-05-14 13:28:50,016 - Best results have been updated.
2025-05-14 13:28:50,016 - ============================================================
2025-05-14 13:28:50,016 - Start Epoch 5
2025-05-14 13:28:57,030 - Epoch 5, Batch 50, lr = 0.00024, final_loss = 2.5760, nll_loss = 2.4616, ref_nll_loss = 2.6903, ivc_loss = 0.0833, neg_loss_1 = 0.0159, neg_loss_2 = 0.0120, ref_loss = 0.0268, intra_loss = 0.0153, div_loss = 0.0027, 0.140 seconds/batch
2025-05-14 13:29:03,236 - Epoch 5, Batch 100, lr = 0.00024, final_loss = 2.5925, nll_loss = 2.4754, ref_nll_loss = 2.7097, ivc_loss = 0.0770, neg_loss_1 = 0.0161, neg_loss_2 = 0.0105, ref_loss = 0.0280, intra_loss = 0.0071, div_loss = 0.0030, 0.132 seconds/batch
2025-05-14 13:29:09,445 - Epoch 5, Batch 150, lr = 0.00023, final_loss = 2.5720, nll_loss = 2.4609, ref_nll_loss = 2.6831, ivc_loss = 0.0986, neg_loss_1 = 0.0171, neg_loss_2 = 0.0111, ref_loss = 0.0322, intra_loss = 0.0224, div_loss = 0.0032, 0.130 seconds/batch
2025-05-14 13:29:15,650 - Epoch 5, Batch 200, lr = 0.00023, final_loss = 2.5677, nll_loss = 2.4528, ref_nll_loss = 2.6826, ivc_loss = 0.0884, neg_loss_1 = 0.0156, neg_loss_2 = 0.0142, ref_loss = 0.0286, intra_loss = 0.0095, div_loss = 0.0041, 0.128 seconds/batch
2025-05-14 13:29:21,733 - Epoch 5, Batch 250, lr = 0.00022, final_loss = 2.5542, nll_loss = 2.4410, ref_nll_loss = 2.6674, ivc_loss = 0.0934, neg_loss_1 = 0.0167, neg_loss_2 = 0.0119, ref_loss = 0.0301, intra_loss = 0.0193, div_loss = 0.0031, 0.127 seconds/batch
2025-05-14 13:29:22,842 - Epoch 5, Batch 259, lr = 0.00022, final_loss = 2.5435, nll_loss = 2.4306, ref_nll_loss = 2.6563, ivc_loss = 0.0797, neg_loss_1 = 0.0132, neg_loss_2 = 0.0103, ref_loss = 0.0303, intra_loss = 0.0125, div_loss = 0.0027, 0.127 seconds/batch
2025-05-14 13:29:22,845 - merge_alpha: 0.05942220613360405, range_width: 0.22673135995864868
2025-05-14 13:29:28,946 - | R@1,mIoU 0.4618 | R@1,IoU@0.1 0.7852 | R@1,IoU@0.3 0.6967 | R@1,IoU@0.5 0.5446 | R@1,IoU@0.7 0.2477 | R@1,IoU@0.9 0.0346 | R@5,mIoU 0.6880 | R@5,IoU@0.1 0.9952 | R@5,IoU@0.3 0.9748 | R@5,IoU@0.5 0.8724 | R@5,IoU@0.7 0.5430 | R@5,IoU@0.9 0.0740 |
2025-05-14 13:29:29,086 - save model to checkpoints/CharadesSTA/8_2025-05-14_13-26-12/model-best.pt, num_updates 1295.
2025-05-14 13:29:29,087 - Best results have been updated.
2025-05-14 13:29:29,087 - ============================================================
2025-05-14 13:29:29,087 - Start Epoch 6
2025-05-14 13:29:36,118 - Epoch 6, Batch 50, lr = 0.00022, final_loss = 2.5224, nll_loss = 2.4029, ref_nll_loss = 2.6419, ivc_loss = 0.0773, neg_loss_1 = 0.0143, neg_loss_2 = 0.0114, ref_loss = 0.0253, intra_loss = 0.0105, div_loss = 0.0032, 0.141 seconds/batch
2025-05-14 13:29:42,327 - Epoch 6, Batch 100, lr = 0.00021, final_loss = 2.5199, nll_loss = 2.4047, ref_nll_loss = 2.6351, ivc_loss = 0.0815, neg_loss_1 = 0.0155, neg_loss_2 = 0.0105, ref_loss = 0.0291, intra_loss = 0.0115, div_loss = 0.0030, 0.132 seconds/batch
2025-05-14 13:29:48,560 - Epoch 6, Batch 150, lr = 0.00021, final_loss = 2.5119, nll_loss = 2.3923, ref_nll_loss = 2.6315, ivc_loss = 0.0731, neg_loss_1 = 0.0136, neg_loss_2 = 0.0103, ref_loss = 0.0268, intra_loss = 0.0099, div_loss = 0.0025, 0.130 seconds/batch
2025-05-14 13:29:54,792 - Epoch 6, Batch 200, lr = 0.00021, final_loss = 2.5066, nll_loss = 2.3867, ref_nll_loss = 2.6265, ivc_loss = 0.0777, neg_loss_1 = 0.0129, neg_loss_2 = 0.0095, ref_loss = 0.0279, intra_loss = 0.0092, div_loss = 0.0036, 0.129 seconds/batch
2025-05-14 13:30:00,889 - Epoch 6, Batch 250, lr = 0.00020, final_loss = 2.5076, nll_loss = 2.3922, ref_nll_loss = 2.6231, ivc_loss = 0.0835, neg_loss_1 = 0.0155, neg_loss_2 = 0.0118, ref_loss = 0.0286, intra_loss = 0.0106, div_loss = 0.0034, 0.127 seconds/batch
2025-05-14 13:30:02,001 - Epoch 6, Batch 259, lr = 0.00020, final_loss = 2.5395, nll_loss = 2.4177, ref_nll_loss = 2.6614, ivc_loss = 0.0753, neg_loss_1 = 0.0140, neg_loss_2 = 0.0104, ref_loss = 0.0264, intra_loss = 0.0110, div_loss = 0.0027, 0.127 seconds/batch
2025-05-14 13:30:02,004 - merge_alpha: 0.05631934106349945, range_width: 0.2297177016735077
2025-05-14 13:30:08,130 - | R@1,mIoU 0.4602 | R@1,IoU@0.1 0.7859 | R@1,IoU@0.3 0.6957 | R@1,IoU@0.5 0.5504 | R@1,IoU@0.7 0.2432 | R@1,IoU@0.9 0.0294 | R@5,mIoU 0.6830 | R@5,IoU@0.1 0.9948 | R@5,IoU@0.3 0.9755 | R@5,IoU@0.5 0.8611 | R@5,IoU@0.7 0.5326 | R@5,IoU@0.9 0.0578 |
2025-05-14 13:30:08,132 - ============================================================
2025-05-14 13:30:08,132 - Start Epoch 7
2025-05-14 13:30:15,134 - Epoch 7, Batch 50, lr = 0.00020, final_loss = 2.4712, nll_loss = 2.3543, ref_nll_loss = 2.5881, ivc_loss = 0.0733, neg_loss_1 = 0.0146, neg_loss_2 = 0.0091, ref_loss = 0.0272, intra_loss = 0.0037, div_loss = 0.0037, 0.140 seconds/batch
2025-05-14 13:30:21,386 - Epoch 7, Batch 100, lr = 0.00020, final_loss = 2.4656, nll_loss = 2.3428, ref_nll_loss = 2.5883, ivc_loss = 0.0612, neg_loss_1 = 0.0124, neg_loss_2 = 0.0085, ref_loss = 0.0246, intra_loss = 0.0031, div_loss = 0.0025, 0.133 seconds/batch
2025-05-14 13:30:27,608 - Epoch 7, Batch 150, lr = 0.00019, final_loss = 2.4838, nll_loss = 2.3611, ref_nll_loss = 2.6064, ivc_loss = 0.0680, neg_loss_1 = 0.0133, neg_loss_2 = 0.0087, ref_loss = 0.0260, intra_loss = 0.0054, div_loss = 0.0029, 0.130 seconds/batch
2025-05-14 13:30:33,802 - Epoch 7, Batch 200, lr = 0.00019, final_loss = 2.4431, nll_loss = 2.3170, ref_nll_loss = 2.5693, ivc_loss = 0.0648, neg_loss_1 = 0.0132, neg_loss_2 = 0.0094, ref_loss = 0.0247, intra_loss = 0.0039, div_loss = 0.0027, 0.128 seconds/batch
2025-05-14 13:30:39,848 - Epoch 7, Batch 250, lr = 0.00019, final_loss = 2.4874, nll_loss = 2.3689, ref_nll_loss = 2.6060, ivc_loss = 0.0673, neg_loss_1 = 0.0134, neg_loss_2 = 0.0097, ref_loss = 0.0266, intra_loss = 0.0022, div_loss = 0.0031, 0.127 seconds/batch
2025-05-14 13:30:40,944 - Epoch 7, Batch 259, lr = 0.00019, final_loss = 2.4682, nll_loss = 2.3486, ref_nll_loss = 2.5877, ivc_loss = 0.0927, neg_loss_1 = 0.0152, neg_loss_2 = 0.0075, ref_loss = 0.0279, intra_loss = 0.0239, div_loss = 0.0037, 0.127 seconds/batch
2025-05-14 13:30:40,947 - merge_alpha: 0.054500654339790344, range_width: 0.23923827707767487
2025-05-14 13:30:46,966 - | R@1,mIoU 0.4572 | R@1,IoU@0.1 0.7817 | R@1,IoU@0.3 0.6957 | R@1,IoU@0.5 0.5339 | R@1,IoU@0.7 0.2552 | R@1,IoU@0.9 0.0300 | R@5,mIoU 0.6833 | R@5,IoU@0.1 0.9919 | R@5,IoU@0.3 0.9742 | R@5,IoU@0.5 0.8592 | R@5,IoU@0.7 0.5436 | R@5,IoU@0.9 0.0659 |
2025-05-14 13:30:46,969 - ============================================================
2025-05-14 13:30:46,969 - Start Epoch 8
2025-05-14 13:30:54,041 - Epoch 8, Batch 50, lr = 0.00019, final_loss = 2.4324, nll_loss = 2.3066, ref_nll_loss = 2.5581, ivc_loss = 0.0646, neg_loss_1 = 0.0131, neg_loss_2 = 0.0075, ref_loss = 0.0240, intra_loss = 0.0003, div_loss = 0.0040, 0.141 seconds/batch
2025-05-14 13:31:00,268 - Epoch 8, Batch 100, lr = 0.00018, final_loss = 2.4190, nll_loss = 2.2962, ref_nll_loss = 2.5419, ivc_loss = 0.0654, neg_loss_1 = 0.0122, neg_loss_2 = 0.0087, ref_loss = 0.0253, intra_loss = 0.0044, div_loss = 0.0029, 0.133 seconds/batch
2025-05-14 13:31:06,467 - Epoch 8, Batch 150, lr = 0.00018, final_loss = 2.4054, nll_loss = 2.2786, ref_nll_loss = 2.5323, ivc_loss = 0.0580, neg_loss_1 = 0.0119, neg_loss_2 = 0.0078, ref_loss = 0.0248, intra_loss = 0.0002, div_loss = 0.0026, 0.130 seconds/batch
2025-05-14 13:31:12,676 - Epoch 8, Batch 200, lr = 0.00018, final_loss = 2.4480, nll_loss = 2.3252, ref_nll_loss = 2.5708, ivc_loss = 0.0671, neg_loss_1 = 0.0123, neg_loss_2 = 0.0105, ref_loss = 0.0265, intra_loss = 0.0035, div_loss = 0.0028, 0.129 seconds/batch
2025-05-14 13:31:18,756 - Epoch 8, Batch 250, lr = 0.00018, final_loss = 2.4602, nll_loss = 2.3374, ref_nll_loss = 2.5829, ivc_loss = 0.0692, neg_loss_1 = 0.0113, neg_loss_2 = 0.0084, ref_loss = 0.0273, intra_loss = 0.0060, div_loss = 0.0033, 0.127 seconds/batch
2025-05-14 13:31:19,873 - Epoch 8, Batch 259, lr = 0.00018, final_loss = 2.4132, nll_loss = 2.2922, ref_nll_loss = 2.5341, ivc_loss = 0.0607, neg_loss_1 = 0.0095, neg_loss_2 = 0.0058, ref_loss = 0.0262, intra_loss = 0.0004, div_loss = 0.0038, 0.127 seconds/batch
2025-05-14 13:31:19,876 - merge_alpha: 0.05338822305202484, range_width: 0.2453274130821228
2025-05-14 13:31:25,928 - | R@1,mIoU 0.4651 | R@1,IoU@0.1 0.7881 | R@1,IoU@0.3 0.7064 | R@1,IoU@0.5 0.5455 | R@1,IoU@0.7 0.2555 | R@1,IoU@0.9 0.0401 | R@5,mIoU 0.6921 | R@5,IoU@0.1 0.9942 | R@5,IoU@0.3 0.9774 | R@5,IoU@0.5 0.8653 | R@5,IoU@0.7 0.5562 | R@5,IoU@0.9 0.0904 |
2025-05-14 13:31:26,043 - save model to checkpoints/CharadesSTA/8_2025-05-14_13-26-12/model-best.pt, num_updates 2072.
2025-05-14 13:31:26,043 - Best results have been updated.
2025-05-14 13:31:26,043 - ============================================================
2025-05-14 13:31:26,044 - Start Epoch 9
2025-05-14 13:31:33,060 - Epoch 9, Batch 50, lr = 0.00017, final_loss = 2.3546, nll_loss = 2.2324, ref_nll_loss = 2.4768, ivc_loss = 0.0577, neg_loss_1 = 0.0116, neg_loss_2 = 0.0073, ref_loss = 0.0227, intra_loss = 0.0013, div_loss = 0.0029, 0.140 seconds/batch
2025-05-14 13:31:39,287 - Epoch 9, Batch 100, lr = 0.00017, final_loss = 2.4238, nll_loss = 2.2974, ref_nll_loss = 2.5502, ivc_loss = 0.0532, neg_loss_1 = 0.0104, neg_loss_2 = 0.0069, ref_loss = 0.0212, intra_loss = 0.0020, div_loss = 0.0026, 0.132 seconds/batch
2025-05-14 13:31:45,481 - Epoch 9, Batch 150, lr = 0.00017, final_loss = 2.4249, nll_loss = 2.2996, ref_nll_loss = 2.5503, ivc_loss = 0.0577, neg_loss_1 = 0.0103, neg_loss_2 = 0.0084, ref_loss = 0.0247, intra_loss = 0.0002, div_loss = 0.0028, 0.130 seconds/batch
2025-05-14 13:31:51,676 - Epoch 9, Batch 200, lr = 0.00017, final_loss = 2.3882, nll_loss = 2.2628, ref_nll_loss = 2.5136, ivc_loss = 0.0635, neg_loss_1 = 0.0115, neg_loss_2 = 0.0072, ref_loss = 0.0244, intra_loss = 0.0067, div_loss = 0.0028, 0.128 seconds/batch
2025-05-14 13:31:57,748 - Epoch 9, Batch 250, lr = 0.00017, final_loss = 2.4203, nll_loss = 2.2916, ref_nll_loss = 2.5490, ivc_loss = 0.0691, neg_loss_1 = 0.0107, neg_loss_2 = 0.0078, ref_loss = 0.0251, intra_loss = 0.0047, div_loss = 0.0042, 0.127 seconds/batch
2025-05-14 13:31:58,851 - Epoch 9, Batch 259, lr = 0.00017, final_loss = 2.4290, nll_loss = 2.3112, ref_nll_loss = 2.5468, ivc_loss = 0.0636, neg_loss_1 = 0.0185, neg_loss_2 = 0.0055, ref_loss = 0.0267, intra_loss = 0.0003, div_loss = 0.0025, 0.127 seconds/batch
2025-05-14 13:31:58,854 - merge_alpha: 0.052225977182388306, range_width: 0.24832165241241455
2025-05-14 13:32:04,938 - | R@1,mIoU 0.4712 | R@1,IoU@0.1 0.7955 | R@1,IoU@0.3 0.7087 | R@1,IoU@0.5 0.5484 | R@1,IoU@0.7 0.2668 | R@1,IoU@0.9 0.0436 | R@5,mIoU 0.6919 | R@5,IoU@0.1 0.9955 | R@5,IoU@0.3 0.9800 | R@5,IoU@0.5 0.8608 | R@5,IoU@0.7 0.5433 | R@5,IoU@0.9 0.0972 |
2025-05-14 13:32:05,045 - save model to checkpoints/CharadesSTA/8_2025-05-14_13-26-12/model-best.pt, num_updates 2331.
2025-05-14 13:32:05,045 - Best results have been updated.
2025-05-14 13:32:05,045 - ============================================================
2025-05-14 13:32:05,045 - Start Epoch 10
2025-05-14 13:32:12,037 - Epoch 10, Batch 50, lr = 0.00016, final_loss = 2.3506, nll_loss = 2.2302, ref_nll_loss = 2.4710, ivc_loss = 0.0604, neg_loss_1 = 0.0103, neg_loss_2 = 0.0061, ref_loss = 0.0255, intra_loss = 0.0001, div_loss = 0.0037, 0.140 seconds/batch
2025-05-14 13:32:18,254 - Epoch 10, Batch 100, lr = 0.00016, final_loss = 2.3731, nll_loss = 2.2446, ref_nll_loss = 2.5017, ivc_loss = 0.0599, neg_loss_1 = 0.0111, neg_loss_2 = 0.0064, ref_loss = 0.0227, intra_loss = 0.0045, div_loss = 0.0030, 0.132 seconds/batch
2025-05-14 13:32:24,454 - Epoch 10, Batch 150, lr = 0.00016, final_loss = 2.3895, nll_loss = 2.2583, ref_nll_loss = 2.5206, ivc_loss = 0.0544, neg_loss_1 = 0.0104, neg_loss_2 = 0.0059, ref_loss = 0.0234, intra_loss = 0.0015, div_loss = 0.0026, 0.129 seconds/batch
2025-05-14 13:32:30,644 - Epoch 10, Batch 200, lr = 0.00016, final_loss = 2.4028, nll_loss = 2.2774, ref_nll_loss = 2.5282, ivc_loss = 0.0580, neg_loss_1 = 0.0120, neg_loss_2 = 0.0066, ref_loss = 0.0235, intra_loss = 0.0015, div_loss = 0.0029, 0.128 seconds/batch
2025-05-14 13:32:36,709 - Epoch 10, Batch 250, lr = 0.00016, final_loss = 2.3539, nll_loss = 2.2285, ref_nll_loss = 2.4793, ivc_loss = 0.0713, neg_loss_1 = 0.0096, neg_loss_2 = 0.0077, ref_loss = 0.0237, intra_loss = 0.0020, div_loss = 0.0057, 0.127 seconds/batch
2025-05-14 13:32:37,815 - Epoch 10, Batch 259, lr = 0.00016, final_loss = 2.3995, nll_loss = 2.2696, ref_nll_loss = 2.5294, ivc_loss = 0.0583, neg_loss_1 = 0.0082, neg_loss_2 = 0.0077, ref_loss = 0.0248, intra_loss = 0.0002, div_loss = 0.0035, 0.127 seconds/batch
2025-05-14 13:32:37,818 - merge_alpha: 0.0505269430577755, range_width: 0.25080448389053345
2025-05-14 13:32:43,849 - | R@1,mIoU 0.4628 | R@1,IoU@0.1 0.7881 | R@1,IoU@0.3 0.6990 | R@1,IoU@0.5 0.5407 | R@1,IoU@0.7 0.2516 | R@1,IoU@0.9 0.0423 | R@5,mIoU 0.6933 | R@5,IoU@0.1 0.9945 | R@5,IoU@0.3 0.9790 | R@5,IoU@0.5 0.8731 | R@5,IoU@0.7 0.5446 | R@5,IoU@0.9 0.0950 |
2025-05-14 13:32:43,852 - ============================================================
2025-05-14 13:32:43,852 - Start Epoch 11
2025-05-14 13:32:50,893 - Epoch 11, Batch 50, lr = 0.00016, final_loss = 2.3238, nll_loss = 2.1964, ref_nll_loss = 2.4512, ivc_loss = 0.0543, neg_loss_1 = 0.0105, neg_loss_2 = 0.0070, ref_loss = 0.0233, intra_loss = 0.0011, div_loss = 0.0025, 0.141 seconds/batch
2025-05-14 13:32:57,070 - Epoch 11, Batch 100, lr = 0.00015, final_loss = 2.3455, nll_loss = 2.2129, ref_nll_loss = 2.4780, ivc_loss = 0.0510, neg_loss_1 = 0.0081, neg_loss_2 = 0.0064, ref_loss = 0.0230, intra_loss = 0.0002, div_loss = 0.0026, 0.132 seconds/batch
2025-05-14 13:33:03,273 - Epoch 11, Batch 150, lr = 0.00015, final_loss = 2.3488, nll_loss = 2.2189, ref_nll_loss = 2.4788, ivc_loss = 0.0539, neg_loss_1 = 0.0103, neg_loss_2 = 0.0062, ref_loss = 0.0244, intra_loss = 0.0015, div_loss = 0.0023, 0.129 seconds/batch
2025-05-14 13:33:09,474 - Epoch 11, Batch 200, lr = 0.00015, final_loss = 2.3597, nll_loss = 2.2300, ref_nll_loss = 2.4894, ivc_loss = 0.0532, neg_loss_1 = 0.0097, neg_loss_2 = 0.0064, ref_loss = 0.0217, intra_loss = 0.0044, div_loss = 0.0022, 0.128 seconds/batch
2025-05-14 13:33:15,552 - Epoch 11, Batch 250, lr = 0.00015, final_loss = 2.3414, nll_loss = 2.2111, ref_nll_loss = 2.4717, ivc_loss = 0.0565, neg_loss_1 = 0.0106, neg_loss_2 = 0.0080, ref_loss = 0.0218, intra_loss = 0.0035, div_loss = 0.0025, 0.127 seconds/batch
2025-05-14 13:33:16,663 - Epoch 11, Batch 259, lr = 0.00015, final_loss = 2.3189, nll_loss = 2.1915, ref_nll_loss = 2.4464, ivc_loss = 0.0678, neg_loss_1 = 0.0111, neg_loss_2 = 0.0085, ref_loss = 0.0236, intra_loss = 0.0138, div_loss = 0.0022, 0.127 seconds/batch
2025-05-14 13:33:16,665 - merge_alpha: 0.04908980429172516, range_width: 0.2544218897819519
2025-05-14 13:33:22,711 - | R@1,mIoU 0.4573 | R@1,IoU@0.1 0.7871 | R@1,IoU@0.3 0.6944 | R@1,IoU@0.5 0.5268 | R@1,IoU@0.7 0.2390 | R@1,IoU@0.9 0.0362 | R@5,mIoU 0.6868 | R@5,IoU@0.1 0.9922 | R@5,IoU@0.3 0.9742 | R@5,IoU@0.5 0.8556 | R@5,IoU@0.7 0.5329 | R@5,IoU@0.9 0.0908 |
2025-05-14 13:33:22,714 - ============================================================
2025-05-14 13:33:22,714 - Start Epoch 12
2025-05-14 13:33:29,711 - Epoch 12, Batch 50, lr = 0.00015, final_loss = 2.3047, nll_loss = 2.1760, ref_nll_loss = 2.4334, ivc_loss = 0.0515, neg_loss_1 = 0.0087, neg_loss_2 = 0.0058, ref_loss = 0.0224, intra_loss = 0.0018, div_loss = 0.0026, 0.140 seconds/batch
2025-05-14 13:33:35,945 - Epoch 12, Batch 100, lr = 0.00015, final_loss = 2.3185, nll_loss = 2.1889, ref_nll_loss = 2.4481, ivc_loss = 0.0533, neg_loss_1 = 0.0090, neg_loss_2 = 0.0063, ref_loss = 0.0219, intra_loss = 0.0041, div_loss = 0.0024, 0.132 seconds/batch
2025-05-14 13:33:42,167 - Epoch 12, Batch 150, lr = 0.00015, final_loss = 2.3195, nll_loss = 2.1892, ref_nll_loss = 2.4498, ivc_loss = 0.0520, neg_loss_1 = 0.0106, neg_loss_2 = 0.0069, ref_loss = 0.0221, intra_loss = 0.0002, div_loss = 0.0024, 0.130 seconds/batch
2025-05-14 13:33:48,373 - Epoch 12, Batch 200, lr = 0.00014, final_loss = 2.3356, nll_loss = 2.2041, ref_nll_loss = 2.4670, ivc_loss = 0.0577, neg_loss_1 = 0.0102, neg_loss_2 = 0.0083, ref_loss = 0.0220, intra_loss = 0.0043, div_loss = 0.0026, 0.128 seconds/batch
2025-05-14 13:33:54,445 - Epoch 12, Batch 250, lr = 0.00014, final_loss = 2.3165, nll_loss = 2.1877, ref_nll_loss = 2.4454, ivc_loss = 0.0521, neg_loss_1 = 0.0088, neg_loss_2 = 0.0069, ref_loss = 0.0203, intra_loss = 0.0031, div_loss = 0.0026, 0.127 seconds/batch
2025-05-14 13:33:55,552 - Epoch 12, Batch 259, lr = 0.00014, final_loss = 2.3765, nll_loss = 2.2506, ref_nll_loss = 2.5023, ivc_loss = 0.0564, neg_loss_1 = 0.0084, neg_loss_2 = 0.0087, ref_loss = 0.0262, intra_loss = 0.0002, div_loss = 0.0026, 0.127 seconds/batch
2025-05-14 13:33:55,555 - merge_alpha: 0.04734688252210617, range_width: 0.25351616740226746
2025-05-14 13:34:01,741 - | R@1,mIoU 0.4656 | R@1,IoU@0.1 0.7991 | R@1,IoU@0.3 0.7051 | R@1,IoU@0.5 0.5355 | R@1,IoU@0.7 0.2490 | R@1,IoU@0.9 0.0436 | R@5,mIoU 0.6908 | R@5,IoU@0.1 0.9939 | R@5,IoU@0.3 0.9767 | R@5,IoU@0.5 0.8663 | R@5,IoU@0.7 0.5449 | R@5,IoU@0.9 0.0927 |
2025-05-14 13:34:01,744 - ============================================================
2025-05-14 13:34:01,744 - Start Epoch 13
2025-05-14 13:34:08,736 - Epoch 13, Batch 50, lr = 0.00014, final_loss = 2.2811, nll_loss = 2.1527, ref_nll_loss = 2.4094, ivc_loss = 0.0497, neg_loss_1 = 0.0083, neg_loss_2 = 0.0058, ref_loss = 0.0201, intra_loss = 0.0000, div_loss = 0.0031, 0.140 seconds/batch
2025-05-14 13:34:14,943 - Epoch 13, Batch 100, lr = 0.00014, final_loss = 2.2804, nll_loss = 2.1502, ref_nll_loss = 2.4107, ivc_loss = 0.0441, neg_loss_1 = 0.0057, neg_loss_2 = 0.0041, ref_loss = 0.0215, intra_loss = 0.0013, div_loss = 0.0023, 0.132 seconds/batch
2025-05-14 13:34:21,156 - Epoch 13, Batch 150, lr = 0.00014, final_loss = 2.3060, nll_loss = 2.1762, ref_nll_loss = 2.4358, ivc_loss = 0.0546, neg_loss_1 = 0.0097, neg_loss_2 = 0.0062, ref_loss = 0.0233, intra_loss = 0.0036, div_loss = 0.0024, 0.129 seconds/batch
2025-05-14 13:34:27,349 - Epoch 13, Batch 200, lr = 0.00014, final_loss = 2.2910, nll_loss = 2.1574, ref_nll_loss = 2.4245, ivc_loss = 0.0501, neg_loss_1 = 0.0088, neg_loss_2 = 0.0053, ref_loss = 0.0213, intra_loss = 0.0029, div_loss = 0.0024, 0.128 seconds/batch
2025-05-14 13:34:33,408 - Epoch 13, Batch 250, lr = 0.00014, final_loss = 2.3064, nll_loss = 2.1748, ref_nll_loss = 2.4381, ivc_loss = 0.0494, neg_loss_1 = 0.0073, neg_loss_2 = 0.0052, ref_loss = 0.0217, intra_loss = 0.0014, div_loss = 0.0028, 0.127 seconds/batch
2025-05-14 13:34:34,513 - Epoch 13, Batch 259, lr = 0.00014, final_loss = 2.3549, nll_loss = 2.2274, ref_nll_loss = 2.4823, ivc_loss = 0.0510, neg_loss_1 = 0.0095, neg_loss_2 = 0.0039, ref_loss = 0.0246, intra_loss = 0.0000, div_loss = 0.0026, 0.127 seconds/batch
2025-05-14 13:34:34,515 - merge_alpha: 0.046287693083286285, range_width: 0.2521556615829468
2025-05-14 13:34:40,613 - | R@1,mIoU 0.4582 | R@1,IoU@0.1 0.7868 | R@1,IoU@0.3 0.6948 | R@1,IoU@0.5 0.5262 | R@1,IoU@0.7 0.2471 | R@1,IoU@0.9 0.0339 | R@5,mIoU 0.6862 | R@5,IoU@0.1 0.9926 | R@5,IoU@0.3 0.9742 | R@5,IoU@0.5 0.8624 | R@5,IoU@0.7 0.5352 | R@5,IoU@0.9 0.0791 |
2025-05-14 13:34:40,615 - ============================================================
2025-05-14 13:34:40,615 - Start Epoch 14
2025-05-14 13:34:47,719 - Epoch 14, Batch 50, lr = 0.00014, final_loss = 2.2412, nll_loss = 2.1102, ref_nll_loss = 2.3722, ivc_loss = 0.0510, neg_loss_1 = 0.0081, neg_loss_2 = 0.0059, ref_loss = 0.0209, intra_loss = 0.0030, div_loss = 0.0027, 0.142 seconds/batch
2025-05-14 13:34:53,928 - Epoch 14, Batch 100, lr = 0.00014, final_loss = 2.2806, nll_loss = 2.1468, ref_nll_loss = 2.4143, ivc_loss = 0.0543, neg_loss_1 = 0.0095, neg_loss_2 = 0.0063, ref_loss = 0.0214, intra_loss = 0.0025, div_loss = 0.0029, 0.133 seconds/batch
2025-05-14 13:35:00,161 - Epoch 14, Batch 150, lr = 0.00013, final_loss = 2.2667, nll_loss = 2.1316, ref_nll_loss = 2.4019, ivc_loss = 0.0467, neg_loss_1 = 0.0069, neg_loss_2 = 0.0046, ref_loss = 0.0209, intra_loss = 0.0020, div_loss = 0.0025, 0.130 seconds/batch
2025-05-14 13:35:06,380 - Epoch 14, Batch 200, lr = 0.00013, final_loss = 2.2688, nll_loss = 2.1352, ref_nll_loss = 2.4024, ivc_loss = 0.0517, neg_loss_1 = 0.0074, neg_loss_2 = 0.0052, ref_loss = 0.0204, intra_loss = 0.0063, div_loss = 0.0025, 0.129 seconds/batch
2025-05-14 13:35:12,449 - Epoch 14, Batch 250, lr = 0.00013, final_loss = 2.2711, nll_loss = 2.1393, ref_nll_loss = 2.4028, ivc_loss = 0.0502, neg_loss_1 = 0.0076, neg_loss_2 = 0.0050, ref_loss = 0.0221, intra_loss = 0.0039, div_loss = 0.0024, 0.127 seconds/batch
2025-05-14 13:35:13,553 - Epoch 14, Batch 259, lr = 0.00013, final_loss = 2.2769, nll_loss = 2.1453, ref_nll_loss = 2.4085, ivc_loss = 0.0426, neg_loss_1 = 0.0079, neg_loss_2 = 0.0025, ref_loss = 0.0205, intra_loss = 0.0000, div_loss = 0.0023, 0.127 seconds/batch
2025-05-14 13:35:13,556 - merge_alpha: 0.045786306262016296, range_width: 0.2456446886062622
2025-05-14 13:35:19,561 - | R@1,mIoU 0.4682 | R@1,IoU@0.1 0.8020 | R@1,IoU@0.3 0.7122 | R@1,IoU@0.5 0.5401 | R@1,IoU@0.7 0.2545 | R@1,IoU@0.9 0.0375 | R@5,mIoU 0.6913 | R@5,IoU@0.1 0.9926 | R@5,IoU@0.3 0.9771 | R@5,IoU@0.5 0.8592 | R@5,IoU@0.7 0.5620 | R@5,IoU@0.9 0.0843 |
2025-05-14 13:35:19,563 - ============================================================
2025-05-14 13:35:19,563 - Start Epoch 15
2025-05-14 13:35:26,550 - Epoch 15, Batch 50, lr = 0.00013, final_loss = 2.2498, nll_loss = 2.1137, ref_nll_loss = 2.3859, ivc_loss = 0.0479, neg_loss_1 = 0.0070, neg_loss_2 = 0.0050, ref_loss = 0.0217, intra_loss = 0.0028, div_loss = 0.0023, 0.140 seconds/batch
2025-05-14 13:35:32,757 - Epoch 15, Batch 100, lr = 0.00013, final_loss = 2.2491, nll_loss = 2.1169, ref_nll_loss = 2.3814, ivc_loss = 0.0461, neg_loss_1 = 0.0081, neg_loss_2 = 0.0051, ref_loss = 0.0196, intra_loss = 0.0000, div_loss = 0.0026, 0.132 seconds/batch
2025-05-14 13:35:38,983 - Epoch 15, Batch 150, lr = 0.00013, final_loss = 2.2415, nll_loss = 2.1109, ref_nll_loss = 2.3720, ivc_loss = 0.0553, neg_loss_1 = 0.0086, neg_loss_2 = 0.0055, ref_loss = 0.0226, intra_loss = 0.0023, div_loss = 0.0033, 0.129 seconds/batch
2025-05-14 13:35:45,185 - Epoch 15, Batch 200, lr = 0.00013, final_loss = 2.2407, nll_loss = 2.1056, ref_nll_loss = 2.3757, ivc_loss = 0.0473, neg_loss_1 = 0.0071, neg_loss_2 = 0.0056, ref_loss = 0.0191, intra_loss = 0.0000, div_loss = 0.0031, 0.128 seconds/batch
2025-05-14 13:35:51,241 - Epoch 15, Batch 250, lr = 0.00013, final_loss = 2.2410, nll_loss = 2.1078, ref_nll_loss = 2.3741, ivc_loss = 0.0454, neg_loss_1 = 0.0070, neg_loss_2 = 0.0057, ref_loss = 0.0213, intra_loss = 0.0001, div_loss = 0.0023, 0.127 seconds/batch
2025-05-14 13:35:52,365 - Epoch 15, Batch 259, lr = 0.00013, final_loss = 2.2324, nll_loss = 2.1029, ref_nll_loss = 2.3620, ivc_loss = 0.0536, neg_loss_1 = 0.0075, neg_loss_2 = 0.0067, ref_loss = 0.0241, intra_loss = 0.0000, div_loss = 0.0031, 0.127 seconds/batch
2025-05-14 13:35:52,367 - merge_alpha: 0.04514365270733833, range_width: 0.24175027012825012
2025-05-14 13:35:58,472 - | R@1,mIoU 0.4632 | R@1,IoU@0.1 0.7955 | R@1,IoU@0.3 0.7048 | R@1,IoU@0.5 0.5281 | R@1,IoU@0.7 0.2529 | R@1,IoU@0.9 0.0423 | R@5,mIoU 0.6867 | R@5,IoU@0.1 0.9906 | R@5,IoU@0.3 0.9725 | R@5,IoU@0.5 0.8582 | R@5,IoU@0.7 0.5397 | R@5,IoU@0.9 0.0924 |
2025-05-14 13:35:58,475 - ============================================================
2025-05-14 13:35:58,475 - Start Epoch 16
2025-05-14 13:36:05,439 - Epoch 16, Batch 50, lr = 0.00013, final_loss = 2.1905, nll_loss = 2.0582, ref_nll_loss = 2.3227, ivc_loss = 0.0523, neg_loss_1 = 0.0081, neg_loss_2 = 0.0050, ref_loss = 0.0214, intra_loss = 0.0053, div_loss = 0.0025, 0.139 seconds/batch
2025-05-14 13:36:11,637 - Epoch 16, Batch 100, lr = 0.00013, final_loss = 2.2185, nll_loss = 2.0825, ref_nll_loss = 2.3546, ivc_loss = 0.0476, neg_loss_1 = 0.0062, neg_loss_2 = 0.0037, ref_loss = 0.0212, intra_loss = 0.0031, div_loss = 0.0027, 0.132 seconds/batch
2025-05-14 13:36:17,842 - Epoch 16, Batch 150, lr = 0.00013, final_loss = 2.2312, nll_loss = 2.1005, ref_nll_loss = 2.3620, ivc_loss = 0.0467, neg_loss_1 = 0.0067, neg_loss_2 = 0.0035, ref_loss = 0.0223, intra_loss = 0.0000, div_loss = 0.0028, 0.129 seconds/batch
2025-05-14 13:36:24,048 - Epoch 16, Batch 200, lr = 0.00013, final_loss = 2.2190, nll_loss = 2.0863, ref_nll_loss = 2.3517, ivc_loss = 0.0450, neg_loss_1 = 0.0069, neg_loss_2 = 0.0039, ref_loss = 0.0206, intra_loss = 0.0000, div_loss = 0.0027, 0.128 seconds/batch
2025-05-14 13:36:30,125 - Epoch 16, Batch 250, lr = 0.00012, final_loss = 2.2610, nll_loss = 2.1269, ref_nll_loss = 2.3951, ivc_loss = 0.0507, neg_loss_1 = 0.0076, neg_loss_2 = 0.0052, ref_loss = 0.0219, intra_loss = 0.0001, div_loss = 0.0032, 0.127 seconds/batch
2025-05-14 13:36:31,230 - Epoch 16, Batch 259, lr = 0.00012, final_loss = 2.2743, nll_loss = 2.1425, ref_nll_loss = 2.4060, ivc_loss = 0.0701, neg_loss_1 = 0.0112, neg_loss_2 = 0.0079, ref_loss = 0.0257, intra_loss = 0.0000, div_loss = 0.0051, 0.126 seconds/batch
2025-05-14 13:36:31,233 - merge_alpha: 0.044020164757966995, range_width: 0.23489157855510712
2025-05-14 13:36:37,271 - | R@1,mIoU 0.4539 | R@1,IoU@0.1 0.7917 | R@1,IoU@0.3 0.6915 | R@1,IoU@0.5 0.5200 | R@1,IoU@0.7 0.2377 | R@1,IoU@0.9 0.0320 | R@5,mIoU 0.6828 | R@5,IoU@0.1 0.9926 | R@5,IoU@0.3 0.9709 | R@5,IoU@0.5 0.8563 | R@5,IoU@0.7 0.5381 | R@5,IoU@0.9 0.0688 |
2025-05-14 13:36:37,273 - ============================================================
2025-05-14 13:36:37,273 - Start Epoch 17
2025-05-14 13:36:44,336 - Epoch 17, Batch 50, lr = 0.00012, final_loss = 2.1833, nll_loss = 2.0454, ref_nll_loss = 2.3213, ivc_loss = 0.0430, neg_loss_1 = 0.0048, neg_loss_2 = 0.0047, ref_loss = 0.0181, intra_loss = 0.0041, div_loss = 0.0023, 0.141 seconds/batch
2025-05-14 13:36:50,559 - Epoch 17, Batch 100, lr = 0.00012, final_loss = 2.2041, nll_loss = 2.0713, ref_nll_loss = 2.3368, ivc_loss = 0.0510, neg_loss_1 = 0.0063, neg_loss_2 = 0.0038, ref_loss = 0.0216, intra_loss = 0.0070, div_loss = 0.0025, 0.133 seconds/batch
2025-05-14 13:36:56,786 - Epoch 17, Batch 150, lr = 0.00012, final_loss = 2.2072, nll_loss = 2.0732, ref_nll_loss = 2.3412, ivc_loss = 0.0492, neg_loss_1 = 0.0073, neg_loss_2 = 0.0047, ref_loss = 0.0205, intra_loss = 0.0020, div_loss = 0.0029, 0.130 seconds/batch
2025-05-14 13:37:03,008 - Epoch 17, Batch 200, lr = 0.00012, final_loss = 2.2116, nll_loss = 2.0806, ref_nll_loss = 2.3425, ivc_loss = 0.0454, neg_loss_1 = 0.0065, neg_loss_2 = 0.0046, ref_loss = 0.0222, intra_loss = 0.0001, div_loss = 0.0024, 0.129 seconds/batch
2025-05-14 13:37:09,090 - Epoch 17, Batch 250, lr = 0.00012, final_loss = 2.2290, nll_loss = 2.0976, ref_nll_loss = 2.3605, ivc_loss = 0.0494, neg_loss_1 = 0.0074, neg_loss_2 = 0.0047, ref_loss = 0.0225, intra_loss = 0.0019, div_loss = 0.0026, 0.127 seconds/batch
2025-05-14 13:37:10,197 - Epoch 17, Batch 259, lr = 0.00012, final_loss = 2.2283, nll_loss = 2.0922, ref_nll_loss = 2.3644, ivc_loss = 0.0541, neg_loss_1 = 0.0079, neg_loss_2 = 0.0047, ref_loss = 0.0247, intra_loss = 0.0000, div_loss = 0.0034, 0.127 seconds/batch
2025-05-14 13:37:10,200 - merge_alpha: 0.043797533959150314, range_width: 0.2269527018070221
2025-05-14 13:37:16,258 - | R@1,mIoU 0.4590 | R@1,IoU@0.1 0.7991 | R@1,IoU@0.3 0.7038 | R@1,IoU@0.5 0.5317 | R@1,IoU@0.7 0.2358 | R@1,IoU@0.9 0.0294 | R@5,mIoU 0.6875 | R@5,IoU@0.1 0.9939 | R@5,IoU@0.3 0.9742 | R@5,IoU@0.5 0.8598 | R@5,IoU@0.7 0.5494 | R@5,IoU@0.9 0.0756 |
2025-05-14 13:37:16,261 - ============================================================
2025-05-14 13:37:16,261 - Start Epoch 18
2025-05-14 13:37:23,244 - Epoch 18, Batch 50, lr = 0.00012, final_loss = 2.1783, nll_loss = 2.0460, ref_nll_loss = 2.3107, ivc_loss = 0.0458, neg_loss_1 = 0.0072, neg_loss_2 = 0.0039, ref_loss = 0.0212, intra_loss = 0.0000, div_loss = 0.0027, 0.140 seconds/batch
2025-05-14 13:37:29,448 - Epoch 18, Batch 100, lr = 0.00012, final_loss = 2.1784, nll_loss = 2.0421, ref_nll_loss = 2.3147, ivc_loss = 0.0426, neg_loss_1 = 0.0054, neg_loss_2 = 0.0031, ref_loss = 0.0193, intra_loss = 0.0015, div_loss = 0.0027, 0.132 seconds/batch
2025-05-14 13:37:35,682 - Epoch 18, Batch 150, lr = 0.00012, final_loss = 2.2096, nll_loss = 2.0761, ref_nll_loss = 2.3431, ivc_loss = 0.0462, neg_loss_1 = 0.0064, neg_loss_2 = 0.0036, ref_loss = 0.0206, intra_loss = 0.0016, div_loss = 0.0028, 0.129 seconds/batch
2025-05-14 13:37:41,876 - Epoch 18, Batch 200, lr = 0.00012, final_loss = 2.1886, nll_loss = 2.0528, ref_nll_loss = 2.3244, ivc_loss = 0.0511, neg_loss_1 = 0.0075, neg_loss_2 = 0.0050, ref_loss = 0.0227, intra_loss = 0.0034, div_loss = 0.0025, 0.128 seconds/batch
2025-05-14 13:37:47,943 - Epoch 18, Batch 250, lr = 0.00012, final_loss = 2.1648, nll_loss = 2.0285, ref_nll_loss = 2.3012, ivc_loss = 0.0481, neg_loss_1 = 0.0059, neg_loss_2 = 0.0045, ref_loss = 0.0206, intra_loss = 0.0049, div_loss = 0.0025, 0.127 seconds/batch
2025-05-14 13:37:49,047 - Epoch 18, Batch 259, lr = 0.00012, final_loss = 2.1896, nll_loss = 2.0488, ref_nll_loss = 2.3304, ivc_loss = 0.0472, neg_loss_1 = 0.0030, neg_loss_2 = 0.0059, ref_loss = 0.0273, intra_loss = 0.0000, div_loss = 0.0022, 0.127 seconds/batch
2025-05-14 13:37:49,050 - merge_alpha: 0.04299314320087433, range_width: 0.22077028453350067
2025-05-14 13:37:55,194 - | R@1,mIoU 0.4585 | R@1,IoU@0.1 0.7913 | R@1,IoU@0.3 0.6986 | R@1,IoU@0.5 0.5210 | R@1,IoU@0.7 0.2439 | R@1,IoU@0.9 0.0323 | R@5,mIoU 0.6882 | R@5,IoU@0.1 0.9942 | R@5,IoU@0.3 0.9742 | R@5,IoU@0.5 0.8553 | R@5,IoU@0.7 0.5455 | R@5,IoU@0.9 0.0804 |
2025-05-14 13:37:55,196 - ============================================================
2025-05-14 13:37:55,196 - Start Epoch 19
2025-05-14 13:38:02,202 - Epoch 19, Batch 50, lr = 0.00012, final_loss = 2.1341, nll_loss = 1.9951, ref_nll_loss = 2.2730, ivc_loss = 0.0373, neg_loss_1 = 0.0047, neg_loss_2 = 0.0035, ref_loss = 0.0177, intra_loss = 0.0000, div_loss = 0.0023, 0.140 seconds/batch
2025-05-14 13:38:08,430 - Epoch 19, Batch 100, lr = 0.00012, final_loss = 2.1212, nll_loss = 1.9845, ref_nll_loss = 2.2579, ivc_loss = 0.0417, neg_loss_1 = 0.0068, neg_loss_2 = 0.0034, ref_loss = 0.0183, intra_loss = 0.0000, div_loss = 0.0027, 0.132 seconds/batch
2025-05-14 13:38:14,637 - Epoch 19, Batch 150, lr = 0.00012, final_loss = 2.1784, nll_loss = 2.0396, ref_nll_loss = 2.3172, ivc_loss = 0.0437, neg_loss_1 = 0.0058, neg_loss_2 = 0.0040, ref_loss = 0.0191, intra_loss = 0.0022, div_loss = 0.0025, 0.130 seconds/batch
2025-05-14 13:38:20,861 - Epoch 19, Batch 200, lr = 0.00011, final_loss = 2.1772, nll_loss = 2.0418, ref_nll_loss = 2.3126, ivc_loss = 0.0436, neg_loss_1 = 0.0050, neg_loss_2 = 0.0050, ref_loss = 0.0197, intra_loss = 0.0013, div_loss = 0.0025, 0.128 seconds/batch
2025-05-14 13:38:26,952 - Epoch 19, Batch 250, lr = 0.00011, final_loss = 2.1879, nll_loss = 2.0541, ref_nll_loss = 2.3218, ivc_loss = 0.0491, neg_loss_1 = 0.0054, neg_loss_2 = 0.0051, ref_loss = 0.0221, intra_loss = 0.0033, div_loss = 0.0027, 0.127 seconds/batch
2025-05-14 13:38:28,057 - Epoch 19, Batch 259, lr = 0.00011, final_loss = 2.1730, nll_loss = 2.0371, ref_nll_loss = 2.3089, ivc_loss = 0.0711, neg_loss_1 = 0.0053, neg_loss_2 = 0.0039, ref_loss = 0.0210, intra_loss = 0.0260, div_loss = 0.0030, 0.127 seconds/batch
2025-05-14 13:38:28,060 - merge_alpha: 0.04287160933017731, range_width: 0.2161843180656433
2025-05-14 13:38:34,109 - | R@1,mIoU 0.4575 | R@1,IoU@0.1 0.7859 | R@1,IoU@0.3 0.6974 | R@1,IoU@0.5 0.5252 | R@1,IoU@0.7 0.2406 | R@1,IoU@0.9 0.0359 | R@5,mIoU 0.6880 | R@5,IoU@0.1 0.9926 | R@5,IoU@0.3 0.9738 | R@5,IoU@0.5 0.8579 | R@5,IoU@0.7 0.5449 | R@5,IoU@0.9 0.0824 |
2025-05-14 13:38:34,112 - ============================================================
2025-05-14 13:38:34,112 - Start Epoch 20
2025-05-14 13:38:41,156 - Epoch 20, Batch 50, lr = 0.00011, final_loss = 2.1128, nll_loss = 1.9753, ref_nll_loss = 2.2504, ivc_loss = 0.0454, neg_loss_1 = 0.0062, neg_loss_2 = 0.0043, ref_loss = 0.0208, intra_loss = 0.0023, div_loss = 0.0024, 0.141 seconds/batch
2025-05-14 13:38:47,357 - Epoch 20, Batch 100, lr = 0.00011, final_loss = 2.1185, nll_loss = 1.9837, ref_nll_loss = 2.2532, ivc_loss = 0.0414, neg_loss_1 = 0.0060, neg_loss_2 = 0.0029, ref_loss = 0.0206, intra_loss = 0.0001, div_loss = 0.0024, 0.132 seconds/batch
2025-05-14 13:38:53,568 - Epoch 20, Batch 150, lr = 0.00011, final_loss = 2.1448, nll_loss = 2.0076, ref_nll_loss = 2.2820, ivc_loss = 0.0431, neg_loss_1 = 0.0048, neg_loss_2 = 0.0033, ref_loss = 0.0222, intra_loss = 0.0000, div_loss = 0.0026, 0.130 seconds/batch
2025-05-14 13:38:59,798 - Epoch 20, Batch 200, lr = 0.00011, final_loss = 2.1428, nll_loss = 2.0017, ref_nll_loss = 2.2839, ivc_loss = 0.0411, neg_loss_1 = 0.0051, neg_loss_2 = 0.0032, ref_loss = 0.0183, intra_loss = 0.0023, div_loss = 0.0024, 0.128 seconds/batch
2025-05-14 13:39:05,874 - Epoch 20, Batch 250, lr = 0.00011, final_loss = 2.1634, nll_loss = 2.0245, ref_nll_loss = 2.3024, ivc_loss = 0.0399, neg_loss_1 = 0.0054, neg_loss_2 = 0.0037, ref_loss = 0.0189, intra_loss = 0.0000, div_loss = 0.0024, 0.127 seconds/batch
2025-05-14 13:39:06,980 - Epoch 20, Batch 259, lr = 0.00011, final_loss = 2.1135, nll_loss = 1.9796, ref_nll_loss = 2.2475, ivc_loss = 0.0401, neg_loss_1 = 0.0047, neg_loss_2 = 0.0040, ref_loss = 0.0206, intra_loss = 0.0000, div_loss = 0.0022, 0.127 seconds/batch
2025-05-14 13:39:06,982 - merge_alpha: 0.04184537008404732, range_width: 0.2087583988904953
2025-05-14 13:39:12,997 - | R@1,mIoU 0.4596 | R@1,IoU@0.1 0.7943 | R@1,IoU@0.3 0.7016 | R@1,IoU@0.5 0.5287 | R@1,IoU@0.7 0.2397 | R@1,IoU@0.9 0.0375 | R@5,mIoU 0.6856 | R@5,IoU@0.1 0.9922 | R@5,IoU@0.3 0.9732 | R@5,IoU@0.5 0.8517 | R@5,IoU@0.7 0.5439 | R@5,IoU@0.9 0.0807 |
2025-05-14 13:39:12,999 - ============================================================
2025-05-14 13:39:12,999 - Start Epoch 21
2025-05-14 13:39:19,981 - Epoch 21, Batch 50, lr = 0.00011, final_loss = 2.1170, nll_loss = 1.9803, ref_nll_loss = 2.2537, ivc_loss = 0.0412, neg_loss_1 = 0.0061, neg_loss_2 = 0.0047, ref_loss = 0.0191, intra_loss = 0.0000, div_loss = 0.0023, 0.140 seconds/batch
2025-05-14 13:39:26,198 - Epoch 21, Batch 100, lr = 0.00011, final_loss = 2.1112, nll_loss = 1.9727, ref_nll_loss = 2.2497, ivc_loss = 0.0452, neg_loss_1 = 0.0051, neg_loss_2 = 0.0039, ref_loss = 0.0197, intra_loss = 0.0001, div_loss = 0.0033, 0.132 seconds/batch
2025-05-14 13:39:32,403 - Epoch 21, Batch 150, lr = 0.00011, final_loss = 2.1357, nll_loss = 1.9999, ref_nll_loss = 2.2714, ivc_loss = 0.0487, neg_loss_1 = 0.0045, neg_loss_2 = 0.0037, ref_loss = 0.0225, intra_loss = 0.0001, div_loss = 0.0036, 0.129 seconds/batch
2025-05-14 13:39:38,596 - Epoch 21, Batch 200, lr = 0.00011, final_loss = 2.1132, nll_loss = 1.9760, ref_nll_loss = 2.2505, ivc_loss = 0.0408, neg_loss_1 = 0.0048, neg_loss_2 = 0.0023, ref_loss = 0.0203, intra_loss = 0.0000, div_loss = 0.0027, 0.128 seconds/batch
2025-05-14 13:39:44,671 - Epoch 21, Batch 250, lr = 0.00011, final_loss = 2.1361, nll_loss = 1.9986, ref_nll_loss = 2.2735, ivc_loss = 0.0444, neg_loss_1 = 0.0055, neg_loss_2 = 0.0043, ref_loss = 0.0209, intra_loss = 0.0000, div_loss = 0.0027, 0.127 seconds/batch
2025-05-14 13:39:45,777 - Epoch 21, Batch 259, lr = 0.00011, final_loss = 2.1419, nll_loss = 1.9987, ref_nll_loss = 2.2850, ivc_loss = 0.0429, neg_loss_1 = 0.0068, neg_loss_2 = 0.0034, ref_loss = 0.0200, intra_loss = 0.0000, div_loss = 0.0025, 0.127 seconds/batch
2025-05-14 13:39:45,779 - merge_alpha: 0.041841764003038406, range_width: 0.20129846036434174
2025-05-14 13:39:51,889 - | R@1,mIoU 0.4552 | R@1,IoU@0.1 0.7836 | R@1,IoU@0.3 0.6928 | R@1,IoU@0.5 0.5271 | R@1,IoU@0.7 0.2335 | R@1,IoU@0.9 0.0362 | R@5,mIoU 0.6846 | R@5,IoU@0.1 0.9926 | R@5,IoU@0.3 0.9696 | R@5,IoU@0.5 0.8521 | R@5,IoU@0.7 0.5401 | R@5,IoU@0.9 0.0769 |
2025-05-14 13:39:51,891 - ============================================================
2025-05-14 13:39:51,891 - Start Epoch 22
2025-05-14 13:39:58,893 - Epoch 22, Batch 50, lr = 0.00011, final_loss = 2.0780, nll_loss = 1.9413, ref_nll_loss = 2.2147, ivc_loss = 0.0395, neg_loss_1 = 0.0043, neg_loss_2 = 0.0028, ref_loss = 0.0198, intra_loss = 0.0010, div_loss = 0.0023, 0.140 seconds/batch
2025-05-14 13:40:05,105 - Epoch 22, Batch 100, lr = 0.00011, final_loss = 2.1186, nll_loss = 1.9786, ref_nll_loss = 2.2585, ivc_loss = 0.0418, neg_loss_1 = 0.0052, neg_loss_2 = 0.0029, ref_loss = 0.0225, intra_loss = 0.0000, div_loss = 0.0022, 0.132 seconds/batch
2025-05-14 13:40:11,324 - Epoch 22, Batch 150, lr = 0.00011, final_loss = 2.1023, nll_loss = 1.9638, ref_nll_loss = 2.2408, ivc_loss = 0.0441, neg_loss_1 = 0.0075, neg_loss_2 = 0.0038, ref_loss = 0.0196, intra_loss = 0.0000, div_loss = 0.0026, 0.130 seconds/batch
2025-05-14 13:40:17,540 - Epoch 22, Batch 200, lr = 0.00011, final_loss = 2.0892, nll_loss = 1.9491, ref_nll_loss = 2.2294, ivc_loss = 0.0422, neg_loss_1 = 0.0041, neg_loss_2 = 0.0026, ref_loss = 0.0199, intra_loss = 0.0036, div_loss = 0.0024, 0.128 seconds/batch
2025-05-14 13:40:23,628 - Epoch 22, Batch 250, lr = 0.00011, final_loss = 2.1351, nll_loss = 1.9943, ref_nll_loss = 2.2760, ivc_loss = 0.0457, neg_loss_1 = 0.0063, neg_loss_2 = 0.0039, ref_loss = 0.0208, intra_loss = 0.0000, div_loss = 0.0029, 0.127 seconds/batch
2025-05-14 13:40:24,739 - Epoch 22, Batch 259, lr = 0.00011, final_loss = 2.1359, nll_loss = 2.0064, ref_nll_loss = 2.2654, ivc_loss = 0.0502, neg_loss_1 = 0.0068, neg_loss_2 = 0.0031, ref_loss = 0.0265, intra_loss = 0.0001, div_loss = 0.0027, 0.127 seconds/batch
2025-05-14 13:40:24,742 - merge_alpha: 0.04196201264858246, range_width: 0.1933201551437378
2025-05-14 13:40:30,880 - | R@1,mIoU 0.4520 | R@1,IoU@0.1 0.7849 | R@1,IoU@0.3 0.6877 | R@1,IoU@0.5 0.5123 | R@1,IoU@0.7 0.2355 | R@1,IoU@0.9 0.0371 | R@5,mIoU 0.6897 | R@5,IoU@0.1 0.9942 | R@5,IoU@0.3 0.9761 | R@5,IoU@0.5 0.8563 | R@5,IoU@0.7 0.5481 | R@5,IoU@0.9 0.0898 |
2025-05-14 13:40:30,883 - ============================================================
2025-05-14 13:40:30,883 - Start Epoch 23
2025-05-14 13:40:37,850 - Epoch 23, Batch 50, lr = 0.00011, final_loss = 2.0734, nll_loss = 1.9395, ref_nll_loss = 2.2074, ivc_loss = 0.0417, neg_loss_1 = 0.0050, neg_loss_2 = 0.0033, ref_loss = 0.0216, intra_loss = 0.0000, div_loss = 0.0023, 0.139 seconds/batch
2025-05-14 13:40:44,032 - Epoch 23, Batch 100, lr = 0.00011, final_loss = 2.0848, nll_loss = 1.9427, ref_nll_loss = 2.2269, ivc_loss = 0.0373, neg_loss_1 = 0.0045, neg_loss_2 = 0.0025, ref_loss = 0.0184, intra_loss = 0.0000, div_loss = 0.0024, 0.131 seconds/batch
2025-05-14 13:40:50,215 - Epoch 23, Batch 150, lr = 0.00010, final_loss = 2.0898, nll_loss = 1.9524, ref_nll_loss = 2.2271, ivc_loss = 0.0464, neg_loss_1 = 0.0056, neg_loss_2 = 0.0036, ref_loss = 0.0219, intra_loss = 0.0025, div_loss = 0.0026, 0.129 seconds/batch
2025-05-14 13:40:56,414 - Epoch 23, Batch 200, lr = 0.00010, final_loss = 2.0728, nll_loss = 1.9312, ref_nll_loss = 2.2145, ivc_loss = 0.0393, neg_loss_1 = 0.0038, neg_loss_2 = 0.0039, ref_loss = 0.0192, intra_loss = 0.0000, div_loss = 0.0025, 0.128 seconds/batch
2025-05-14 13:41:02,500 - Epoch 23, Batch 250, lr = 0.00010, final_loss = 2.0975, nll_loss = 1.9622, ref_nll_loss = 2.2329, ivc_loss = 0.0459, neg_loss_1 = 0.0046, neg_loss_2 = 0.0036, ref_loss = 0.0230, intra_loss = 0.0023, div_loss = 0.0025, 0.126 seconds/batch
2025-05-14 13:41:03,602 - Epoch 23, Batch 259, lr = 0.00010, final_loss = 2.1743, nll_loss = 2.0218, ref_nll_loss = 2.3267, ivc_loss = 0.0377, neg_loss_1 = 0.0067, neg_loss_2 = 0.0018, ref_loss = 0.0155, intra_loss = 0.0000, div_loss = 0.0027, 0.126 seconds/batch
2025-05-14 13:41:03,605 - merge_alpha: 0.041767168790102005, range_width: 0.18463385105133057
2025-05-14 13:41:09,681 - | R@1,mIoU 0.4539 | R@1,IoU@0.1 0.7855 | R@1,IoU@0.3 0.6915 | R@1,IoU@0.5 0.5158 | R@1,IoU@0.7 0.2371 | R@1,IoU@0.9 0.0359 | R@5,mIoU 0.6885 | R@5,IoU@0.1 0.9929 | R@5,IoU@0.3 0.9706 | R@5,IoU@0.5 0.8582 | R@5,IoU@0.7 0.5488 | R@5,IoU@0.9 0.0866 |
2025-05-14 13:41:09,684 - ============================================================
2025-05-14 13:41:09,684 - Start Epoch 24
2025-05-14 13:41:16,697 - Epoch 24, Batch 50, lr = 0.00010, final_loss = 2.0618, nll_loss = 1.9287, ref_nll_loss = 2.1949, ivc_loss = 0.0409, neg_loss_1 = 0.0050, neg_loss_2 = 0.0024, ref_loss = 0.0209, intra_loss = 0.0000, div_loss = 0.0025, 0.140 seconds/batch
2025-05-14 13:41:22,919 - Epoch 24, Batch 100, lr = 0.00010, final_loss = 2.0800, nll_loss = 1.9422, ref_nll_loss = 2.2179, ivc_loss = 0.0416, neg_loss_1 = 0.0059, neg_loss_2 = 0.0040, ref_loss = 0.0188, intra_loss = 0.0000, div_loss = 0.0026, 0.132 seconds/batch
2025-05-14 13:41:29,159 - Epoch 24, Batch 150, lr = 0.00010, final_loss = 2.0870, nll_loss = 1.9489, ref_nll_loss = 2.2251, ivc_loss = 0.0430, neg_loss_1 = 0.0058, neg_loss_2 = 0.0038, ref_loss = 0.0213, intra_loss = 0.0000, div_loss = 0.0024, 0.130 seconds/batch
2025-05-14 13:41:35,411 - Epoch 24, Batch 200, lr = 0.00010, final_loss = 2.0765, nll_loss = 1.9355, ref_nll_loss = 2.2175, ivc_loss = 0.0465, neg_loss_1 = 0.0052, neg_loss_2 = 0.0030, ref_loss = 0.0223, intra_loss = 0.0000, div_loss = 0.0032, 0.129 seconds/batch
2025-05-14 13:41:41,502 - Epoch 24, Batch 250, lr = 0.00010, final_loss = 2.0380, nll_loss = 1.8970, ref_nll_loss = 2.1790, ivc_loss = 0.0415, neg_loss_1 = 0.0049, neg_loss_2 = 0.0043, ref_loss = 0.0206, intra_loss = 0.0000, div_loss = 0.0024, 0.127 seconds/batch
2025-05-14 13:41:42,610 - Epoch 24, Batch 259, lr = 0.00010, final_loss = 2.0687, nll_loss = 1.9232, ref_nll_loss = 2.2143, ivc_loss = 0.0459, neg_loss_1 = 0.0078, neg_loss_2 = 0.0027, ref_loss = 0.0209, intra_loss = 0.0000, div_loss = 0.0029, 0.127 seconds/batch
2025-05-14 13:41:42,612 - merge_alpha: 0.04147595912218094, range_width: 0.17909401655197144
2025-05-14 13:41:48,737 - | R@1,mIoU 0.4513 | R@1,IoU@0.1 0.7865 | R@1,IoU@0.3 0.6886 | R@1,IoU@0.5 0.5139 | R@1,IoU@0.7 0.2297 | R@1,IoU@0.9 0.0346 | R@5,mIoU 0.6837 | R@5,IoU@0.1 0.9916 | R@5,IoU@0.3 0.9722 | R@5,IoU@0.5 0.8547 | R@5,IoU@0.7 0.5294 | R@5,IoU@0.9 0.0814 |
2025-05-14 13:41:48,739 - ============================================================
2025-05-14 13:41:48,739 - Start Epoch 25
2025-05-14 13:41:55,720 - Epoch 25, Batch 50, lr = 0.00010, final_loss = 2.0556, nll_loss = 1.9178, ref_nll_loss = 2.1934, ivc_loss = 0.0374, neg_loss_1 = 0.0035, neg_loss_2 = 0.0033, ref_loss = 0.0187, intra_loss = 0.0000, div_loss = 0.0024, 0.140 seconds/batch
2025-05-14 13:42:01,920 - Epoch 25, Batch 100, lr = 0.00010, final_loss = 2.0513, nll_loss = 1.9095, ref_nll_loss = 2.1931, ivc_loss = 0.0427, neg_loss_1 = 0.0044, neg_loss_2 = 0.0036, ref_loss = 0.0197, intra_loss = 0.0028, div_loss = 0.0024, 0.132 seconds/batch
2025-05-14 13:42:08,107 - Epoch 25, Batch 150, lr = 0.00010, final_loss = 2.0755, nll_loss = 1.9372, ref_nll_loss = 2.2137, ivc_loss = 0.0412, neg_loss_1 = 0.0058, neg_loss_2 = 0.0031, ref_loss = 0.0199, intra_loss = 0.0000, div_loss = 0.0025, 0.129 seconds/batch
2025-05-14 13:42:14,304 - Epoch 25, Batch 200, lr = 0.00010, final_loss = 2.0193, nll_loss = 1.8811, ref_nll_loss = 2.1575, ivc_loss = 0.0425, neg_loss_1 = 0.0059, neg_loss_2 = 0.0037, ref_loss = 0.0208, intra_loss = 0.0000, div_loss = 0.0024, 0.128 seconds/batch
2025-05-14 13:42:20,382 - Epoch 25, Batch 250, lr = 0.00010, final_loss = 2.0637, nll_loss = 1.9234, ref_nll_loss = 2.2040, ivc_loss = 0.0399, neg_loss_1 = 0.0050, neg_loss_2 = 0.0031, ref_loss = 0.0206, intra_loss = 0.0000, div_loss = 0.0022, 0.127 seconds/batch
2025-05-14 13:42:21,484 - Epoch 25, Batch 259, lr = 0.00010, final_loss = 2.0230, nll_loss = 1.8773, ref_nll_loss = 2.1687, ivc_loss = 0.0334, neg_loss_1 = 0.0019, neg_loss_2 = 0.0029, ref_loss = 0.0176, intra_loss = 0.0000, div_loss = 0.0022, 0.126 seconds/batch
2025-05-14 13:42:21,487 - merge_alpha: 0.04170581325888634, range_width: 0.1707567423582077
2025-05-14 13:42:27,491 - | R@1,mIoU 0.4521 | R@1,IoU@0.1 0.7810 | R@1,IoU@0.3 0.6935 | R@1,IoU@0.5 0.5120 | R@1,IoU@0.7 0.2355 | R@1,IoU@0.9 0.0362 | R@5,mIoU 0.6869 | R@5,IoU@0.1 0.9932 | R@5,IoU@0.3 0.9738 | R@5,IoU@0.5 0.8543 | R@5,IoU@0.7 0.5420 | R@5,IoU@0.9 0.0879 |
2025-05-14 13:42:27,494 - ============================================================
2025-05-14 13:42:27,494 - Start Epoch 26
2025-05-14 13:42:34,502 - Epoch 26, Batch 50, lr = 0.00010, final_loss = 2.0167, nll_loss = 1.8778, ref_nll_loss = 2.1557, ivc_loss = 0.0372, neg_loss_1 = 0.0036, neg_loss_2 = 0.0027, ref_loss = 0.0197, intra_loss = 0.0000, div_loss = 0.0022, 0.140 seconds/batch
2025-05-14 13:42:40,790 - Epoch 26, Batch 100, lr = 0.00010, final_loss = 2.0247, nll_loss = 1.8850, ref_nll_loss = 2.1645, ivc_loss = 0.0433, neg_loss_1 = 0.0052, neg_loss_2 = 0.0036, ref_loss = 0.0220, intra_loss = 0.0000, div_loss = 0.0025, 0.133 seconds/batch
2025-05-14 13:42:46,993 - Epoch 26, Batch 150, lr = 0.00010, final_loss = 2.0499, nll_loss = 1.9054, ref_nll_loss = 2.1944, ivc_loss = 0.0394, neg_loss_1 = 0.0041, neg_loss_2 = 0.0040, ref_loss = 0.0193, intra_loss = 0.0000, div_loss = 0.0024, 0.130 seconds/batch
2025-05-14 13:42:53,202 - Epoch 26, Batch 200, lr = 0.00010, final_loss = 2.0472, nll_loss = 1.9066, ref_nll_loss = 2.1878, ivc_loss = 0.0376, neg_loss_1 = 0.0036, neg_loss_2 = 0.0025, ref_loss = 0.0203, intra_loss = 0.0000, div_loss = 0.0022, 0.129 seconds/batch
2025-05-14 13:42:59,280 - Epoch 26, Batch 250, lr = 0.00010, final_loss = 2.0406, nll_loss = 1.9013, ref_nll_loss = 2.1798, ivc_loss = 0.0443, neg_loss_1 = 0.0044, neg_loss_2 = 0.0028, ref_loss = 0.0223, intra_loss = 0.0015, div_loss = 0.0027, 0.127 seconds/batch
2025-05-14 13:43:00,400 - Epoch 26, Batch 259, lr = 0.00010, final_loss = 2.0549, nll_loss = 1.9129, ref_nll_loss = 2.1969, ivc_loss = 0.0423, neg_loss_1 = 0.0031, neg_loss_2 = 0.0023, ref_loss = 0.0245, intra_loss = 0.0000, div_loss = 0.0025, 0.127 seconds/batch
2025-05-14 13:43:00,403 - merge_alpha: 0.04160187020897865, range_width: 0.1628975123167038
2025-05-14 13:43:06,431 - | R@1,mIoU 0.4546 | R@1,IoU@0.1 0.7897 | R@1,IoU@0.3 0.6935 | R@1,IoU@0.5 0.5149 | R@1,IoU@0.7 0.2377 | R@1,IoU@0.9 0.0368 | R@5,mIoU 0.6869 | R@5,IoU@0.1 0.9935 | R@5,IoU@0.3 0.9729 | R@5,IoU@0.5 0.8511 | R@5,IoU@0.7 0.5472 | R@5,IoU@0.9 0.0862 |
2025-05-14 13:43:06,434 - ============================================================
2025-05-14 13:43:06,434 - Start Epoch 27
2025-05-14 13:43:13,447 - Epoch 27, Batch 50, lr = 0.00010, final_loss = 2.0111, nll_loss = 1.8706, ref_nll_loss = 2.1515, ivc_loss = 0.0395, neg_loss_1 = 0.0055, neg_loss_2 = 0.0034, ref_loss = 0.0193, intra_loss = 0.0000, div_loss = 0.0023, 0.140 seconds/batch
2025-05-14 13:43:19,645 - Epoch 27, Batch 100, lr = 0.00010, final_loss = 1.9938, nll_loss = 1.8525, ref_nll_loss = 2.1352, ivc_loss = 0.0388, neg_loss_1 = 0.0046, neg_loss_2 = 0.0026, ref_loss = 0.0191, intra_loss = 0.0000, div_loss = 0.0025, 0.132 seconds/batch
2025-05-14 13:43:25,838 - Epoch 27, Batch 150, lr = 0.00010, final_loss = 2.0162, nll_loss = 1.8735, ref_nll_loss = 2.1589, ivc_loss = 0.0408, neg_loss_1 = 0.0039, neg_loss_2 = 0.0035, ref_loss = 0.0197, intra_loss = 0.0015, div_loss = 0.0024, 0.129 seconds/batch
2025-05-14 13:43:32,035 - Epoch 27, Batch 200, lr = 0.00010, final_loss = 2.0245, nll_loss = 1.8844, ref_nll_loss = 2.1646, ivc_loss = 0.0394, neg_loss_1 = 0.0040, neg_loss_2 = 0.0021, ref_loss = 0.0216, intra_loss = 0.0000, div_loss = 0.0023, 0.128 seconds/batch
2025-05-14 13:43:38,092 - Epoch 27, Batch 250, lr = 0.00010, final_loss = 2.0393, nll_loss = 1.8957, ref_nll_loss = 2.1829, ivc_loss = 0.0432, neg_loss_1 = 0.0040, neg_loss_2 = 0.0030, ref_loss = 0.0207, intra_loss = 0.0000, div_loss = 0.0031, 0.127 seconds/batch
2025-05-14 13:43:39,195 - Epoch 27, Batch 259, lr = 0.00010, final_loss = 2.0206, nll_loss = 1.8826, ref_nll_loss = 2.1585, ivc_loss = 0.0440, neg_loss_1 = 0.0068, neg_loss_2 = 0.0030, ref_loss = 0.0229, intra_loss = 0.0000, div_loss = 0.0023, 0.126 seconds/batch
2025-05-14 13:43:39,198 - merge_alpha: 0.041271764785051346, range_width: 0.15588797628879547
2025-05-14 13:43:45,332 - | R@1,mIoU 0.4546 | R@1,IoU@0.1 0.7875 | R@1,IoU@0.3 0.6951 | R@1,IoU@0.5 0.5161 | R@1,IoU@0.7 0.2361 | R@1,IoU@0.9 0.0381 | R@5,mIoU 0.6848 | R@5,IoU@0.1 0.9926 | R@5,IoU@0.3 0.9693 | R@5,IoU@0.5 0.8547 | R@5,IoU@0.7 0.5388 | R@5,IoU@0.9 0.0801 |
2025-05-14 13:43:45,334 - ============================================================
2025-05-14 13:43:45,334 - Start Epoch 28
2025-05-14 13:43:52,355 - Epoch 28, Batch 50, lr = 0.00010, final_loss = 1.9596, nll_loss = 1.8221, ref_nll_loss = 2.0972, ivc_loss = 0.0365, neg_loss_1 = 0.0036, neg_loss_2 = 0.0031, ref_loss = 0.0192, intra_loss = 0.0000, div_loss = 0.0021, 0.140 seconds/batch
2025-05-14 13:43:58,559 - Epoch 28, Batch 100, lr = 0.00009, final_loss = 2.0143, nll_loss = 1.8689, ref_nll_loss = 2.1597, ivc_loss = 0.0367, neg_loss_1 = 0.0030, neg_loss_2 = 0.0019, ref_loss = 0.0193, intra_loss = 0.0014, div_loss = 0.0022, 0.132 seconds/batch
2025-05-14 13:44:04,769 - Epoch 28, Batch 150, lr = 0.00009, final_loss = 1.9825, nll_loss = 1.8426, ref_nll_loss = 2.1225, ivc_loss = 0.0383, neg_loss_1 = 0.0042, neg_loss_2 = 0.0036, ref_loss = 0.0182, intra_loss = 0.0000, div_loss = 0.0025, 0.130 seconds/batch
2025-05-14 13:44:11,073 - Epoch 28, Batch 200, lr = 0.00009, final_loss = 2.0115, nll_loss = 1.8733, ref_nll_loss = 2.1498, ivc_loss = 0.0409, neg_loss_1 = 0.0047, neg_loss_2 = 0.0028, ref_loss = 0.0219, intra_loss = 0.0000, div_loss = 0.0023, 0.129 seconds/batch
2025-05-14 13:44:17,176 - Epoch 28, Batch 250, lr = 0.00009, final_loss = 2.0127, nll_loss = 1.8682, ref_nll_loss = 2.1571, ivc_loss = 0.0394, neg_loss_1 = 0.0042, neg_loss_2 = 0.0025, ref_loss = 0.0207, intra_loss = 0.0010, div_loss = 0.0022, 0.127 seconds/batch
2025-05-14 13:44:18,292 - Epoch 28, Batch 259, lr = 0.00009, final_loss = 2.0239, nll_loss = 1.8799, ref_nll_loss = 2.1680, ivc_loss = 0.0419, neg_loss_1 = 0.0020, neg_loss_2 = 0.0035, ref_loss = 0.0230, intra_loss = 0.0000, div_loss = 0.0027, 0.127 seconds/batch
2025-05-14 13:44:18,294 - merge_alpha: 0.041280049830675125, range_width: 0.14707209169864655
2025-05-14 13:44:24,359 - | R@1,mIoU 0.4478 | R@1,IoU@0.1 0.7765 | R@1,IoU@0.3 0.6860 | R@1,IoU@0.5 0.5023 | R@1,IoU@0.7 0.2332 | R@1,IoU@0.9 0.0397 | R@5,mIoU 0.6857 | R@5,IoU@0.1 0.9926 | R@5,IoU@0.3 0.9709 | R@5,IoU@0.5 0.8505 | R@5,IoU@0.7 0.5381 | R@5,IoU@0.9 0.0882 |
2025-05-14 13:44:24,362 - ============================================================
2025-05-14 13:44:24,362 - Start Epoch 29
2025-05-14 13:44:31,402 - Epoch 29, Batch 50, lr = 0.00009, final_loss = 1.9709, nll_loss = 1.8312, ref_nll_loss = 2.1106, ivc_loss = 0.0392, neg_loss_1 = 0.0045, neg_loss_2 = 0.0032, ref_loss = 0.0189, intra_loss = 0.0001, div_loss = 0.0025, 0.141 seconds/batch
2025-05-14 13:44:37,691 - Epoch 29, Batch 100, lr = 0.00009, final_loss = 1.9800, nll_loss = 1.8408, ref_nll_loss = 2.1191, ivc_loss = 0.0390, neg_loss_1 = 0.0039, neg_loss_2 = 0.0022, ref_loss = 0.0212, intra_loss = 0.0000, div_loss = 0.0023, 0.133 seconds/batch
2025-05-14 13:44:43,891 - Epoch 29, Batch 150, lr = 0.00009, final_loss = 1.9702, nll_loss = 1.8295, ref_nll_loss = 2.1109, ivc_loss = 0.0378, neg_loss_1 = 0.0045, neg_loss_2 = 0.0020, ref_loss = 0.0204, intra_loss = 0.0000, div_loss = 0.0022, 0.130 seconds/batch
2025-05-14 13:44:50,115 - Epoch 29, Batch 200, lr = 0.00009, final_loss = 1.9811, nll_loss = 1.8365, ref_nll_loss = 2.1257, ivc_loss = 0.0385, neg_loss_1 = 0.0048, neg_loss_2 = 0.0027, ref_loss = 0.0192, intra_loss = 0.0000, div_loss = 0.0024, 0.129 seconds/batch
2025-05-14 13:44:56,194 - Epoch 29, Batch 250, lr = 0.00009, final_loss = 2.0029, nll_loss = 1.8591, ref_nll_loss = 2.1466, ivc_loss = 0.0374, neg_loss_1 = 0.0032, neg_loss_2 = 0.0038, ref_loss = 0.0191, intra_loss = 0.0000, div_loss = 0.0023, 0.127 seconds/batch
2025-05-14 13:44:57,299 - Epoch 29, Batch 259, lr = 0.00009, final_loss = 2.0571, nll_loss = 1.9061, ref_nll_loss = 2.2080, ivc_loss = 0.0325, neg_loss_1 = 0.0021, neg_loss_2 = 0.0012, ref_loss = 0.0173, intra_loss = 0.0000, div_loss = 0.0024, 0.127 seconds/batch
2025-05-14 13:44:57,302 - merge_alpha: 0.04132680594921112, range_width: 0.14161795377731323
2025-05-14 13:45:03,352 - | R@1,mIoU 0.4479 | R@1,IoU@0.1 0.7794 | R@1,IoU@0.3 0.6893 | R@1,IoU@0.5 0.5068 | R@1,IoU@0.7 0.2274 | R@1,IoU@0.9 0.0368 | R@5,mIoU 0.6829 | R@5,IoU@0.1 0.9922 | R@5,IoU@0.3 0.9690 | R@5,IoU@0.5 0.8424 | R@5,IoU@0.7 0.5381 | R@5,IoU@0.9 0.0862 |
2025-05-14 13:45:03,355 - ============================================================
2025-05-14 13:45:03,355 - Start Epoch 30
2025-05-14 13:45:10,323 - Epoch 30, Batch 50, lr = 0.00009, final_loss = 1.9556, nll_loss = 1.8144, ref_nll_loss = 2.0967, ivc_loss = 0.0388, neg_loss_1 = 0.0039, neg_loss_2 = 0.0025, ref_loss = 0.0204, intra_loss = 0.0000, div_loss = 0.0024, 0.139 seconds/batch
2025-05-14 13:45:16,513 - Epoch 30, Batch 100, lr = 0.00009, final_loss = 1.9635, nll_loss = 1.8193, ref_nll_loss = 2.1077, ivc_loss = 0.0373, neg_loss_1 = 0.0045, neg_loss_2 = 0.0023, ref_loss = 0.0195, intra_loss = 0.0000, div_loss = 0.0022, 0.132 seconds/batch
2025-05-14 13:45:22,713 - Epoch 30, Batch 150, lr = 0.00009, final_loss = 1.9665, nll_loss = 1.8230, ref_nll_loss = 2.1099, ivc_loss = 0.0369, neg_loss_1 = 0.0041, neg_loss_2 = 0.0028, ref_loss = 0.0188, intra_loss = 0.0000, div_loss = 0.0023, 0.129 seconds/batch
2025-05-14 13:45:28,904 - Epoch 30, Batch 200, lr = 0.00009, final_loss = 1.9720, nll_loss = 1.8325, ref_nll_loss = 2.1115, ivc_loss = 0.0429, neg_loss_1 = 0.0045, neg_loss_2 = 0.0024, ref_loss = 0.0224, intra_loss = 0.0014, div_loss = 0.0025, 0.128 seconds/batch
2025-05-14 13:45:34,983 - Epoch 30, Batch 250, lr = 0.00009, final_loss = 1.9920, nll_loss = 1.8436, ref_nll_loss = 2.1404, ivc_loss = 0.0370, neg_loss_1 = 0.0039, neg_loss_2 = 0.0023, ref_loss = 0.0190, intra_loss = 0.0001, div_loss = 0.0023, 0.127 seconds/batch
2025-05-14 13:45:36,087 - Epoch 30, Batch 259, lr = 0.00009, final_loss = 1.9811, nll_loss = 1.8365, ref_nll_loss = 2.1257, ivc_loss = 0.0399, neg_loss_1 = 0.0034, neg_loss_2 = 0.0044, ref_loss = 0.0184, intra_loss = 0.0000, div_loss = 0.0028, 0.126 seconds/batch
2025-05-14 13:45:36,090 - merge_alpha: 0.040859755128622055, range_width: 0.13465161621570587
2025-05-14 13:45:42,210 - | R@1,mIoU 0.4493 | R@1,IoU@0.1 0.7836 | R@1,IoU@0.3 0.6893 | R@1,IoU@0.5 0.5078 | R@1,IoU@0.7 0.2326 | R@1,IoU@0.9 0.0359 | R@5,mIoU 0.6866 | R@5,IoU@0.1 0.9939 | R@5,IoU@0.3 0.9722 | R@5,IoU@0.5 0.8514 | R@5,IoU@0.7 0.5468 | R@5,IoU@0.9 0.0908 |
2025-05-14 13:45:42,213 - ============================================================
2025-05-14 13:45:42,213 - Best results:
2025-05-14 13:45:42,213 - | R@1,mIoU 0.4712 | R@1,IoU@0.1 0.7955 | R@1,IoU@0.3 0.7087 | R@1,IoU@0.5 0.5484 | R@1,IoU@0.7 0.2668 | R@1,IoU@0.9 0.0436 | R@5,mIoU 0.6919 | R@5,IoU@0.1 0.9955 | R@5,IoU@0.3 0.9800 | R@5,IoU@0.5 0.8608 | R@5,IoU@0.7 0.5433 | R@5,IoU@0.9 0.0972 |
